Sheet: Weekly Payroll Report
B1: WEEKLY PAYROLL REPORT | AO1: American National Skyline, Inc.
S2: VOL: | U2: of:=[Summary.AD38] -> 26807.6 | Y2: PAY: | AA2: of:=[Summary.X38] -> 7865 | AD2: PROD: | AG2: of:=[.AA2]/[.U2] -> 0.293386949969412
B3: DIVISION : | I3: 19 | L3: Operations Manager : | V3: Rhett Winford | AL3: WEEK ENDING : | AM3: 2021-09-24
B5: EMPLOYEE | F5: of:=[.J5]-1 -> 2021-09-18 | J5: of:=[.N5]-1 -> 2021-09-19 | N5: of:=[.R5]-1 -> 2021-09-20 | R5: of:=[.V5]-1 -> 2021-09-21 | V5: of:=[.Z5]-1 -> 2021-09-22 | Z5: of:=[.AD5]-1 -> 2021-09-23 | AD5: of:=[.AM3] -> 2021-09-24 | AH5: REGULAR$ & VACATION$ | AK5: O.T$. & HOLIDAY$ | AM5: TOTAL$ & EXPENSES$ | AW5: Row | AY5: Employee Name | BA5: Reg Hrs | BC5: Reg Pay | BE5: Expenses | BG5: OT Hrs | BI5: OT Pay | BK5: Vac Hrs | BM5: Vac Pay | BO5: Hol Hrs | BQ5: Hol Pay | BS5: Gross | BU5: Expenses Submitted | BW5: Expenses Allowed | BY5: VOL | CA5: D/L | CC5: Reg Pay + Expenses
B6: Baxter, Brian | E6: HRS : | N6: 10 | R6: 8.5 | V6: 10 | Z6: 8 | AD6: 3.5 | AE6: 7 | AH6: of:=IF([.BC6]>0; [.BC6];"") -> 889.009900990099 | AK6: of:=[.BI6] -> 235.990099009901 | AM6: of:=[.BS6] -> 1135 | AW6: of:=[.E10] -> 1 | AY6: of:=[.B6] -> Baxter, Brian | BA6: of:=[.$F6]+[.$J6]+[.$N6]+[.$R6]+[.$V6]+[.$Z6]+[.$AD6] -> 40 | BC6: of:=IF([.$BG6]=0;[.$CA6]; IF([.$BG6]>0; [.$CA6]/([.$BA6]+([.$BG6]*1.5)))*[.$BA6])-[.$BE6] -> 889.009900990099 | BE6: of:=[.BU6] -> 10 | BG6: of:=[.$G6]+[.$K6]+[.$O6]+[.$S6]+[.$W6]+[.$AA6]+[.$AE6] -> 7 | BI6: of:=IF([.$BA6]>0;[.$BG6]*[.$CA6]/([.$BA6]+([.$BG6]*1.5))*1.5;0) -> 235.990099009901 | BK6: of:=[.$H6]+[.$L6]+[.$P6]+[.$T6]+[.$X6]+[.$AB6]+[.$AF6] -> 0 | BM6: of:=[.$BK6]*([.$AR8]/8) -> 0 | BO6: of:=[.$I6]+[.$M6]+[.$Q6]+[.$U6]+[.$Y6]+[.$AC6]+[.$AG6] -> 0 | BQ6: of:=[.$BO6]*([.$AR11]/8) -> 0 | BS6: of:=[.$BC6]+[.$BI6]+[.$BM6]+[.$BQ6]+[.$BE6] -> 1135 | BU6: of:=[.$AM10] -> 10 | BW6: of:=IF([.$BU6] <= [.$CA6]* 0.2; [.$BU6]; [.$CA6]* 0.25) -> 10 | BY6: of:=SUM([.$F12:.$AD12]) -> 4214.5 | CA6: of:=VALUE([.F13])+VALUE([.J13])+VALUE([.N13])+VALUE([.R13])+VALUE([.V13])+VALUE([.Z13])+VALUE([.AD13]) -> 1135 | CC6: of:=[.BC6]+[.BE6] -> 899.009900990099
F7: R | G7: O | H7: V | I7: H | J7: R | K7: O | L7: V | M7: H | N7: R | O7: O | P7: V | Q7: H | R7: R | S7: O | T7: V | U7: H | V7: R | W7: O | X7: V | Y7: H | Z7: R | AA7: O | AB7: V | AC7: H | AD7: R | AE7: O | AF7: V | AG7: H | AR7: VACATION RATE
E8: ROW # | N8: Residential and Hopedale | R8: Hopedale | V8: Carle North Clinic | Z8: Carle North Clinic | AD8: Cullinan Property | AH8: of:=IF([.AH6]>0;CONCATENATE(TEXT([.CC6];"####.##");"-Expense");"") -> 899.01-Expense
AH9: VACATION | AK9: HOLIDAY | AM9: EXPENSES
E10: 1 | AH10: of:=IF([.BK6]>0; IF([.AR8]>0;[.BM6]; "ENTER RATE >");0) -> 0 | AK10: of:=IF([.BO6]>0; IF([.AR11]>0;[.BQ6]; "ENTER RATE >");0) -> 0 | AM10: 10 | AR10: HOLIDAY RATE
E12: VOL | F12: 0 | J12: of:=['Work Log'.I13] -> 0 | N12: 791.25 | R12: 791.25 | V12: 923 | Z12: 625 | AD12: 1084 | AH12: of:=[.BY6] -> 4214.5 | AK12: of:=CONCATENATE("REG = ";[.BA6]) -> REG = 40 | AL12: of:=CONCATENATE("OT = "; [.BG6]) -> OT = 7 | AM12: Prod % = | AN12: of:=[.AM6]/[.AH12] -> 0.269308340253885
E13: D/L | F13: of:=IF([.F12]>0;[.F12]*0.3;0) -> 0 | J13: of:=IF([.J12]>0;[.J12]*0.3;0) -> 0 | N13: 225 | R13: 225 | V13: 225 | Z13: 190 | AD13: 270 | AH13: of:=SUM([.F13:.AD13]) -> 1135 | AK13: of:=CONCATENATE("VAC = ";[.BK6]) -> VAC = 0 | AL13: of:=CONCATENATE("HOL = "; [.BO6]) -> HOL = 0
B14: Fonseca, Jonathan Colon | E14: HRS : | N14: 7 | R14: 7.5 | V14: 10.5 | Z14: 13 | AD14: 2 | AE14: 6.5 | AH14: of:=[.BC14] -> 828.190954773869 | AK14: of:=[.BI14] -> 204.309045226131 | AM14: of:=[.BS14] -> 1042.5 | AW14: of:=[.E18] -> 2 | AY14: of:=[.B14] -> Fonseca, Jonathan Colon | BA14: of:=[.$F14]+[.$J14]+[.$N14]+[.$R14]+[.$V14]+[.$Z14]+[.$AD14] -> 40 | BC14: of:=IF([.$BG14]=0;[.$CA14]; IF([.$BG14]>0; [.$CA14]/([.$BA14]+([.$BG14]*1.5)))*[.$BA14])-[.$BE14] -> 828.190954773869 | BE14: of:=[.BU14] -> 10 | BG14: of:=[.$G14]+[.$K14]+[.$O14]+[.$S14]+[.$W14]+[.$AA14]+[.$AE14] -> 6.5 | BI14: of:=IF([.$BA14]>0;[.$BG14]*[.$CA14]/([.$BA14]+([.$BG14]*1.5))*1.5;0) -> 204.309045226131 | BK14: of:=[.$H14]+[.$L14]+[.$P14]+[.$T14]+[.$X14]+[.$AB14]+[.$AF14] -> 0 | BM14: of:=[.$BK14]*([.$AR16]/8) -> 0 | BO14: of:=[.$I14]+[.$M14]+[.$Q14]+[.$U14]+[.$Y14]+[.$AC14]+[.$AG14] -> 0 | BQ14: of:=[.$BO14]*([.$AR19]/8) -> 0 | BS14: of:=[.$BC14]+[.$BI14]+[.$BM14]+[.$BQ14]+[.$BE14] -> 1042.5 | BU14: of:=[.$AM18] -> 10 | BW14: of:=IF([.$BU14] <= [.$CA14]* 0.2; [.$BU14]; [.$CA14]* 0.2) -> 10 | BY14: of:=SUM([.$F20:.$AD20]) -> 3957.5 | CA14: of:=SUM([.$F21:.$AD21]) -> 1042.5 | CC14: of:=[.BC14]+[.BE14] -> 838.190954773869
F15: R | G15: O | H15: V | I15: H | J15: R | K15: O | L15: V | M15: H | N15: R | O15: O | P15: V | Q15: H | R15: R | S15: O | T15: V | U15: H | V15: R | W15: O | X15: V | Y15: H | Z15: R | AA15: O | AB15: V | AC15: H | AD15: R | AE15: O | AF15: V | AG15: H | AR15: VACATION RATE
E16: ROW # | F16: Incomplete from previous week | N16: Carle | R16: Hopedale | V16: Carle North Clinic | Z16: OSF Rte 91 | AD16: Cullinan Property | AH16: of:=IF([.AH14]>0;CONCATENATE(TEXT([.CC14];"####.##");"-Expense");"") -> 838.19-Expense
AH17: VACATION | AK17: HOLIDAY | AM17: EXPENSES
E18: of:=[.E10]+1 -> 2 | AH18: of:=IF([.BK14]>0; IF([.AR16]>0;[.BM14]; "ENTER VACATION RATE IN THE VACATION RATE FIELD ==>");0) -> 0 | AK18: of:=IF([.BO14]>0; IF([.AR19]>0;[.BQ14]; "ENTER HOLIDAY RATE IN THE HOLIDAY RATE FIELD ==>");0) -> 0 | AM18: 10 | AR18: HOLIDAY RATE
E20: VOL | F20: -84 | J20: 0 | N20: 509.75 | R20: 573.75 | V20: 625 | Z20: 1250 | AD20: 1083 | AH20: of:=[.BY14] -> 3957.5 | AK20: of:=CONCATENATE("REG = ";[.BA14]) -> REG = 40 | AL20: of:=CONCATENATE("OT = "; [.BG14]) -> OT = 6.5 | AM20: Prod % = | AN20: of:=[.AM14]/[.AH20] -> 0.263423878711308
E21: D/L | F21: 0 | J21: 0 | N21: 100 | R21: 175 | V21: 185 | Z21: 312.5 | AD21: 270 | AH21: of:=SUM([.F21:.AD21]) -> 1042.5 | AK21: of:=CONCATENATE("VAC = ";[.BK14]) -> VAC = 0 | AL21: of:=CONCATENATE("HOL = "; [.BO14]) -> HOL = 0
B22: Rigdon, Chad | E22: HRS : | N22: 8 | R22: 8 | V22: 8 | Z22: 7 | AD22: 8 | AH22: of:=IF([.BC22]>0; [.BC22];"") -> 1090 | AK22: of:=[.BI22] -> 0 | AM22: of:=[.BS22] -> 1100 | AW22: of:=[.E26] -> 3 | AY22: of:=[.B22] -> Rigdon, Chad | BA22: of:=[.$F22]+[.$J22]+[.$N22]+[.$R22]+[.$V22]+[.$Z22]+[.$AD22] -> 39 | BC22: of:=IF([.$BG22]=0;[.$CA22]; IF([.$BG22]>0; [.$CA22]/([.$BA22]+([.$BG22]*1.5)))*[.$BA22])-[.$BE22] -> 1090 | BE22: of:=[.BU22] -> 10 | BG22: of:=[.$G22]+[.$K22]+[.$O22]+[.$S22]+[.$W22]+[.$AA22]+[.$AE22] -> 0 | BI22: of:=IF([.$BA22]>0;[.$BG22]*[.$CA22]/([.$BA22]+([.$BG22]*1.5))*1.5;0) -> 0 | BK22: of:=[.$H22]+[.$L22]+[.$P22]+[.$T22]+[.$X22]+[.$AB22]+[.$AF22] -> 0 | BM22: of:=[.$BK22]*([.$AR24]/8) -> 0 | BO22: of:=[.$I22]+[.$M22]+[.$Q22]+[.$U22]+[.$Y22]+[.$AC22]+[.$AG22] -> 0 | BQ22: of:=[.$BO22]*([.$AR27]/8) -> 0 | BS22: of:=[.$BC22]+[.$BI22]+[.$BM22]+[.$BQ22]+[.$BE22] -> 1100 | BU22: of:=[.$AM26] -> 10 | BW22: of:=IF([.$BU22] <= [.$CA22]* 0.25; [.$BU22]; [.$CA22]* 0.25) -> 10 | BY22: of:=SUM([.$F28:.$AD28]) -> 3750 | CA22: of:=SUM([.$F29:.$AD29]) -> 1100 | CC22: of:=[.BC22]+[.BE22] -> 1100
F23: R | G23: O | H23: V | I23: H | J23: R | K23: O | L23: V | M23: H | N23: R | O23: O | P23: V | Q23: H | R23: R | S23: O | T23: V | U23: H | V23: R | W23: O | X23: V | Y23: H | Z23: R | AA23: O | AB23: V | AC23: H | AD23: R | AE23: O | AF23: V | AG23: H | AR23: VACATION RATE
E24: ROW # | N24: State Farm | R24: State Farm | V24: State Farm | Z24: State Farm and Residential | AD24: State Farm | AH24: of:=IF([.AH22]>0;CONCATENATE(TEXT([.CC22];"####.##");"-Expense");"") -> 1100-Expense
AH25: VACATION | AK25: HOLIDAY | AM25: EXPENSES
E26: of:=[.E18]+1 -> 3 | AH26: of:=IF([.BK22]>0; IF([.AR24]>0;[.BM22]; "ENTER RATE >");0) -> 0 | AK26: of:=IF([.BO22]>0; IF([.AR27]>0;[.BQ22]; "ENTER RATE >");0) -> 0 | AM26: 10 | AR26: HOLIDAY RATE
E28: VOL | F28: of:=['Work Log'.E31] -> 0 | J28: of:=['Work Log'.I31] -> 0 | N28: 750 | R28: 750 | V28: 750 | Z28: 750 | AD28: 750 | AH28: of:=[.BY22] -> 3750 | AK28: of:=CONCATENATE("REG = ";[.BA22]) -> REG = 39 | AL28: of:=CONCATENATE("OT = "; [.BG22]) -> OT = 0 | AM28: Prod % = | AN28: of:=[.AM22]/[.AH28] -> 0.293333333333333
E29: D/L | F29: of:=IF([.F28];[.F28]*0.3;"") ->  | J29: of:=IF([.J28];[.J28]*0.3;"") ->  | N29: 220 | R29: 220 | V29: 220 | Z29: 220 | AD29: 220 | AH29: of:=SUM([.F29:.AD29]) -> 1100 | AK29: of:=CONCATENATE("VAC = ";[.BK22]) -> VAC = 0 | AL29: of:=CONCATENATE("HOL = "; [.BO22]) -> HOL = 0
B30: Selleck, Dustin | E30: HRS : | N30: 12 | R30: 11.5 | V30: 10 | Z30: 6.5 | AA30: 5.5 | AE30: 8 | AH30: of:=IF([.BC30]>0; [.BC30];"") -> 574.232365145228 | AK30: of:=[.BI30] -> 295.767634854772 | AM30: of:=[.BS30] -> 880 | AW30: of:=[.E34] -> 4 | AY30: of:=[.B30] -> Selleck, Dustin | BA30: of:=[.$F30]+[.$J30]+[.$N30]+[.$R30]+[.$V30]+[.$Z30]+[.$AD30] -> 40 | BC30: of:=IF([.$BG30]=0;[.$CA30]; IF([.$BG30]>0; [.$CA30]/([.$BA30]+([.$BG30]*1.5)))*[.$BA30])-[.$BE30] -> 574.232365145228 | BE30: of:=[.BU30] -> 10 | BG30: of:=[.$G30]+[.$K30]+[.$O30]+[.$S30]+[.$W30]+[.$AA30]+[.$AE30] -> 13.5 | BI30: of:=IF([.$BA30]>0;[.$BG30]*[.$CA30]/([.$BA30]+([.$BG30]*1.5))*1.5;0) -> 295.767634854772 | BK30: of:=[.$H30]+[.$L30]+[.$P30]+[.$T30]+[.$X30]+[.$AB30]+[.$AF30] -> 0 | BM30: of:=[.$BK30]*([.$AR32]/8) -> 0 | BO30: of:=[.$I30]+[.$M30]+[.$Q30]+[.$U30]+[.$Y30]+[.$AC30]+[.$AG30] -> 0 | BQ30: of:=[.$BO30]*([.$AR35]/8) -> 0 | BS30: of:=[.$BC30]+[.$BI30]+[.$BM30]+[.$BQ30]+[.$BE30] -> 880 | BU30: of:=[.$AM34] -> 10 | BW30: of:=IF([.$BU30] <= [.$CA30]* 0.25; [.$BU30]; [.$CA30]* 0.25) -> 10 | BY30: of:=SUM([.$F36:.$AD36]) -> 2940.5 | CA30: of:=SUM([.$F37:.$AD37]) -> 880 | CC30: of:=[.BC30]+[.BE30] -> 584.232365145228
F31: R | G31: O | H31: V | I31: H | J31: R | K31: O | L31: V | M31: H | N31: R | O31: O | P31: V | Q31: H | R31: R | S31: O | T31: V | U31: H | V31: R | W31: O | X31: V | Y31: H | Z31: R | AA31: O | AB31: V | AC31: H | AD31: R | AE31: O | AF31: V | AG31: H | AR31: VACATION RATE
E32: ROW # | N32: Chm Rte | R32: Blm Rte | V32: Peoria Rte | Z32: Chm Rte | AD32: Blm Rte | AH32: of:=IF([.AH30]>0;CONCATENATE(TEXT([.CC30];"####.##");"-Expense");"") -> 584.23-Expense
AH33: VACATION | AK33: HOLIDAY | AM33: EXPENSES
E34: of:=[.E26]+1 -> 4 | AH34: of:=IF([.BK30]>0; IF([.AR32]>0;[.BM30]; "ENTER RATE >");0) -> 0 | AK34: of:=IF([.BO30]>0; IF([.AR35]>0;[.BQ30]; "ENTER RATE >");0) -> 0 | AM34: 10 | AR34: HOLIDAY RATE
E36: VOL | F36: of:=['Work Log'.E40] -> 0 | J36: of:=['Work Log'.I40] -> 0 | N36: 557 | R36: 766 | V36: 449 | Z36: 660 | AD36: 508.5 | AH36: of:=[.BY30] -> 2940.5 | AK36: of:=CONCATENATE("REG = ";[.BA30]) -> REG = 40 | AL36: of:=CONCATENATE("OT = "; [.BG30]) -> OT = 13.5 | AM36: Prod % = | AN36: of:=[.AM30]/[.AH36] -> 0.299268831831321
E37: D/L | F37: of:=IF([.F36];[.F36]*0.3;"") ->  | J37: of:=IF([.J36];[.J36]*0.3;"") ->  | N37: 165 | R37: 230 | V37: 135 | Z37: 200 | AD37: 150 | AH37: of:=SUM([.F37:.AD37]) -> 880 | AK37: of:=CONCATENATE("VAC = ";[.BK30]) -> VAC = 0 | AL37: of:=CONCATENATE("HOL = "; [.BO30]) -> HOL = 0
B38: Snyder, Blake | E38: HRS : | N38: 8 | R38: 8 | V38: 10 | Z38: 8 | AD38: 6 | AE38: 2.5 | AH38: of:=IF([.BC38]>0; [.BC38];"") -> 826.571428571429 | AK38: of:=[.BI38] -> 78.4285714285714 | AM38: of:=[.BS38] -> 915 | AW38: of:=[.E42] -> 5 | AY38: of:=[.B38] -> Snyder, Blake | BA38: of:=[.$F38]+[.$J38]+[.$N38]+[.$R38]+[.$V38]+[.$Z38]+[.$AD38] -> 40 | BC38: of:=IF([.$BG38]=0;[.$CA38]; IF([.$BG38]>0; [.$CA38]/([.$BA38]+([.$BG38]*1.5)))*[.$BA38])-[.$BE38] -> 826.571428571429 | BE38: of:=[.BU38] -> 10 | BG38: of:=[.$G38]+[.$K38]+[.$O38]+[.$S38]+[.$W38]+[.$AA38]+[.$AE38] -> 2.5 | BI38: of:=IF([.$BA38]>0;[.$BG38]*[.$CA38]/([.$BA38]+([.$BG38]*1.5))*1.5;0) -> 78.4285714285714 | BK38: of:=[.$H38]+[.$L38]+[.$P38]+[.$T38]+[.$X38]+[.$AB38]+[.$AF38] -> 0 | BM38: of:=[.$BK38]*([.$AR40]/8) -> 0 | BO38: of:=[.$I38]+[.$M38]+[.$Q38]+[.$U38]+[.$Y38]+[.$AC38]+[.$AG38] -> 0 | BQ38: of:=[.$BO38]*([.$AR43]/8) -> 0 | BS38: of:=[.$BC38]+[.$BI38]+[.$BM38]+[.$BQ38]+[.$BE38] -> 915 | BU38: of:=[.$AM42] -> 10 | BW38: of:=IF([.$BU38] <= [.$CA38]* 0.25; [.$BU38]; [.$CA38]* 0.25) -> 10 | BY38: of:=SUM([.$F44:.$AD44]) -> 3028.6 | CA38: of:=SUM([.$F45:.$AD45]) -> 915 | CC38: of:=[.BC38]+[.BE38] -> 836.571428571429
F39: R | G39: O | H39: V | I39: H | J39: R | K39: O | L39: V | M39: H | N39: R | O39: O | P39: V | Q39: H | R39: R | S39: O | T39: V | U39: H | V39: R | W39: O | X39: V | Y39: H | Z39: R | AA39: O | AB39: V | AC39: H | AD39: R | AE39: O | AF39: V | AG39: H | AR39: VACATION RATE
E40: ROW # | N40: State Farm | R40: State Farm | V40: Carle North Clinic | Z40: Carle North Clinic | AD40: Res and Decatur Rte | AH40: of:=IF([.AH38]>0;CONCATENATE(TEXT([.CC38];"####.##");"-Expense");"") -> 836.57-Expense
AH41: VACATION | AK41: HOLIDAY | AM41: EXPENSES
E42: of:=[.E34]+1 -> 5 | AH42: of:=IF([.BK38]>0; IF([.AR40]>0;[.BM38]; "ENTER RATE >");0) -> 0 | AK42: of:=IF([.BO38]>0; IF([.AR43]>0;[.BQ38]; "ENTER RATE >");0) -> 0 | AM42: 10 | AR42: HOLIDAY RATE
E44: VOL | F44: of:=['Work Log'.E49] -> 0 | J44: of:=['Work Log'.I49] -> 0 | N44: 700 | R44: 700 | V44: 622.1 | Z44: 650 | AD44: 356.5 | AH44: of:=[.BY38] -> 3028.6 | AK44: of:=CONCATENATE("REG = ";[.BA38]) -> REG = 40 | AL44: of:=CONCATENATE("OT = "; [.BG38]) -> OT = 2.5 | AM44: Prod % = | AN44: of:=[.AM38]/[.AH44] -> 0.302119791322723
E45: D/L | F45: of:=IF([.F44];[.F44]*0.3;"") ->  | J45: of:=IF([.J44];[.J44]*0.3;"") ->  | N45: 200 | R45: 200 | V45: 175 | Z45: 175 | AD45: 165 | AH45: of:=SUM([.F45:.AD45]) -> 915 | AK45: of:=CONCATENATE("VAC = ";[.BK38]) -> VAC = 0 | AL45: of:=CONCATENATE("HOL = "; [.BO38]) -> HOL = 0
B46: Stonestreet, Jessi | E46: HRS : | N46: 6.5 | V46: 7.5 | Z46: 7 | AD46: 10.5 | AH46: of:=IF([.BC46]>0; [.BC46];"") -> 790 | AK46: of:=[.BI46] -> 0 | AM46: of:=[.BS46] -> 800 | AW46: of:=[.E50] -> 6 | AY46: of:=[.B46] -> Stonestreet, Jessi | BA46: of:=[.$F46]+[.$J46]+[.$N46]+[.$R46]+[.$V46]+[.$Z46]+[.$AD46] -> 31.5 | BC46: of:=IF([.$BG46]=0;[.$CA46]; IF([.$BG46]>0; [.$CA46]/([.$BA46]+([.$BG46]*1.5)))*[.$BA46])-[.$BE46] -> 790 | BE46: of:=[.BU46] -> 10 | BG46: of:=[.$G46]+[.$K46]+[.$O46]+[.$S46]+[.$W46]+[.$AA46]+[.$AE46] -> 0 | BI46: of:=IF([.$BA46]>0;[.$BG46]*[.$CA46]/([.$BA46]+([.$BG46]*1.5))*1.5;0) -> 0 | BK46: of:=[.$H46]+[.$L46]+[.$P46]+[.$T46]+[.$X46]+[.$AB46]+[.$AF46] -> 0 | BM46: of:=[.$BK46]*([.$AR48]/8) -> 0 | BO46: of:=[.$I46]+[.$M46]+[.$Q46]+[.$U46]+[.$Y46]+[.$AC46]+[.$AG46] -> 0 | BQ46: of:=[.$BO46]*([.$AR51]/8) -> 0 | BS46: of:=[.$BC46]+[.$BI46]+[.$BM46]+[.$BQ46]+[.$BE46] -> 800 | BU46: of:=[.$AM50] -> 10 | BW46: of:=IF([.$BU46] <= [.$CA46]* 0.25; [.$BU46]; [.$CA46]* 0.25) -> 10 | BY46: of:=SUM([.$F52:.$AD52]) -> 2992.75 | CA46: of:=SUM([.$F53:.$AD53]) -> 800 | CC46: of:=[.BC46]+[.BE46] -> 800
F47: R | G47: O | H47: V | I47: H | J47: R | K47: O | L47: V | M47: H | N47: R | O47: O | P47: V | Q47: H | R47: R | S47: O | T47: V | U47: H | V47: R | W47: O | X47: V | Y47: H | Z47: R | AA47: O | AB47: V | AC47: H | AD47: R | AE47: O | AF47: V | AG47: H | AR47: VACATION RATE
E48: ROW # | N48: Carle | R48: OFF | V48: State Farm | Z48: State Farm and Residential | AD48: Cullinan Property | AH48: of:=IF([.AH46]>0;CONCATENATE(TEXT([.CC46];"####.##");"-Expense");"") -> 800-Expense
AH49: VACATION | AK49: HOLIDAY | AM49: EXPENSES
E50: of:=[.E42]+1 -> 6 | AH50: of:=IF([.BK46]>0; IF([.AR48]>0;[.BM46]; "ENTER RATE >");0) -> 0 | AK50: of:=IF([.BO46]>0; IF([.AR51]>0;[.BQ46]; "ENTER RATE >");0) -> 0 | AM50: 10 | AR50: HOLIDAY RATE
E52: VOL | F52: of:=['Work Log'.E58] -> 0 | J52: of:=['Work Log'.I58] -> 0 | N52: 509.75 | R52: of:=['Work Log'.Q58] -> 0 | V52: 700 | Z52: 700 | AD52: 1083 | AH52: of:=[.BY46] -> 2992.75 | AK52: of:=CONCATENATE("REG = ";[.BA46]) -> REG = 31.5 | AL52: of:=CONCATENATE("OT = "; [.BG46]) -> OT = 0 | AM52: Prod % = | AN52: of:=[.AM46]/[.AH52] -> 0.267312672291371
E53: D/L | F53: of:=IF([.F52];[.F52]*0.3;"") ->  | J53: of:=IF([.J52];[.J52]*0.3;"") ->  | N53: 100 | R53: of:=IF([.R52];[.R52]*0.3;"") ->  | V53: 215 | Z53: 215 | AD53: 270 | AH53: of:=SUM([.F53:.AD53]) -> 800 | AK53: of:=CONCATENATE("VAC = ";[.BK46]) -> VAC = 0 | AL53: of:=CONCATENATE("HOL = "; [.BO46]) -> HOL = 0
B54: Vaughn, Kyle | E54: HRS : | N54: 8.5 | R54: 8.5 | V54: 8 | Z54: 12.5 | AD54: 2.5 | AE54: 6.5 | AH54: of:=IF([.BC54]>0; [.BC54];"") -> 856.331658291457 | AK54: of:=[.BI54] -> 211.168341708543 | AM54: of:=[.BS54] -> 1077.5 | AW54: of:=[.E58] -> 7 | AY54: of:=[.B54] -> Vaughn, Kyle | BA54: of:=[.$F54]+[.$J54]+[.$N54]+[.$R54]+[.$V54]+[.$Z54]+[.$AD54] -> 40 | BC54: of:=IF([.$BG54]=0;[.$CA54]; IF([.$BG54]>0; [.$CA54]/([.$BA54]+([.$BG54]*1.5)))*[.$BA54])-[.$BE54] -> 856.331658291457 | BE54: of:=[.BU54] -> 10 | BG54: of:=[.$G54]+[.$K54]+[.$O54]+[.$S54]+[.$W54]+[.$AA54]+[.$AE54] -> 6.5 | BI54: of:=IF([.$BA54]>0;[.$BG54]*[.$CA54]/([.$BA54]+([.$BG54]*1.5))*1.5;0) -> 211.168341708543 | BK54: of:=[.$H54]+[.$L54]+[.$P54]+[.$T54]+[.$X54]+[.$AB54]+[.$AF54] -> 0 | BM54: of:=[.$BK54]*([.$AR56]/8) -> 0 | BO54: of:=[.$I54]+[.$M54]+[.$Q54]+[.$U54]+[.$Y54]+[.$AC54]+[.$AG54] -> 0 | BQ54: of:=[.$BO54]*([.$AR59]/8) -> 0 | BS54: of:=[.$BC54]+[.$BI54]+[.$BM54]+[.$BQ54]+[.$BE54] -> 1077.5 | BU54: of:=[.$AM58] -> 10 | BW54: of:=IF([.$BU54] <= [.$CA54]* 0.25; [.$BU54]; [.$CA54]* 0.25) -> 10 | BY54: of:=SUM([.$F60:.$AD60]) -> 3873.75 | CA54: of:=SUM([.$F61:.$AD61]) -> 1077.5 | CC54: of:=[.BC54]+[.BE54] -> 866.331658291457
F55: R | G55: O | H55: V | I55: H | J55: R | K55: O | L55: V | M55: H | N55: R | O55: O | P55: V | Q55: H | R55: R | S55: O | T55: V | U55: H | V55: R | W55: O | X55: V | Y55: H | Z55: R | AA55: O | AB55: V | AC55: H | AD55: R | AE55: O | AF55: V | AG55: H | AR55: VACATION RATE
E56: ROW # | N56: Hopedale | R56: Hopedale | V56: State Farm | Z56: OSF Rte 91 | AD56: State Farm | AH56: of:=IF([.AH54]>0;CONCATENATE(TEXT([.CC54];"####.##");"-Expense");"") -> 866.33-Expense
AH57: VACATION | AK57: HOLIDAY | AM57: EXPENSES
E58: of:=[.E50]+1 -> 7 | AH58: of:=IF([.BK54]>0; IF([.AR56]>0;[.BM54]; "ENTER RATE >");0) -> 0 | AK58: of:=IF([.BO54]>0; IF([.AR59]>0;[.BQ54]; "ENTER RATE >");0) -> 0 | AM58: 10 | AR58: HOLIDAY RATE
E60: VOL | F60: of:=['Work Log'.E67] -> 0 | J60: of:=['Work Log'.I67] -> 0 | N60: 573.75 | R60: 650 | V60: 700 | Z60: 1250 | AD60: 700 | AH60: of:=[.BY54] -> 3873.75 | AK60: of:=CONCATENATE("REG = ";[.BA54]) -> REG = 40 | AL60: of:=CONCATENATE("OT = "; [.BG54]) -> OT = 6.5 | AM60: Prod % = | AN60: of:=[.AM54]/[.AH60] -> 0.278154243304292
E61: D/L | F61: of:=IF([.F60];[.F60]*0.3;"") ->  | J61: of:=IF([.J60];[.J60]*0.3;"") ->  | N61: 170 | R61: of:=IF([.R60];[.R60]*0.3;"") -> 195 | V61: 200 | Z61: 312.5 | AD61: 200 | AH61: of:=SUM([.F61:.AD61]) -> 1077.5 | AK61: of:=CONCATENATE("VAC = ";[.BK54]) -> VAC = 0 | AL61: of:=CONCATENATE("HOL = "; [.BO54]) -> HOL = 0
B62: Winford, Rhett | E62: HRS : | AH62: of:=IF([.BC62]>0; [.BC62];"") -> 915 | AK62: of:=[.BI62] -> 0 | AM62: of:=[.BS62] -> 915 | AW62: of:=[.E66] -> 8 | AY62: of:=[.B62] -> Winford, Rhett | BA62: of:=[.$F62]+[.$J62]+[.$N62]+[.$R62]+[.$V62]+[.$Z62]+[.$AD62] -> 0 | BC62: of:=IF([.$BG62]=0;[.$CA62]; IF([.$BG62]>0; [.$CA62]/([.$BA62]+([.$BG62]*1.5)))*[.$BA62])-[.$BE62] -> 915 | BE62: of:=[.BU62] -> 0 | BG62: of:=[.$G62]+[.$K62]+[.$O62]+[.$S62]+[.$W62]+[.$AA62]+[.$AE62] -> 0 | BI62: of:=IF([.$BA62]>0;[.$BG62]*[.$CA62]/([.$BA62]+([.$BG62]*1.5))*1.5;0) -> 0 | BK62: of:=[.$H62]+[.$L62]+[.$P62]+[.$T62]+[.$X62]+[.$AB62]+[.$AF62] -> 0 | BM62: of:=[.$BK62]*([.$AR64]/8) -> 0 | BO62: of:=[.$I62]+[.$M62]+[.$Q62]+[.$U62]+[.$Y62]+[.$AC62]+[.$AG62] -> 0 | BQ62: of:=[.$BO62]*([.$AR67]/8) -> 0 | BS62: of:=[.$BC62]+[.$BI62]+[.$BM62]+[.$BQ62]+[.$BE62] -> 915 | BU62: of:=[.$AM66] -> 0 | BW62: of:=IF([.$BU62] <= [.$CA62]* 0.25; [.$BU62]; [.$CA62]* 0.25) -> 0 | BY62: of:=SUM([.$F68:.$AD68]) -> 2050 | CA62: of:=SUM([.$F69:.$AD69]) -> 915 | CC62: of:=[.BC62]+[.BE62] -> 915
F63: R | G63: O | H63: V | I63: H | J63: R | K63: O | L63: V | M63: H | N63: R | O63: O | P63: V | Q63: H | R63: R | S63: O | T63: V | U63: H | V63: R | W63: O | X63: V | Y63: H | Z63: R | AA63: O | AB63: V | AC63: H | AD63: R | AE63: O | AF63: V | AG63: H | AR63: VACATION RATE
E64: ROW # | N64: Hopedale | V64: Carle North Clinic | AH64: of:=IF([.AH62]>0;CONCATENATE(TEXT([.CC62];"####.##");"-Expense");"") -> 915-Expense
AH65: VACATION | AK65: HOLIDAY | AM65: EXPENSES
E66: of:=[.E58]+1 -> 8 | AH66: of:=IF([.BK62]>0; IF([.AR64]>0;[.BM62]; "ENTER RATE >");0) -> 0 | AK66: of:=IF([.BO62]>0; IF([.AR67]>0;[.BQ62]; "ENTER RATE >");0) -> 0 | AR66: HOLIDAY RATE
E68: VOL | F68: of:=['Work Log'.E76] -> 0 | J68: of:=['Work Log'.I76] -> 0 | N68: 1025 | R68: of:=['Work Log'.Q76] -> 0 | V68: 1025 | Z68: of:=['Work Log'.Y76] -> 0 | AD68: of:=['Work Log'.AC76] -> 0 | AH68: of:=[.BY62] -> 2050 | AK68: of:=CONCATENATE("REG = ";[.BA62]) -> REG = 0 | AL68: of:=CONCATENATE("OT = "; [.BG62]) -> OT = 0 | AM68: Prod % = | AN68: of:=[.AM62]/[.AH68] -> 0.446341463414634
E69: D/L | F69: of:=IF([.F68];[.F68]*0.3;"") ->  | J69: of:=IF([.J68];[.J68]*0.3;"") ->  | N69: 457.5 | R69: of:=IF([.R68];[.R68]*0.3;"") ->  | V69: 457.5 | Z69: of:=IF([.Z68];[.Z68]*0.3;"") ->  | AD69: of:=IF([.AD68];[.AD68]*0.3;"") ->  | AH69: of:=SUM([.F69:.AD69]) -> 915 | AK69: of:=CONCATENATE("VAC = ";[.BK62]) -> VAC = 0 | AL69: of:=CONCATENATE("HOL = "; [.BO62]) -> HOL = 0
E70: HRS : | AH70: of:=IF([.BC70]>0; [.BC70];"") ->  | AK70: of:=[.BI70] -> 0 | AM70: of:=[.BS70] -> 0 | AW70: of:=[.E74] -> 9 | AY70: of:=[.B70] -> 0 | BA70: of:=[.$F70]+[.$J70]+[.$N70]+[.$R70]+[.$V70]+[.$Z70]+[.$AD70] -> 0 | BC70: of:=IF([.$BG70]=0;[.$CA70]; IF([.$BG70]>0; [.$CA70]/([.$BA70]+([.$BG70]*1.5)))*[.$BA70])-[.$BE70] -> 0 | BE70: of:=[.BU70] -> 0 | BG70: of:=[.$G70]+[.$K70]+[.$O70]+[.$S70]+[.$W70]+[.$AA70]+[.$AE70] -> 0 | BI70: of:=IF([.$BA70]>0;[.$BG70]*[.$CA70]/([.$BA70]+([.$BG70]*1.5))*1.5;0) -> 0 | BK70: of:=[.$H70]+[.$L70]+[.$P70]+[.$T70]+[.$X70]+[.$AB70]+[.$AF70] -> 0 | BM70: of:=[.$BK70]*([.$AR72]/8) -> 0 | BO70: of:=[.$I70]+[.$M70]+[.$Q70]+[.$U70]+[.$Y70]+[.$AC70]+[.$AG70] -> 0 | BQ70: of:=[.$BO70]*([.$AR75]/8) -> 0 | BS70: of:=[.$BC70]+[.$BI70]+[.$BM70]+[.$BQ70]+[.$BE70] -> 0 | BU70: of:=[.$AM74] -> 0 | BW70: of:=IF([.$BU70] <= [.$CA70]* 0.25; [.$BU70]; [.$CA70]* 0.25) -> 0 | BY70: of:=SUM([.$F76:.$AD76]) -> 0 | CA70: of:=SUM([.$F77:.$AD77]) -> 0 | CC70: of:=[.BC70]+[.BE70] -> 0
F71: R | G71: O | H71: V | I71: H | J71: R | K71: O | L71: V | M71: H | N71: R | O71: O | P71: V | Q71: H | R71: R | S71: O | T71: V | U71: H | V71: R | W71: O | X71: V | Y71: H | Z71: R | AA71: O | AB71: V | AC71: H | AD71: R | AE71: O | AF71: V | AG71: H | AR71: VACATION RATE
E72: ROW # | AH72: of:=IF([.AH70]>0;CONCATENATE(TEXT([.CC70];"####.##");"-Expense");"") -> .-Expense
AH73: VACATION | AK73: HOLIDAY | AM73: EXPENSES
E74: of:=[.E66]+1 -> 9 | AH74: of:=IF([.BK70]>0; IF([.AR72]>0;[.BM70]; "ENTER RATE >");0) -> 0 | AK74: of:=IF([.BO70]>0; IF([.AR75]>0;[.BQ70]; "ENTER RATE >");0) -> 0 | AR74: HOLIDAY RATE
E76: VOL | F76: of:=['Work Log'.E85] -> 0 | J76: of:=['Work Log'.I85] -> 0 | N76: of:=['Work Log'.M85] -> 0 | R76: of:=['Work Log'.Q85] -> 0 | V76: of:=['Work Log'.U85] -> 0 | Z76: of:=['Work Log'.Y85] -> 0 | AD76: of:=['Work Log'.AC85] -> 0 | AH76: of:=[.BY70] -> 0 | AK76: of:=CONCATENATE("REG = ";[.BA70]) -> REG = 0 | AL76: of:=CONCATENATE("OT = "; [.BG70]) -> OT = 0 | AM76: Prod % = | AN76: of:=[.AM70]/[.AH76] -> 
E77: D/L | F77: of:=IF([.F76];[.F76]*0.3;"") ->  | J77: of:=IF([.J76];[.J76]*0.3;"") ->  | N77: of:=IF([.N76];[.N76]*0.3;"") ->  | R77: of:=IF([.R76];[.R76]*0.3;"") ->  | V77: of:=IF([.V76];[.V76]*0.3;"") ->  | Z77: of:=IF([.Z76];[.Z76]*0.3;"") ->  | AD77: of:=IF([.AD76];[.AD76]*0.3;"") ->  | AH77: of:=SUM([.F77:.AD77]) -> 0 | AK77: of:=CONCATENATE("VAC = ";[.BK70]) -> VAC = 0 | AL77: of:=CONCATENATE("HOL = "; [.BO70]) -> HOL = 0
E78: HRS : | AH78: of:=IF([.BC78]>0; [.BC78];"") ->  | AK78: of:=[.BI78] -> 0 | AM78: of:=[.BS78] -> 0 | AW78: of:=[.E82] -> 10 | AY78: of:=[.B78] -> 0 | BA78: of:=[.$F78]+[.$J78]+[.$N78]+[.$R78]+[.$V78]+[.$Z78]+[.$AD78] -> 0 | BC78: of:=IF([.$BG78]=0;[.$CA78]; IF([.$BG78]>0; [.$CA78]/([.$BA78]+([.$BG78]*1.5)))*[.$BA78])-[.$BE78] -> 0 | BE78: of:=[.BU78] -> 0 | BG78: of:=[.$G78]+[.$K78]+[.$O78]+[.$S78]+[.$W78]+[.$AA78]+[.$AE78] -> 0 | BI78: of:=IF([.$BA78]>0;[.$BG78]*[.$CA78]/([.$BA78]+([.$BG78]*1.5))*1.5;0) -> 0 | BK78: of:=[.$H78]+[.$L78]+[.$P78]+[.$T78]+[.$X78]+[.$AB78]+[.$AF78] -> 0 | BM78: of:=[.$BK78]*([.$AR80]/8) -> 0 | BO78: of:=[.$I78]+[.$M78]+[.$Q78]+[.$U78]+[.$Y78]+[.$AC78]+[.$AG78] -> 0 | BQ78: of:=[.$BO78]*([.$AR83]/8) -> 0 | BS78: of:=[.$BC78]+[.$BI78]+[.$BM78]+[.$BQ78]+[.$BE78] -> 0 | BU78: of:=[.$AM82] -> 0 | BW78: of:=IF([.$BU78] <= [.$CA78]* 0.25; [.$BU78]; [.$CA78]* 0.25) -> 0 | BY78: of:=SUM([.$F84:.$AD84]) -> 0 | CA78: of:=SUM([.$F85:.$AD85]) -> 0 | CC78: of:=[.BC78]+[.BE78] -> 0
F79: R | G79: O | H79: V | I79: H | J79: R | K79: O | L79: V | M79: H | N79: R | O79: O | P79: V | Q79: H | R79: R | S79: O | T79: V | U79: H | V79: R | W79: O | X79: V | Y79: H | Z79: R | AA79: O | AB79: V | AC79: H | AD79: R | AE79: O | AF79: V | AG79: H | AR79: VACATION RATE
E80: ROW # | AH80: of:=IF([.AH78]>0;CONCATENATE(TEXT([.CC78];"####.##");"-Expense");"") -> .-Expense
AH81: VACATION | AK81: HOLIDAY | AM81: EXPENSES
E82: of:=[.E74]+1 -> 10 | AH82: of:=IF([.BK78]>0; IF([.AR80]>0;[.BM78]; "ENTER RATE >");0) -> 0 | AK82: of:=IF([.BO78]>0; IF([.AR83]>0;[.BQ78]; "ENTER RATE >");0) -> 0 | AR82: HOLIDAY RATE
E84: VOL | F84: of:=['Work Log'.E94] -> 0 | J84: of:=['Work Log'.I94] -> 0 | N84: of:=['Work Log'.M94] -> 0 | R84: of:=['Work Log'.Q94] -> 0 | V84: of:=['Work Log'.U94] -> 0 | Z84: of:=['Work Log'.Y94] -> 0 | AD84: of:=['Work Log'.AC94] -> 0 | AH84: of:=[.BY78] -> 0 | AK84: of:=CONCATENATE("REG = ";[.BA78]) -> REG = 0 | AL84: of:=CONCATENATE("OT = "; [.BG78]) -> OT = 0 | AM84: Prod % = | AN84: of:=[.AM78]/[.AH84] -> 
E85: D/L | F85: of:=IF([.F84];[.F84]*0.3;"") ->  | J85: of:=IF([.J84];[.J84]*0.3;"") ->  | N85: of:=IF([.N84];[.N84]*0.3;"") ->  | R85: of:=IF([.R84];[.R84]*0.3;"") ->  | V85: of:=IF([.V84];[.V84]*0.3;"") ->  | Z85: of:=IF([.Z84];[.Z84]*0.3;"") ->  | AD85: of:=IF([.AD84];[.AD84]*0.3;"") ->  | AH85: of:=SUM([.F85:.AD85]) -> 0 | AK85: of:=CONCATENATE("VAC = ";[.BK78]) -> VAC = 0 | AL85: of:=CONCATENATE("HOL = "; [.BO78]) -> HOL = 0
E86: HRS : | AH86: of:=IF([.BC86]>0; [.BC86];"") ->  | AK86: of:=[.BI86] -> 0 | AM86: of:=[.BS86] -> 0 | AW86: of:=[.E90] -> 11 | AY86: of:=[.B86] -> 0 | BA86: of:=[.$F86]+[.$J86]+[.$N86]+[.$R86]+[.$V86]+[.$Z86]+[.$AD86] -> 0 | BC86: of:=IF([.$BG86]=0;[.$CA86]; IF([.$BG86]>0; [.$CA86]/([.$BA86]+([.$BG86]*1.5)))*[.$BA86])-[.$BE86] -> 0 | BE86: of:=[.BU86] -> 0 | BG86: of:=[.$G86]+[.$K86]+[.$O86]+[.$S86]+[.$W86]+[.$AA86]+[.$AE86] -> 0 | BI86: of:=IF([.$BA86]>0;[.$BG86]*[.$CA86]/([.$BA86]+([.$BG86]*1.5))*1.5;0) -> 0 | BK86: of:=[.$H86]+[.$L86]+[.$P86]+[.$T86]+[.$X86]+[.$AB86]+[.$AF86] -> 0 | BM86: of:=[.$BK86]*([.$AR88]/8) -> 0 | BO86: of:=[.$I86]+[.$M86]+[.$Q86]+[.$U86]+[.$Y86]+[.$AC86]+[.$AG86] -> 0 | BQ86: of:=[.$BO86]*([.$AR91]/8) -> 0 | BS86: of:=[.$BC86]+[.$BI86]+[.$BM86]+[.$BQ86]+[.$BE86] -> 0 | BU86: of:=[.$AM90] -> 0 | BW86: of:=IF([.$BU86] <= [.$CA86]* 0.25; [.$BU86]; [.$CA86]* 0.25) -> 0 | BY86: of:=SUM([.$F92:.$AD92]) -> 0 | CA86: of:=SUM([.$F93:.$AD93]) -> 0 | CC86: of:=[.BC86]+[.BE86] -> 0
F87: R | G87: O | H87: V | I87: H | J87: R | K87: O | L87: V | M87: H | N87: R | O87: O | P87: V | Q87: H | R87: R | S87: O | T87: V | U87: H | V87: R | W87: O | X87: V | Y87: H | Z87: R | AA87: O | AB87: V | AC87: H | AD87: R | AE87: O | AF87: V | AG87: H | AR87: VACATION RATE
E88: ROW # | AH88: of:=IF([.AH86]>0;CONCATENATE(TEXT([.CC86];"####.##");"-Expense");"") -> .-Expense
AH89: VACATION | AK89: HOLIDAY | AM89: EXPENSES
E90: of:=[.E82]+1 -> 11 | AH90: of:=IF([.BK86]>0; IF([.AR88]>0;[.BM86]; "ENTER RATE >");0) -> 0 | AK90: of:=IF([.BO86]>0; IF([.AR91]>0;[.BQ86]; "ENTER RATE >");0) -> 0 | AR90: HOLIDAY RATE
E92: VOL | F92: of:=['Work Log'.E103] -> 0 | J92: of:=['Work Log'.I103] -> 0 | N92: of:=['Work Log'.M103] -> 0 | R92: of:=['Work Log'.Q103] -> 0 | V92: of:=['Work Log'.U103] -> 0 | Z92: of:=['Work Log'.Y103] -> 0 | AD92: of:=['Work Log'.AC103] -> 0 | AH92: of:=[.BY86] -> 0 | AK92: of:=CONCATENATE("REG = ";[.BA86]) -> REG = 0 | AL92: of:=CONCATENATE("OT = "; [.BG86]) -> OT = 0 | AM92: Prod % = | AN92: of:=[.AM86]/[.AH92] -> 
E93: D/L | F93: of:=IF([.F92];[.F92]*0.3;"") ->  | J93: of:=IF([.J92];[.J92]*0.3;"") ->  | N93: of:=IF([.N92];[.N92]*0.3;"") ->  | R93: of:=IF([.R92];[.R92]*0.3;"") ->  | V93: of:=IF([.V92];[.V92]*0.3;"") ->  | Z93: of:=IF([.Z92];[.Z92]*0.3;"") ->  | AD93: of:=IF([.AD92];[.AD92]*0.3;"") ->  | AH93: of:=SUM([.F93:.AD93]) -> 0 | AK93: of:=CONCATENATE("VAC = ";[.BK86]) -> VAC = 0 | AL93: of:=CONCATENATE("HOL = "; [.BO86]) -> HOL = 0
E94: HRS : | AH94: of:=IF([.BC94]>0; [.BC94];"") ->  | AK94: of:=[.BI94] -> 0 | AM94: of:=[.BS94] -> 0 | AW94: of:=[.E98] -> 12 | AY94: of:=[.B94] -> 0 | BA94: of:=[.$F94]+[.$J94]+[.$N94]+[.$R94]+[.$V94]+[.$Z94]+[.$AD94] -> 0 | BC94: of:=IF([.$BG94]=0;[.$CA94]; IF([.$BG94]>0; [.$CA94]/([.$BA94]+([.$BG94]*1.5)))*[.$BA94])-[.$BE94] -> 0 | BE94: of:=[.BU94] -> 0 | BG94: of:=[.$G94]+[.$K94]+[.$O94]+[.$S94]+[.$W94]+[.$AA94]+[.$AE94] -> 0 | BI94: of:=IF([.$BA94]>0;[.$BG94]*[.$CA94]/([.$BA94]+([.$BG94]*1.5))*1.5;0) -> 0 | BK94: of:=[.$H94]+[.$L94]+[.$P94]+[.$T94]+[.$X94]+[.$AB94]+[.$AF94] -> 0 | BM94: of:=[.$BK94]*([.$AR96]/8) -> 0 | BO94: of:=[.$I94]+[.$M94]+[.$Q94]+[.$U94]+[.$Y94]+[.$AC94]+[.$AG94] -> 0 | BQ94: of:=[.$BO94]*([.$AR99]/8) -> 0 | BS94: of:=[.$BC94]+[.$BI94]+[.$BM94]+[.$BQ94]+[.$BE94] -> 0 | BU94: of:=[.$AM98] -> 0 | BW94: of:=IF([.$BU94] <= [.$CA94]* 0.25; [.$BU94]; [.$CA94]* 0.25) -> 0 | BY94: of:=SUM([.$F100:.$AD100]) -> 0 | CA94: of:=SUM([.$F101:.$AD101]) -> 0 | CC94: of:=[.BC94]+[.BE94] -> 0
F95: R | G95: O | H95: V | I95: H | J95: R | K95: O | L95: V | M95: H | N95: R | O95: O | P95: V | Q95: H | R95: R | S95: O | T95: V | U95: H | V95: R | W95: O | X95: V | Y95: H | Z95: R | AA95: O | AB95: V | AC95: H | AD95: R | AE95: O | AF95: V | AG95: H | AR95: VACATION RATE
E96: ROW # | AH96: of:=IF([.AH94]>0;CONCATENATE(TEXT([.CC94];"####.##");"-Expense");"") -> .-Expense
AH97: VACATION | AK97: HOLIDAY | AM97: EXPENSES
E98: of:=[.E90]+1 -> 12 | AH98: of:=IF([.BK94]>0; IF([.AR96]>0;[.BM94]; "ENTER RATE >");0) -> 0 | AK98: of:=IF([.BO94]>0; IF([.AR99]>0;[.BQ94]; "ENTER RATE >");0) -> 0 | AR98: HOLIDAY RATE
E100: VOL | F100: of:=['Work Log'.E112] -> 0 | J100: of:=['Work Log'.I112] -> 0 | N100: of:=['Work Log'.M112] -> 0 | R100: of:=['Work Log'.Q112] -> 0 | V100: of:=['Work Log'.U112] -> 0 | Z100: of:=['Work Log'.Y112] -> 0 | AD100: of:=['Work Log'.AC112] -> 0 | AH100: of:=[.BY94] -> 0 | AK100: of:=CONCATENATE("REG = ";[.BA94]) -> REG = 0 | AL100: of:=CONCATENATE("OT = "; [.BG94]) -> OT = 0 | AM100: Prod % = | AN100: of:=[.AM94]/[.AH100] -> 
E101: D/L | F101: of:=IF([.F100];[.F100]*0.3;"") ->  | J101: of:=IF([.J100];[.J100]*0.3;"") ->  | N101: of:=IF([.N100];[.N100]*0.3;"") ->  | R101: of:=IF([.R100];[.R100]*0.3;"") ->  | V101: of:=IF([.V100];[.V100]*0.3;"") ->  | Z101: of:=IF([.Z100];[.Z100]*0.3;"") ->  | AD101: of:=IF([.AD100];[.AD100]*0.3;"") ->  | AH101: of:=SUM([.F101:.AD101]) -> 0 | AK101: of:=CONCATENATE("VAC = ";[.BK94]) -> VAC = 0 | AL101: of:=CONCATENATE("HOL = "; [.BO94]) -> HOL = 0
E102: HRS : | AH102: of:=IF([.BC102]>0; [.BC102];"") ->  | AK102: of:=[.BI102] -> 0 | AM102: of:=[.BS102] -> 0 | AW102: of:=[.E106] -> 13 | AY102: of:=[.B102] -> 0 | BA102: of:=[.$F102]+[.$J102]+[.$N102]+[.$R102]+[.$V102]+[.$Z102]+[.$AD102] -> 0 | BC102: of:=IF([.$BG102]=0;[.$CA102]; IF([.$BG102]>0; [.$CA102]/([.$BA102]+([.$BG102]*1.5)))*[.$BA102])-[.$BE102] -> 0 | BE102: of:=[.BU102] -> 0 | BG102: of:=[.$G102]+[.$K102]+[.$O102]+[.$S102]+[.$W102]+[.$AA102]+[.$AE102] -> 0 | BI102: of:=IF([.$BA102]>0;[.$BG102]*[.$CA102]/([.$BA102]+([.$BG102]*1.5))*1.5;0) -> 0 | BK102: of:=[.$H102]+[.$L102]+[.$P102]+[.$T102]+[.$X102]+[.$AB102]+[.$AF102] -> 0 | BM102: of:=[.$BK102]*([.$AR104]/8) -> 0 | BO102: of:=[.$I102]+[.$M102]+[.$Q102]+[.$U102]+[.$Y102]+[.$AC102]+[.$AG102] -> 0 | BQ102: of:=[.$BO102]*([.$AR107]/8) -> 0 | BS102: of:=[.$BC102]+[.$BI102]+[.$BM102]+[.$BQ102]+[.$BE102] -> 0 | BU102: of:=[.$AM106] -> 0 | BW102: of:=IF([.$BU102] <= [.$CA102]* 0.25; [.$BU102]; [.$CA102]* 0.25) -> 0 | BY102: of:=SUM([.$F108:.$AD108]) -> 0 | CA102: of:=SUM([.$F109:.$AD109]) -> 0 | CC102: of:=[.BC102]+[.BE102] -> 0
F103: R | G103: O | H103: V | I103: H | J103: R | K103: O | L103: V | M103: H | N103: R | O103: O | P103: V | Q103: H | R103: R | S103: O | T103: V | U103: H | V103: R | W103: O | X103: V | Y103: H | Z103: R | AA103: O | AB103: V | AC103: H | AD103: R | AE103: O | AF103: V | AG103: H | AR103: VACATION RATE
E104: ROW # | AH104: of:=IF([.AH102]>0;CONCATENATE(TEXT([.CC102];"####.##");"-Expense");"") -> .-Expense
AH105: VACATION | AK105: HOLIDAY | AM105: EXPENSES
E106: of:=[.E98]+1 -> 13 | AH106: of:=IF([.BK102]>0; IF([.AR104]>0;[.BM102]; "ENTER RATE >");0) -> 0 | AK106: of:=IF([.BO102]>0; IF([.AR107]>0;[.BQ102]; "ENTER RATE >");0) -> 0 | AR106: HOLIDAY RATE
E108: VOL | F108: of:=['Work Log'.E122] -> 0 | J108: of:=['Work Log'.I122] -> 0 | N108: of:=['Work Log'.M122] -> 0 | R108: of:=['Work Log'.Q122] -> 0 | V108: of:=['Work Log'.U122] -> 0 | Z108: of:=['Work Log'.Y122] -> 0 | AD108: of:=['Work Log'.AC122] -> 0 | AH108: of:=[.BY102] -> 0 | AK108: of:=CONCATENATE("REG = ";[.BA102]) -> REG = 0 | AL108: of:=CONCATENATE("OT = "; [.BG102]) -> OT = 0 | AM108: Prod % = | AN108: of:=[.AM102]/[.AH108] -> 
E109: D/L | F109: of:=IF([.F108];[.F108]*0.3;"") ->  | J109: of:=IF([.J108];[.J108]*0.3;"") ->  | N109: of:=IF([.N108];[.N108]*0.3;"") ->  | R109: of:=IF([.R108];[.R108]*0.3;"") ->  | V109: of:=IF([.V108];[.V108]*0.3;"") ->  | Z109: of:=IF([.Z108];[.Z108]*0.3;"") ->  | AD109: of:=IF([.AD108];[.AD108]*0.3;"") ->  | AH109: of:=SUM([.F109:.AD109]) -> 0 | AK109: of:=CONCATENATE("VAC = ";[.BK102]) -> VAC = 0 | AL109: of:=CONCATENATE("HOL = "; [.BO102]) -> HOL = 0
E110: HRS : | AH110: of:=IF([.BC110]>0; [.BC110];"") ->  | AK110: of:=[.BI110] -> 0 | AM110: of:=[.BS110] -> 0 | AW110: of:=[.E114] -> 14 | AY110: of:=[.B110] -> 0 | BA110: of:=[.$F110]+[.$J110]+[.$N110]+[.$R110]+[.$V110]+[.$Z110]+[.$AD110] -> 0 | BC110: of:=IF([.$BG110]=0;[.$CA110]; IF([.$BG110]>0; [.$CA110]/([.$BA110]+([.$BG110]*1.5)))*[.$BA110])-[.$BE110] -> 0 | BE110: of:=[.BU110] -> 0 | BG110: of:=[.$G110]+[.$K110]+[.$O110]+[.$S110]+[.$W110]+[.$AA110]+[.$AE110] -> 0 | BI110: of:=IF([.$BA110]>0;[.$BG110]*[.$CA110]/([.$BA110]+([.$BG110]*1.5))*1.5;0) -> 0 | BK110: of:=[.$H110]+[.$L110]+[.$P110]+[.$T110]+[.$X110]+[.$AB110]+[.$AF110] -> 0 | BM110: of:=[.$BK110]*([.$AR112]/8) -> 0 | BO110: of:=[.$I110]+[.$M110]+[.$Q110]+[.$U110]+[.$Y110]+[.$AC110]+[.$AG110] -> 0 | BQ110: of:=[.$BO110]*([.$AR115]/8) -> 0 | BS110: of:=[.$BC110]+[.$BI110]+[.$BM110]+[.$BQ110]+[.$BE110] -> 0 | BU110: of:=[.$AM114] -> 0 | BW110: of:=IF([.$BU110] <= [.$CA110]* 0.25; [.$BU110]; [.$CA110]* 0.25) -> 0 | BY110: of:=SUM([.$F116:.$AD116]) -> 0 | CA110: of:=SUM([.$F117:.$AD117]) -> 0 | CC110: of:=[.BC110]+[.BE110] -> 0
F111: R | G111: O | H111: V | I111: H | J111: R | K111: O | L111: V | M111: H | N111: R | O111: O | P111: V | Q111: H | R111: R | S111: O | T111: V | U111: H | V111: R | W111: O | X111: V | Y111: H | Z111: R | AA111: O | AB111: V | AC111: H | AD111: R | AE111: O | AF111: V | AG111: H | AR111: VACATION RATE
E112: ROW # | AH112: of:=IF([.AH110]>0;CONCATENATE(TEXT([.CC110];"####.##");"-Expense");"") -> .-Expense
AH113: VACATION | AK113: HOLIDAY | AM113: EXPENSES
E114: of:=[.E106]+1 -> 14 | AH114: of:=IF([.BK110]>0; IF([.AR112]>0;[.BM110]; "ENTER RATE >");0) -> 0 | AK114: of:=IF([.BO110]>0; IF([.AR115]>0;[.BQ110]; "ENTER RATE >");0) -> 0 | AR114: HOLIDAY RATE
E116: VOL | F116: of:=['Work Log'.E131] -> 0 | J116: of:=['Work Log'.I131] -> 0 | N116: of:=['Work Log'.M131] -> 0 | R116: of:=['Work Log'.Q131] -> 0 | V116: of:=['Work Log'.U131] -> 0 | Z116: of:=['Work Log'.Y131] -> 0 | AD116: of:=['Work Log'.AC131] -> 0 | AH116: of:=[.BY110] -> 0 | AK116: of:=CONCATENATE("REG = ";[.BA110]) -> REG = 0 | AL116: of:=CONCATENATE("OT = "; [.BG110]) -> OT = 0 | AM116: Prod % = | AN116: of:=[.AM110]/[.AH116] -> 
E117: D/L | F117: of:=IF([.F116];[.F116]*0.3;"") ->  | J117: of:=IF([.J116];[.J116]*0.3;"") ->  | N117: of:=IF([.N116];[.N116]*0.3;"") ->  | R117: of:=IF([.R116];[.R116]*0.3;"") ->  | V117: of:=IF([.V116];[.V116]*0.3;"") ->  | Z117: of:=IF([.Z116];[.Z116]*0.3;"") ->  | AD117: of:=IF([.AD116];[.AD116]*0.3;"") ->  | AH117: of:=SUM([.F117:.AD117]) -> 0 | AK117: of:=CONCATENATE("VAC = ";[.BK110]) -> VAC = 0 | AL117: of:=CONCATENATE("HOL = "; [.BO110]) -> HOL = 0
E118: HRS : | AH118: of:=IF([.BC118]>0; [.BC118];"") ->  | AK118: of:=[.BI118] -> 0 | AM118: of:=[.BS118] -> 0 | AW118: of:=[.E122] -> 15 | AY118: of:=[.B118] -> 0 | BA118: of:=[.$F118]+[.$J118]+[.$N118]+[.$R118]+[.$V118]+[.$Z118]+[.$AD118] -> 0 | BC118: of:=IF([.$BG118]=0;[.$CA118]; IF([.$BG118]>0; [.$CA118]/([.$BA118]+([.$BG118]*1.5)))*[.$BA118])-[.$BE118] -> 0 | BE118: of:=[.BU118] -> 0 | BG118: of:=[.$G118]+[.$K118]+[.$O118]+[.$S118]+[.$W118]+[.$AA118]+[.$AE118] -> 0 | BI118: of:=IF([.$BA118]>0;[.$BG118]*[.$CA118]/([.$BA118]+([.$BG118]*1.5))*1.5;0) -> 0 | BK118: of:=[.$H118]+[.$L118]+[.$P118]+[.$T118]+[.$X118]+[.$AB118]+[.$AF118] -> 0 | BM118: of:=[.$BK118]*([.$AR120]/8) -> 0 | BO118: of:=[.$I118]+[.$M118]+[.$Q118]+[.$U118]+[.$Y118]+[.$AC118]+[.$AG118] -> 0 | BQ118: of:=[.$BO118]*([.$AR123]/8) -> 0 | BS118: of:=[.$BC118]+[.$BI118]+[.$BM118]+[.$BQ118]+[.$BE118] -> 0 | BU118: of:=[.$AM122] -> 0 | BW118: of:=IF([.$BU118] <= [.$CA118]* 0.25; [.$BU118]; [.$CA118]* 0.25) -> 0 | BY118: of:=SUM([.$F124:.$AD124]) -> 0 | CA118: of:=SUM([.$F125:.$AD125]) -> 0 | CC118: of:=[.BC118]+[.BE118] -> 0
F119: R | G119: O | H119: V | I119: H | J119: R | K119: O | L119: V | M119: H | N119: R | O119: O | P119: V | Q119: H | R119: R | S119: O | T119: V | U119: H | V119: R | W119: O | X119: V | Y119: H | Z119: R | AA119: O | AB119: V | AC119: H | AD119: R | AE119: O | AF119: V | AG119: H | AR119: VACATION RATE
E120: ROW # | AH120: of:=IF([.AH118]>0;CONCATENATE(TEXT([.CC118];"####.##");"-Expense");"") -> .-Expense
AH121: VACATION | AK121: HOLIDAY | AM121: EXPENSES
E122: of:=[.E114]+1 -> 15 | AH122: of:=IF([.BK118]>0; IF([.AR120]>0;[.BM118]; "ENTER RATE >");0) -> 0 | AK122: of:=IF([.BO118]>0; IF([.AR123]>0;[.BQ118]; "ENTER RATE >");0) -> 0 | AR122: HOLIDAY RATE
E124: VOL | F124: of:=['Work Log'.E140] -> 0 | J124: of:=['Work Log'.I140] -> 0 | N124: of:=['Work Log'.M140] -> 0 | R124: of:=['Work Log'.Q140] -> 0 | V124: of:=['Work Log'.U140] -> 0 | Z124: of:=['Work Log'.Y140] -> 0 | AD124: of:=['Work Log'.AC140] -> 0 | AH124: of:=[.BY118] -> 0 | AK124: of:=CONCATENATE("REG = ";[.BA118]) -> REG = 0 | AL124: of:=CONCATENATE("OT = "; [.BG118]) -> OT = 0 | AM124: Prod % = | AN124: of:=[.AM118]/[.AH124] -> 
E125: D/L | F125: of:=IF([.F124];[.F124]*0.3;"") ->  | J125: of:=IF([.J124];[.J124]*0.3;"") ->  | N125: of:=IF([.N124];[.N124]*0.3;"") ->  | R125: of:=IF([.R124];[.R124]*0.3;"") ->  | V125: of:=IF([.V124];[.V124]*0.3;"") ->  | Z125: of:=IF([.Z124];[.Z124]*0.3;"") ->  | AD125: of:=IF([.AD124];[.AD124]*0.3;"") ->  | AH125: of:=SUM([.F125:.AD125]) -> 0 | AK125: of:=CONCATENATE("VAC = ";[.BK118]) -> VAC = 0 | AL125: of:=CONCATENATE("HOL = "; [.BO118]) -> HOL = 0
E126: HRS : | AH126: of:=IF([.BC126]>0; [.BC126];"") ->  | AK126: of:=[.BI126] -> 0 | AM126: of:=[.BS126] -> 0 | AW126: of:=[.E130] -> 16 | AY126: of:=[.B126] -> 0 | BA126: of:=[.$F126]+[.$J126]+[.$N126]+[.$R126]+[.$V126]+[.$Z126]+[.$AD126] -> 0 | BC126: of:=IF([.$BG126]=0;[.$CA126]; IF([.$BG126]>0; [.$CA126]/([.$BA126]+([.$BG126]*1.5)))*[.$BA126])-[.$BE126] -> 0 | BE126: of:=[.BU126] -> 0 | BG126: of:=[.$G126]+[.$K126]+[.$O126]+[.$S126]+[.$W126]+[.$AA126]+[.$AE126] -> 0 | BI126: of:=IF([.$BA126]>0;[.$BG126]*[.$CA126]/([.$BA126]+([.$BG126]*1.5))*1.5;0) -> 0 | BK126: of:=[.$H126]+[.$L126]+[.$P126]+[.$T126]+[.$X126]+[.$AB126]+[.$AF126] -> 0 | BM126: of:=[.$BK126]*([.$AR128]/8) -> 0 | BO126: of:=[.$I126]+[.$M126]+[.$Q126]+[.$U126]+[.$Y126]+[.$AC126]+[.$AG126] -> 0 | BQ126: of:=[.$BO126]*([.$AR131]/8) -> 0 | BS126: of:=[.$BC126]+[.$BI126]+[.$BM126]+[.$BQ126]+[.$BE126] -> 0 | BU126: of:=[.$AM130] -> 0 | BW126: of:=IF([.$BU126] <= [.$CA126]* 0.25; [.$BU126]; [.$CA126]* 0.25) -> 0 | BY126: of:=SUM([.$F132:.$AD132]) -> 0 | CA126: of:=SUM([.$F133:.$AD133]) -> 0 | CC126: of:=[.BC126]+[.BE126] -> 0
F127: R | G127: O | H127: V | I127: H | J127: R | K127: O | L127: V | M127: H | N127: R | O127: O | P127: V | Q127: H | R127: R | S127: O | T127: V | U127: H | V127: R | W127: O | X127: V | Y127: H | Z127: R | AA127: O | AB127: V | AC127: H | AD127: R | AE127: O | AF127: V | AG127: H | AR127: VACATION RATE
E128: ROW # | AH128: of:=IF([.AH126]>0;CONCATENATE(TEXT([.CC126];"####.##");"-Expense");"") -> .-Expense
AH129: VACATION | AK129: HOLIDAY | AM129: EXPENSES
E130: of:=[.E122]+1 -> 16 | AH130: of:=IF([.BK126]>0; IF([.AR128]>0;[.BM126]; "ENTER RATE >");0) -> 0 | AK130: of:=IF([.BO126]>0; IF([.AR131]>0;[.BQ126]; "ENTER RATE >");0) -> 0 | AR130: HOLIDAY RATE
E132: VOL | F132: of:=['Work Log'.E149] -> 0 | J132: of:=['Work Log'.I149] -> 0 | N132: of:=['Work Log'.M149] -> 0 | R132: of:=['Work Log'.Q149] -> 0 | V132: of:=['Work Log'.U149] -> 0 | Z132: of:=['Work Log'.Y149] -> 0 | AD132: of:=['Work Log'.AC149] -> 0 | AH132: of:=[.BY126] -> 0 | AK132: of:=CONCATENATE("REG = ";[.BA126]) -> REG = 0 | AL132: of:=CONCATENATE("OT = "; [.BG126]) -> OT = 0 | AM132: Prod % = | AN132: of:=[.AM126]/[.AH132] -> 
E133: D/L | F133: of:=IF([.F132];[.F132]*0.3;"") ->  | J133: of:=IF([.J132];[.J132]*0.3;"") ->  | N133: of:=IF([.N132];[.N132]*0.3;"") ->  | R133: of:=IF([.R132];[.R132]*0.3;"") ->  | V133: of:=IF([.V132];[.V132]*0.3;"") ->  | Z133: of:=IF([.Z132];[.Z132]*0.3;"") ->  | AD133: of:=IF([.AD132];[.AD132]*0.3;"") ->  | AH133: of:=SUM([.F133:.AD133]) -> 0 | AK133: of:=CONCATENATE("VAC = ";[.BK126]) -> VAC = 0 | AL133: of:=CONCATENATE("HOL = "; [.BO126]) -> HOL = 0
E134: HRS : | AH134: of:=IF([.BC134]>0; [.BC134];"") ->  | AK134: of:=[.BI134] -> 0 | AM134: of:=[.BS134] -> 0 | AW134: of:=[.E138] -> 17 | AY134: of:=[.B134] -> 0 | BA134: of:=[.$F134]+[.$J134]+[.$N134]+[.$R134]+[.$V134]+[.$Z134]+[.$AD134] -> 0 | BC134: of:=IF([.$BG134]=0;[.$CA134]; IF([.$BG134]>0; [.$CA134]/([.$BA134]+([.$BG134]*1.5)))*[.$BA134])-[.$BE134] -> 0 | BE134: of:=[.BU134] -> 0 | BG134: of:=[.$G134]+[.$K134]+[.$O134]+[.$S134]+[.$W134]+[.$AA134]+[.$AE134] -> 0 | BI134: of:=IF([.$BA134]>0;[.$BG134]*[.$CA134]/([.$BA134]+([.$BG134]*1.5))*1.5;0) -> 0 | BK134: of:=[.$H134]+[.$L134]+[.$P134]+[.$T134]+[.$X134]+[.$AB134]+[.$AF134] -> 0 | BM134: of:=[.$BK134]*([.$AR136]/8) -> 0 | BO134: of:=[.$I134]+[.$M134]+[.$Q134]+[.$U134]+[.$Y134]+[.$AC134]+[.$AG134] -> 0 | BQ134: of:=[.$BO134]*([.$AR139]/8) -> 0 | BS134: of:=[.$BC134]+[.$BI134]+[.$BM134]+[.$BQ134]+[.$BE134] -> 0 | BU134: of:=[.$AM138] -> 0 | BW134: of:=IF([.$BU134] <= [.$CA134]* 0.25; [.$BU134]; [.$CA134]* 0.25) -> 0 | BY134: of:=SUM([.$F140:.$AD140]) -> 0 | CA134: of:=SUM([.$F141:.$AD141]) -> 0 | CC134: of:=[.BC134]+[.BE134] -> 0
F135: R | G135: O | H135: V | I135: H | J135: R | K135: O | L135: V | M135: H | N135: R | O135: O | P135: V | Q135: H | R135: R | S135: O | T135: V | U135: H | V135: R | W135: O | X135: V | Y135: H | Z135: R | AA135: O | AB135: V | AC135: H | AD135: R | AE135: O | AF135: V | AG135: H | AR135: VACATION RATE
E136: ROW # | AH136: of:=IF([.AH134]>0;CONCATENATE(TEXT([.CC134];"####.##");"-Expense");"") -> .-Expense
AH137: VACATION | AK137: HOLIDAY | AM137: EXPENSES
E138: of:=[.E130]+1 -> 17 | AH138: of:=IF([.BK134]>0; IF([.AR136]>0;[.BM134]; "ENTER RATE >");0) -> 0 | AK138: of:=IF([.BO134]>0; IF([.AR139]>0;[.BQ134]; "ENTER RATE >");0) -> 0 | AR138: HOLIDAY RATE
E140: VOL | F140: of:=['Work Log'.E159] -> 0 | J140: of:=['Work Log'.I159] -> 0 | N140: of:=['Work Log'.M159] -> 0 | R140: of:=['Work Log'.Q159] -> 0 | V140: of:=['Work Log'.U159] -> 0 | Z140: of:=['Work Log'.Y159] -> 0 | AD140: of:=['Work Log'.AC159] -> 0 | AH140: of:=[.BY134] -> 0 | AK140: of:=CONCATENATE("REG = ";[.BA134]) -> REG = 0 | AL140: of:=CONCATENATE("OT = "; [.BG134]) -> OT = 0 | AM140: Prod % = | AN140: of:=[.AM134]/[.AH140] -> 
E141: D/L | F141: of:=IF([.F140];[.F140]*0.3;"") ->  | J141: of:=IF([.J140];[.J140]*0.3;"") ->  | N141: of:=IF([.N140];[.N140]*0.3;"") ->  | R141: of:=IF([.R140];[.R140]*0.3;"") ->  | V141: of:=IF([.V140];[.V140]*0.3;"") ->  | Z141: of:=IF([.Z140];[.Z140]*0.3;"") ->  | AD141: of:=IF([.AD140];[.AD140]*0.3;"") ->  | AH141: of:=SUM([.F141:.AD141]) -> 0 | AK141: of:=CONCATENATE("VAC = ";[.BK134]) -> VAC = 0 | AL141: of:=CONCATENATE("HOL = "; [.BO134]) -> HOL = 0
E142: HRS : | AH142: of:=IF([.BC142]>0; [.BC142];"") ->  | AK142: of:=[.BI142] -> 0 | AM142: of:=[.BS142] -> 0 | AW142: of:=[.E146] -> 18 | AY142: of:=[.B142] -> 0 | BA142: of:=[.$F142]+[.$J142]+[.$N142]+[.$R142]+[.$V142]+[.$Z142]+[.$AD142] -> 0 | BC142: of:=IF([.$BG142]=0;[.$CA142]; IF([.$BG142]>0; [.$CA142]/([.$BA142]+([.$BG142]*1.5)))*[.$BA142])-[.$BE142] -> 0 | BE142: of:=[.BU142] -> 0 | BG142: of:=[.$G142]+[.$K142]+[.$O142]+[.$S142]+[.$W142]+[.$AA142]+[.$AE142] -> 0 | BI142: of:=IF([.$BA142]>0;[.$BG142]*[.$CA142]/([.$BA142]+([.$BG142]*1.5))*1.5;0) -> 0 | BK142: of:=[.$H142]+[.$L142]+[.$P142]+[.$T142]+[.$X142]+[.$AB142]+[.$AF142] -> 0 | BM142: of:=[.$BK142]*([.$AR144]/8) -> 0 | BO142: of:=[.$I142]+[.$M142]+[.$Q142]+[.$U142]+[.$Y142]+[.$AC142]+[.$AG142] -> 0 | BQ142: of:=[.$BO142]*([.$AR147]/8) -> 0 | BS142: of:=[.$BC142]+[.$BI142]+[.$BM142]+[.$BQ142]+[.$BE142] -> 0 | BU142: of:=[.$AM146] -> 0 | BW142: of:=IF([.$BU142] <= [.$CA142]* 0.25; [.$BU142]; [.$CA142]* 0.25) -> 0 | BY142: of:=SUM([.$F148:.$AD148]) -> 0 | CA142: of:=SUM([.$F149:.$AD149]) -> 0 | CC142: of:=[.BC142]+[.BE142] -> 0
F143: R | G143: O | H143: V | I143: H | J143: R | K143: O | L143: V | M143: H | N143: R | O143: O | P143: V | Q143: H | R143: R | S143: O | T143: V | U143: H | V143: R | W143: O | X143: V | Y143: H | Z143: R | AA143: O | AB143: V | AC143: H | AD143: R | AE143: O | AF143: V | AG143: H | AR143: VACATION RATE
E144: ROW # | AH144: of:=IF([.AH142]>0;CONCATENATE(TEXT([.CC142];"####.##");"-Expense");"") -> .-Expense
AH145: VACATION | AK145: HOLIDAY | AM145: EXPENSES
E146: of:=[.E138]+1 -> 18 | AH146: of:=IF([.BK142]>0; IF([.AR144]>0;[.BM142]; "ENTER RATE >");0) -> 0 | AK146: of:=IF([.BO142]>0; IF([.AR147]>0;[.BQ142]; "ENTER RATE >");0) -> 0 | AR146: HOLIDAY RATE
E148: VOL | F148: of:=['Work Log'.E168] -> 0 | J148: of:=['Work Log'.I168] -> 0 | N148: of:=['Work Log'.M168] -> 0 | R148: of:=['Work Log'.Q168] -> 0 | V148: of:=['Work Log'.U168] -> 0 | Z148: of:=['Work Log'.Y168] -> 0 | AD148: of:=['Work Log'.AC168] -> 0 | AH148: of:=[.BY142] -> 0 | AK148: of:=CONCATENATE("REG = ";[.BA142]) -> REG = 0 | AL148: of:=CONCATENATE("OT = "; [.BG142]) -> OT = 0 | AM148: Prod % = | AN148: of:=[.AM142]/[.AH148] -> 
E149: D/L | F149: of:=IF([.F148];[.F148]*0.3;"") ->  | J149: of:=IF([.J148];[.J148]*0.3;"") ->  | N149: of:=IF([.N148];[.N148]*0.3;"") ->  | R149: of:=IF([.R148];[.R148]*0.3;"") ->  | V149: of:=IF([.V148];[.V148]*0.3;"") ->  | Z149: of:=IF([.Z148];[.Z148]*0.3;"") ->  | AD149: of:=IF([.AD148];[.AD148]*0.3;"") ->  | AH149: of:=SUM([.F149:.AD149]) -> 0 | AK149: of:=CONCATENATE("VAC = ";[.BK142]) -> VAC = 0 | AL149: of:=CONCATENATE("HOL = "; [.BO142]) -> HOL = 0
E150: HRS : | AH150: of:=IF([.BC150]>0; [.BC150];"") ->  | AK150: of:=[.BI150] -> 0 | AM150: of:=[.BS150] -> 0 | AW150: of:=[.E154] -> 19 | AY150: of:=[.B150] -> 0 | BA150: of:=[.$F150]+[.$J150]+[.$N150]+[.$R150]+[.$V150]+[.$Z150]+[.$AD150] -> 0 | BC150: of:=IF([.$BG150]=0;[.$CA150]; IF([.$BG150]>0; [.$CA150]/([.$BA150]+([.$BG150]*1.5)))*[.$BA150])-[.$BE150] -> 0 | BE150: of:=[.BU150] -> 0 | BG150: of:=[.$G150]+[.$K150]+[.$O150]+[.$S150]+[.$W150]+[.$AA150]+[.$AE150] -> 0 | BI150: of:=IF([.$BA150]>0;[.$BG150]*[.$CA150]/([.$BA150]+([.$BG150]*1.5))*1.5;0) -> 0 | BK150: of:=[.$H150]+[.$L150]+[.$P150]+[.$T150]+[.$X150]+[.$AB150]+[.$AF150] -> 0 | BM150: of:=[.$BK150]*([.$AR152]/8) -> 0 | BO150: of:=[.$I150]+[.$M150]+[.$Q150]+[.$U150]+[.$Y150]+[.$AC150]+[.$AG150] -> 0 | BQ150: of:=[.$BO150]*([.$AR155]/8) -> 0 | BS150: of:=[.$BC150]+[.$BI150]+[.$BM150]+[.$BQ150]+[.$BE150] -> 0 | BU150: of:=[.$AM154] -> 0 | BW150: of:=IF([.$BU150] <= [.$CA150]* 0.25; [.$BU150]; [.$CA150]* 0.25) -> 0 | BY150: of:=SUM([.$F156:.$AD156]) -> 0 | CA150: of:=SUM([.$F157:.$AD157]) -> 0 | CC150: of:=[.BC150]+[.BE150] -> 0
F151: R | G151: O | H151: V | I151: H | J151: R | K151: O | L151: V | M151: H | N151: R | O151: O | P151: V | Q151: H | R151: R | S151: O | T151: V | U151: H | V151: R | W151: O | X151: V | Y151: H | Z151: R | AA151: O | AB151: V | AC151: H | AD151: R | AE151: O | AF151: V | AG151: H | AR151: VACATION RATE
E152: ROW # | AH152: of:=IF([.AH150]>0;CONCATENATE(TEXT([.CC150];"####.##");"-Expense");"") -> .-Expense
AH153: VACATION | AK153: HOLIDAY | AM153: EXPENSES
E154: of:=[.E146]+1 -> 19 | AH154: of:=IF([.BK150]>0; IF([.AR152]>0;[.BM150]; "ENTER RATE >");0) -> 0 | AK154: of:=IF([.BO150]>0; IF([.AR155]>0;[.BQ150]; "ENTER RATE >");0) -> 0 | AR154: HOLIDAY RATE
E156: VOL | F156: of:=['Work Log'.E177] -> 0 | J156: of:=['Work Log'.I177] -> 0 | N156: of:=['Work Log'.M177] -> 0 | R156: of:=['Work Log'.Q177] -> 0 | V156: of:=['Work Log'.U177] -> 0 | Z156: of:=['Work Log'.Y177] -> 0 | AD156: of:=['Work Log'.AC177] -> 0 | AH156: of:=[.BY150] -> 0 | AK156: of:=CONCATENATE("REG = ";[.BA150]) -> REG = 0 | AL156: of:=CONCATENATE("OT = "; [.BG150]) -> OT = 0 | AM156: Prod % = | AN156: of:=[.AM150]/[.AH156] -> 
E157: D/L | F157: of:=IF([.F156];[.F156]*0.3;"") ->  | J157: of:=IF([.J156];[.J156]*0.3;"") ->  | N157: of:=IF([.N156];[.N156]*0.3;"") ->  | R157: of:=IF([.R156];[.R156]*0.3;"") ->  | V157: of:=IF([.V156];[.V156]*0.3;"") ->  | Z157: of:=IF([.Z156];[.Z156]*0.3;"") ->  | AD157: of:=IF([.AD156];[.AD156]*0.3;"") ->  | AH157: of:=SUM([.F157:.AD157]) -> 0 | AK157: of:=CONCATENATE("VAC = ";[.BK150]) -> VAC = 0 | AL157: of:=CONCATENATE("HOL = "; [.BO150]) -> HOL = 0
E158: HRS : | AH158: of:=IF([.BC158]>0; [.BC158];"") ->  | AK158: of:=[.BI158] -> 0 | AM158: of:=[.BS158] -> 0 | AW158: of:=[.E162] -> 20 | AY158: of:=[.B158] -> 0 | BA158: of:=[.$F158]+[.$J158]+[.$N158]+[.$R158]+[.$V158]+[.$Z158]+[.$AD158] -> 0 | BC158: of:=IF([.$BG158]=0;[.$CA158]; IF([.$BG158]>0; [.$CA158]/([.$BA158]+([.$BG158]*1.5)))*[.$BA158])-[.$BE158] -> 0 | BE158: of:=[.BU158] -> 0 | BG158: of:=[.$G158]+[.$K158]+[.$O158]+[.$S158]+[.$W158]+[.$AA158]+[.$AE158] -> 0 | BI158: of:=IF([.$BA158]>0;[.$BG158]*[.$CA158]/([.$BA158]+([.$BG158]*1.5))*1.5;0) -> 0 | BK158: of:=[.$H158]+[.$L158]+[.$P158]+[.$T158]+[.$X158]+[.$AB158]+[.$AF158] -> 0 | BM158: of:=[.$BK158]*([.$AR160]/8) -> 0 | BO158: of:=[.$I158]+[.$M158]+[.$Q158]+[.$U158]+[.$Y158]+[.$AC158]+[.$AG158] -> 0 | BQ158: of:=[.$BO158]*([.$AR163]/8) -> 0 | BS158: of:=[.$BC158]+[.$BI158]+[.$BM158]+[.$BQ158]+[.$BE158] -> 0 | BU158: of:=[.$AM162] -> 0 | BW158: of:=IF([.$BU158] <= [.$CA158]* 0.25; [.$BU158]; [.$CA158]* 0.25) -> 0 | BY158: of:=SUM([.$F164:.$AD164]) -> 0 | CA158: of:=SUM([.$F165:.$AD165]) -> 0 | CC158: of:=[.BC158]+[.BE158] -> 0
F159: R | G159: O | H159: V | I159: H | J159: R | K159: O | L159: V | M159: H | N159: R | O159: O | P159: V | Q159: H | R159: R | S159: O | T159: V | U159: H | V159: R | W159: O | X159: V | Y159: H | Z159: R | AA159: O | AB159: V | AC159: H | AD159: R | AE159: O | AF159: V | AG159: H | AR159: VACATION RATE
E160: ROW # | AH160: of:=IF([.AH158]>0;CONCATENATE(TEXT([.CC158];"####.##");"-Expense");"") -> .-Expense
AH161: VACATION | AK161: HOLIDAY | AM161: EXPENSES
E162: of:=[.E154]+1 -> 20 | AH162: of:=IF([.BK158]>0; IF([.AR160]>0;[.BM158]; "ENTER RATE >");0) -> 0 | AK162: of:=IF([.BO158]>0; IF([.AR163]>0;[.BQ158]; "ENTER RATE >");0) -> 0 | AR162: HOLIDAY RATE
E164: VOL | F164: of:=['Work Log'.E186] -> 0 | J164: of:=['Work Log'.I186] -> 0 | N164: of:=['Work Log'.M186] -> 0 | R164: of:=['Work Log'.Q186] -> 0 | V164: of:=['Work Log'.U186] -> 0 | Z164: of:=['Work Log'.Y186] -> 0 | AD164: of:=['Work Log'.AC186] -> 0 | AH164: of:=[.BY158] -> 0 | AK164: of:=CONCATENATE("REG = ";[.BA158]) -> REG = 0 | AL164: of:=CONCATENATE("OT = "; [.BG158]) -> OT = 0 | AM164: Prod % = | AN164: of:=[.AM158]/[.AH164] -> 
E165: D/L | F165: of:=IF([.F164];[.F164]*0.3;"") ->  | J165: of:=IF([.J164];[.J164]*0.3;"") ->  | N165: of:=IF([.N164];[.N164]*0.3;"") ->  | R165: of:=IF([.R164];[.R164]*0.3;"") ->  | V165: of:=IF([.V164];[.V164]*0.3;"") ->  | Z165: of:=IF([.Z164];[.Z164]*0.3;"") ->  | AD165: of:=IF([.AD164];[.AD164]*0.3;"") ->  | AH165: of:=SUM([.F165:.AD165]) -> 0 | AK165: of:=CONCATENATE("VAC = ";[.BK158]) -> VAC = 0 | AL165: of:=CONCATENATE("HOL = "; [.BO158]) -> HOL = 0
E166: HRS : | AH166: of:=IF([.BC166]>0; [.BC166];"") ->  | AK166: of:=[.BI166] -> 0 | AM166: of:=[.BS166] -> 0 | AW166: of:=[.E170] -> 21 | AY166: of:=[.B166] -> 0 | BA166: of:=[.$F166]+[.$J166]+[.$N166]+[.$R166]+[.$V166]+[.$Z166]+[.$AD166] -> 0 | BC166: of:=IF([.$BG166]=0;[.$CA166]; IF([.$BG166]>0; [.$CA166]/([.$BA166]+([.$BG166]*1.5)))*[.$BA166])-[.$BE166] -> 0 | BE166: of:=[.BU166] -> 0 | BG166: of:=[.$G166]+[.$K166]+[.$O166]+[.$S166]+[.$W166]+[.$AA166]+[.$AE166] -> 0 | BI166: of:=IF([.$BA166]>0;[.$BG166]*[.$CA166]/([.$BA166]+([.$BG166]*1.5))*1.5;0) -> 0 | BK166: of:=[.$H166]+[.$L166]+[.$P166]+[.$T166]+[.$X166]+[.$AB166]+[.$AF166] -> 0 | BM166: of:=[.$BK166]*([.$AR168]/8) -> 0 | BO166: of:=[.$I166]+[.$M166]+[.$Q166]+[.$U166]+[.$Y166]+[.$AC166]+[.$AG166] -> 0 | BQ166: of:=[.$BO166]*([.$AR171]/8) -> 0 | BS166: of:=[.$BC166]+[.$BI166]+[.$BM166]+[.$BQ166]+[.$BE166] -> 0 | BU166: of:=[.$AM170] -> 0 | BW166: of:=IF([.$BU166] <= [.$CA166]* 0.25; [.$BU166]; [.$CA166]* 0.25) -> 0 | BY166: of:=SUM([.$F172:.$AD172]) -> 0 | CA166: of:=SUM([.$F173:.$AD173]) -> 0 | CC166: of:=[.BC166]+[.BE166] -> 0
F167: R | G167: O | H167: V | I167: H | J167: R | K167: O | L167: V | M167: H | N167: R | O167: O | P167: V | Q167: H | R167: R | S167: O | T167: V | U167: H | V167: R | W167: O | X167: V | Y167: H | Z167: R | AA167: O | AB167: V | AC167: H | AD167: R | AE167: O | AF167: V | AG167: H | AR167: VACATION RATE
E168: ROW # | AH168: of:=IF([.AH166]>0;CONCATENATE(TEXT([.CC166];"####.##");"-Expense");"") -> .-Expense
AH169: VACATION | AK169: HOLIDAY | AM169: EXPENSES
E170: of:=[.E162]+1 -> 21 | AH170: of:=IF([.BK166]>0; IF([.AR168]>0;[.BM166]; "ENTER RATE >");0) -> 0 | AK170: of:=IF([.BO166]>0; IF([.AR171]>0;[.BQ166]; "ENTER RATE >");0) -> 0 | AR170: HOLIDAY RATE
E172: VOL | F172: of:=['Work Log'.E196] -> 0 | J172: of:=['Work Log'.I196] -> 0 | N172: of:=['Work Log'.M196] -> 0 | R172: of:=['Work Log'.Q196] -> 0 | V172: of:=['Work Log'.U196] -> 0 | Z172: of:=['Work Log'.Y196] -> 0 | AD172: of:=['Work Log'.AC196] -> 0 | AH172: of:=[.BY166] -> 0 | AK172: of:=CONCATENATE("REG = ";[.BA166]) -> REG = 0 | AL172: of:=CONCATENATE("OT = "; [.BG166]) -> OT = 0 | AM172: Prod % = | AN172: of:=[.AM166]/[.AH172] -> 
E173: D/L | F173: of:=IF([.F172];[.F172]*0.3;"") ->  | J173: of:=IF([.J172];[.J172]*0.3;"") ->  | N173: of:=IF([.N172];[.N172]*0.3;"") ->  | R173: of:=IF([.R172];[.R172]*0.3;"") ->  | V173: of:=IF([.V172];[.V172]*0.3;"") ->  | Z173: of:=IF([.Z172];[.Z172]*0.3;"") ->  | AD173: of:=IF([.AD172];[.AD172]*0.3;"") ->  | AH173: of:=SUM([.F173:.AD173]) -> 0 | AK173: of:=CONCATENATE("VAC = ";[.BK166]) -> VAC = 0 | AL173: of:=CONCATENATE("HOL = "; [.BO166]) -> HOL = 0
E174: HRS : | AH174: of:=IF([.BC174]>0; [.BC174];"") ->  | AK174: of:=[.BI174] -> 0 | AM174: of:=[.BS174] -> 0 | AW174: of:=[.E178] -> 22 | AY174: of:=[.B174] -> 0 | BA174: of:=[.$F174]+[.$J174]+[.$N174]+[.$R174]+[.$V174]+[.$Z174]+[.$AD174] -> 0 | BC174: of:=IF([.$BG174]=0;[.$CA174]; IF([.$BG174]>0; [.$CA174]/([.$BA174]+([.$BG174]*1.5)))*[.$BA174])-[.$BE174] -> 0 | BE174: of:=[.BU174] -> 0 | BG174: of:=[.$G174]+[.$K174]+[.$O174]+[.$S174]+[.$W174]+[.$AA174]+[.$AE174] -> 0 | BI174: of:=IF([.$BA174]>0;[.$BG174]*[.$CA174]/([.$BA174]+([.$BG174]*1.5))*1.5;0) -> 0 | BK174: of:=[.$H174]+[.$L174]+[.$P174]+[.$T174]+[.$X174]+[.$AB174]+[.$AF174] -> 0 | BM174: of:=[.$BK174]*([.$AR176]/8) -> 0 | BO174: of:=[.$I174]+[.$M174]+[.$Q174]+[.$U174]+[.$Y174]+[.$AC174]+[.$AG174] -> 0 | BQ174: of:=[.$BO174]*([.$AR179]/8) -> 0 | BS174: of:=[.$BC174]+[.$BI174]+[.$BM174]+[.$BQ174]+[.$BE174] -> 0 | BU174: of:=[.$AM178] -> 0 | BW174: of:=IF([.$BU174] <= [.$CA174]* 0.25; [.$BU174]; [.$CA174]* 0.25) -> 0 | BY174: of:=SUM([.$F180:.$AD180]) -> 0 | CA174: of:=SUM([.$F181:.$AD181]) -> 0 | CC174: of:=[.BC174]+[.BE174] -> 0
F175: R | G175: O | H175: V | I175: H | J175: R | K175: O | L175: V | M175: H | N175: R | O175: O | P175: V | Q175: H | R175: R | S175: O | T175: V | U175: H | V175: R | W175: O | X175: V | Y175: H | Z175: R | AA175: O | AB175: V | AC175: H | AD175: R | AE175: O | AF175: V | AG175: H | AR175: VACATION RATE
E176: ROW # | AH176: of:=IF([.AH174]>0;CONCATENATE(TEXT([.CC174];"####.##");"-Expense");"") -> .-Expense
AH177: VACATION | AK177: HOLIDAY | AM177: EXPENSES
E178: of:=[.E170]+1 -> 22 | AH178: of:=IF([.BK174]>0; IF([.AR176]>0;[.BM174]; "ENTER RATE >");0) -> 0 | AK178: of:=IF([.BO174]>0; IF([.AR179]>0;[.BQ174]; "ENTER RATE >");0) -> 0 | AR178: HOLIDAY RATE
E180: VOL | F180: of:=['Work Log'.E205] -> 0 | J180: of:=['Work Log'.I205] -> 0 | N180: of:=['Work Log'.M205] -> 0 | R180: of:=['Work Log'.Q205] -> 0 | V180: of:=['Work Log'.U205] -> 0 | Z180: of:=['Work Log'.Y205] -> 0 | AD180: of:=['Work Log'.AC205] -> 0 | AH180: of:=[.BY174] -> 0 | AK180: of:=CONCATENATE("REG = ";[.BA174]) -> REG = 0 | AL180: of:=CONCATENATE("OT = "; [.BG174]) -> OT = 0 | AM180: Prod % = | AN180: of:=[.AM174]/[.AH180] -> 
E181: D/L | F181: of:=IF([.F180];[.F180]*0.3;"") ->  | J181: of:=IF([.J180];[.J180]*0.3;"") ->  | N181: of:=IF([.N180];[.N180]*0.3;"") ->  | R181: of:=IF([.R180];[.R180]*0.3;"") ->  | V181: of:=IF([.V180];[.V180]*0.3;"") ->  | Z181: of:=IF([.Z180];[.Z180]*0.3;"") ->  | AD181: of:=IF([.AD180];[.AD180]*0.3;"") ->  | AH181: of:=SUM([.F181:.AD181]) -> 0 | AK181: of:=CONCATENATE("VAC = ";[.BK174]) -> VAC = 0 | AL181: of:=CONCATENATE("HOL = "; [.BO174]) -> HOL = 0
E182: HRS : | AH182: of:=IF([.BC182]>0; [.BC182];"") ->  | AK182: of:=[.BI182] -> 0 | AM182: of:=[.BS182] -> 0 | AW182: of:=[.E186] -> 23 | AY182: of:=[.B182] -> 0 | BA182: of:=[.$F182]+[.$J182]+[.$N182]+[.$R182]+[.$V182]+[.$Z182]+[.$AD182] -> 0 | BC182: of:=IF([.$BG182]=0;[.$CA182]; IF([.$BG182]>0; [.$CA182]/([.$BA182]+([.$BG182]*1.5)))*[.$BA182])-[.$BE182] -> 0 | BE182: of:=[.BU182] -> 0 | BG182: of:=[.$G182]+[.$K182]+[.$O182]+[.$S182]+[.$W182]+[.$AA182]+[.$AE182] -> 0 | BI182: of:=IF([.$BA182]>0;[.$BG182]*[.$CA182]/([.$BA182]+([.$BG182]*1.5))*1.5;0) -> 0 | BK182: of:=[.$H182]+[.$L182]+[.$P182]+[.$T182]+[.$X182]+[.$AB182]+[.$AF182] -> 0 | BM182: of:=[.$BK182]*([.$AR184]/8) -> 0 | BO182: of:=[.$I182]+[.$M182]+[.$Q182]+[.$U182]+[.$Y182]+[.$AC182]+[.$AG182] -> 0 | BQ182: of:=[.$BO182]*([.$AR187]/8) -> 0 | BS182: of:=[.$BC182]+[.$BI182]+[.$BM182]+[.$BQ182]+[.$BE182] -> 0 | BU182: of:=[.$AM186] -> 0 | BW182: of:=IF([.$BU182] <= [.$CA182]* 0.25; [.$BU182]; [.$CA182]* 0.25) -> 0 | BY182: of:=SUM([.$F188:.$AD188]) -> 0 | CA182: of:=SUM([.$F189:.$AD189]) -> 0 | CC182: of:=[.BC182]+[.BE182] -> 0
F183: R | G183: O | H183: V | I183: H | J183: R | K183: O | L183: V | M183: H | N183: R | O183: O | P183: V | Q183: H | R183: R | S183: O | T183: V | U183: H | V183: R | W183: O | X183: V | Y183: H | Z183: R | AA183: O | AB183: V | AC183: H | AD183: R | AE183: O | AF183: V | AG183: H | AR183: VACATION RATE
E184: ROW # | AH184: of:=IF([.AH182]>0;CONCATENATE(TEXT([.CC182];"####.##");"-Expense");"") -> .-Expense
AH185: VACATION | AK185: HOLIDAY | AM185: EXPENSES
E186: of:=[.E178]+1 -> 23 | AH186: of:=IF([.BK182]>0; IF([.AR184]>0;[.BM182]; "ENTER RATE >");0) -> 0 | AK186: of:=IF([.BO182]>0; IF([.AR187]>0;[.BQ182]; "ENTER RATE >");0) -> 0 | AR186: HOLIDAY RATE
E188: VOL | F188: of:=['Work Log'.E214] -> 0 | J188: of:=['Work Log'.I214] -> 0 | N188: of:=['Work Log'.M214] -> 0 | R188: of:=['Work Log'.Q214] -> 0 | V188: of:=['Work Log'.U214] -> 0 | Z188: of:=['Work Log'.Y214] -> 0 | AD188: of:=['Work Log'.AC214] -> 0 | AH188: of:=[.BY182] -> 0 | AK188: of:=CONCATENATE("REG = ";[.BA182]) -> REG = 0 | AL188: of:=CONCATENATE("OT = "; [.BG182]) -> OT = 0 | AM188: Prod % = | AN188: of:=[.AM182]/[.AH188] -> 
E189: D/L | F189: of:=IF([.F188];[.F188]*0.3;"") ->  | J189: of:=IF([.J188];[.J188]*0.3;"") ->  | N189: of:=IF([.N188];[.N188]*0.3;"") ->  | R189: of:=IF([.R188];[.R188]*0.3;"") ->  | V189: of:=IF([.V188];[.V188]*0.3;"") ->  | Z189: of:=IF([.Z188];[.Z188]*0.3;"") ->  | AD189: of:=IF([.AD188];[.AD188]*0.3;"") ->  | AH189: of:=SUM([.F189:.AD189]) -> 0 | AK189: of:=CONCATENATE("VAC = ";[.BK182]) -> VAC = 0 | AL189: of:=CONCATENATE("HOL = "; [.BO182]) -> HOL = 0
E190: HRS : | AH190: of:=IF([.BC190]>0; [.BC190];"") ->  | AK190: of:=[.BI190] -> 0 | AM190: of:=[.BS190] -> 0 | AW190: of:=[.E194] -> 24 | AY190: of:=[.B190] -> 0 | BA190: of:=[.$F190]+[.$J190]+[.$N190]+[.$R190]+[.$V190]+[.$Z190]+[.$AD190] -> 0 | BC190: of:=IF([.$BG190]=0;[.$CA190]; IF([.$BG190]>0; [.$CA190]/([.$BA190]+([.$BG190]*1.5)))*[.$BA190])-[.$BE190] -> 0 | BE190: of:=[.BU190] -> 0 | BG190: of:=[.$G190]+[.$K190]+[.$O190]+[.$S190]+[.$W190]+[.$AA190]+[.$AE190] -> 0 | BI190: of:=IF([.$BA190]>0;[.$BG190]*[.$CA190]/([.$BA190]+([.$BG190]*1.5))*1.5;0) -> 0 | BK190: of:=[.$H190]+[.$L190]+[.$P190]+[.$T190]+[.$X190]+[.$AB190]+[.$AF190] -> 0 | BM190: of:=[.$BK190]*([.$AR192]/8) -> 0 | BO190: of:=[.$I190]+[.$M190]+[.$Q190]+[.$U190]+[.$Y190]+[.$AC190]+[.$AG190] -> 0 | BQ190: of:=[.$BO190]*([.$AR195]/8) -> 0 | BS190: of:=[.$BC190]+[.$BI190]+[.$BM190]+[.$BQ190]+[.$BE190] -> 0 | BU190: of:=[.$AM194] -> 0 | BW190: of:=IF([.$BU190] <= [.$CA190]* 0.25; [.$BU190]; [.$CA190]* 0.25) -> 0 | BY190: of:=SUM([.$F196:.$AD196]) -> 0 | CA190: of:=SUM([.$F197:.$AD197]) -> 0 | CC190: of:=[.BC190]+[.BE190] -> 0
F191: R | G191: O | H191: V | I191: H | J191: R | K191: O | L191: V | M191: H | N191: R | O191: O | P191: V | Q191: H | R191: R | S191: O | T191: V | U191: H | V191: R | W191: O | X191: V | Y191: H | Z191: R | AA191: O | AB191: V | AC191: H | AD191: R | AE191: O | AF191: V | AG191: H | AR191: VACATION RATE
E192: ROW # | AH192: of:=IF([.AH190]>0;CONCATENATE(TEXT([.CC190];"####.##");"-Expense");"") -> .-Expense
AH193: VACATION | AK193: HOLIDAY | AM193: EXPENSES
E194: of:=[.E186]+1 -> 24 | AH194: of:=IF([.BK190]>0; IF([.AR192]>0;[.BM190]; "ENTER RATE >");0) -> 0 | AK194: of:=IF([.BO190]>0; IF([.AR195]>0;[.BQ190]; "ENTER RATE >");0) -> 0 | AR194: HOLIDAY RATE
E196: VOL | F196: of:=['Work Log'.E223] -> 0 | J196: of:=['Work Log'.I223] -> 0 | N196: of:=['Work Log'.M223] -> 0 | R196: of:=['Work Log'.Q223] -> 0 | V196: of:=['Work Log'.U223] -> 0 | Z196: of:=['Work Log'.Y223] -> 0 | AD196: of:=['Work Log'.AC223] -> 0 | AH196: of:=[.BY190] -> 0 | AK196: of:=CONCATENATE("REG = ";[.BA190]) -> REG = 0 | AL196: of:=CONCATENATE("OT = "; [.BG190]) -> OT = 0 | AM196: Prod % = | AN196: of:=[.AM190]/[.AH196] -> 
E197: D/L | F197: of:=IF([.F196];[.F196]*0.3;"") ->  | J197: of:=IF([.J196];[.J196]*0.3;"") ->  | N197: of:=IF([.N196];[.N196]*0.3;"") ->  | R197: of:=IF([.R196];[.R196]*0.3;"") ->  | V197: of:=IF([.V196];[.V196]*0.3;"") ->  | Z197: of:=IF([.Z196];[.Z196]*0.3;"") ->  | AD197: of:=IF([.AD196];[.AD196]*0.3;"") ->  | AH197: of:=SUM([.F197:.AD197]) -> 0 | AK197: of:=CONCATENATE("VAC = ";[.BK190]) -> VAC = 0 | AL197: of:=CONCATENATE("HOL = "; [.BO190]) -> HOL = 0
E198: HRS : | AH198: of:=IF([.BC198]>0; [.BC198];"") ->  | AK198: of:=[.BI198] -> 0 | AM198: of:=[.BS198] -> 0 | AW198: of:=[.E202] -> 25 | AY198: of:=[.B198] -> 0 | BA198: of:=[.$F198]+[.$J198]+[.$N198]+[.$R198]+[.$V198]+[.$Z198]+[.$AD198] -> 0 | BC198: of:=IF([.$BG198]=0;[.$CA198]; IF([.$BG198]>0; [.$CA198]/([.$BA198]+([.$BG198]*1.5)))*[.$BA198])-[.$BE198] -> 0 | BE198: of:=[.BU198] -> 0 | BG198: of:=[.$G198]+[.$K198]+[.$O198]+[.$S198]+[.$W198]+[.$AA198]+[.$AE198] -> 0 | BI198: of:=IF([.$BA198]>0;[.$BG198]*[.$CA198]/([.$BA198]+([.$BG198]*1.5))*1.5;0) -> 0 | BK198: of:=[.$H198]+[.$L198]+[.$P198]+[.$T198]+[.$X198]+[.$AB198]+[.$AF198] -> 0 | BM198: of:=[.$BK198]*([.$AR200]/8) -> 0 | BO198: of:=[.$I198]+[.$M198]+[.$Q198]+[.$U198]+[.$Y198]+[.$AC198]+[.$AG198] -> 0 | BQ198: of:=[.$BO198]*([.$AR203]/8) -> 0 | BS198: of:=[.$BC198]+[.$BI198]+[.$BM198]+[.$BQ198]+[.$BE198] -> 0 | BU198: of:=[.$AM202] -> 0 | BW198: of:=IF([.$BU198] <= [.$CA198]* 0.25; [.$BU198]; [.$CA198]* 0.25) -> 0 | BY198: of:=SUM([.$F204:.$AD204]) -> 0 | CA198: of:=SUM([.$F205:.$AD205]) -> 0 | CC198: of:=[.BC198]+[.BE198] -> 0
F199: R | G199: O | H199: V | I199: H | J199: R | K199: O | L199: V | M199: H | N199: R | O199: O | P199: V | Q199: H | R199: R | S199: O | T199: V | U199: H | V199: R | W199: O | X199: V | Y199: H | Z199: R | AA199: O | AB199: V | AC199: H | AD199: R | AE199: O | AF199: V | AG199: H | AR199: VACATION RATE
E200: ROW # | AH200: of:=IF([.AH198]>0;CONCATENATE(TEXT([.CC198];"####.##");"-Expense");"") -> .-Expense
AH201: VACATION | AK201: HOLIDAY | AM201: EXPENSES
E202: of:=[.E194]+1 -> 25 | AH202: of:=IF([.BK198]>0; IF([.AR200]>0;[.BM198]; "ENTER RATE >");0) -> 0 | AK202: of:=IF([.BO198]>0; IF([.AR203]>0;[.BQ198]; "ENTER RATE >");0) -> 0 | AR202: HOLIDAY RATE
E204: VOL | F204: of:=['Work Log'.E233] -> 0 | J204: of:=['Work Log'.I233] -> 0 | N204: of:=['Work Log'.M233] -> 0 | R204: of:=['Work Log'.Q233] -> 0 | V204: of:=['Work Log'.U233] -> 0 | Z204: of:=['Work Log'.Y233] -> 0 | AD204: of:=['Work Log'.AC233] -> 0 | AH204: of:=[.BY198] -> 0 | AK204: of:=CONCATENATE("REG = ";[.BA198]) -> REG = 0 | AL204: of:=CONCATENATE("OT = "; [.BG198]) -> OT = 0 | AM204: Prod % = | AN204: of:=[.AM198]/[.AH204] -> 
E205: D/L | F205: of:=IF([.F204];[.F204]*0.3;"") ->  | J205: of:=IF([.J204];[.J204]*0.3;"") ->  | N205: of:=IF([.N204];[.N204]*0.3;"") ->  | R205: of:=IF([.R204];[.R204]*0.3;"") ->  | V205: of:=IF([.V204];[.V204]*0.3;"") ->  | Z205: of:=IF([.Z204];[.Z204]*0.3;"") ->  | AD205: of:=IF([.AD204];[.AD204]*0.3;"") ->  | AH205: of:=SUM([.F205:.AD205]) -> 0 | AK205: of:=CONCATENATE("VAC = ";[.BK198]) -> VAC = 0 | AL205: of:=CONCATENATE("HOL = "; [.BO198]) -> HOL = 0
E206: HRS : | AH206: of:=IF([.BC206]>0; [.BC206];"") ->  | AK206: of:=[.BI206] -> 0 | AM206: of:=[.BS206] -> 0 | AW206: of:=[.E210] -> 26 | AY206: of:=[.B206] -> 0 | BA206: of:=[.$F206]+[.$J206]+[.$N206]+[.$R206]+[.$V206]+[.$Z206]+[.$AD206] -> 0 | BC206: of:=IF([.$BG206]=0;[.$CA206]; IF([.$BG206]>0; [.$CA206]/([.$BA206]+([.$BG206]*1.5)))*[.$BA206])-[.$BE206] -> 0 | BE206: of:=[.BU206] -> 0 | BG206: of:=[.$G206]+[.$K206]+[.$O206]+[.$S206]+[.$W206]+[.$AA206]+[.$AE206] -> 0 | BI206: of:=IF([.$BA206]>0;[.$BG206]*[.$CA206]/([.$BA206]+([.$BG206]*1.5))*1.5;0) -> 0 | BK206: of:=[.$H206]+[.$L206]+[.$P206]+[.$T206]+[.$X206]+[.$AB206]+[.$AF206] -> 0 | BM206: of:=[.$BK206]*([.$AR208]/8) -> 0 | BO206: of:=[.$I206]+[.$M206]+[.$Q206]+[.$U206]+[.$Y206]+[.$AC206]+[.$AG206] -> 0 | BQ206: of:=[.$BO206]*([.$AR211]/8) -> 0 | BS206: of:=[.$BC206]+[.$BI206]+[.$BM206]+[.$BQ206]+[.$BE206] -> 0 | BU206: of:=[.$AM210] -> 0 | BW206: of:=IF([.$BU206] <= [.$CA206]* 0.25; [.$BU206]; [.$CA206]* 0.25) -> 0 | BY206: of:=SUM([.$F212:.$AD212]) -> 0 | CA206: of:=SUM([.$F213:.$AD213]) -> 0 | CC206: of:=[.BC206]+[.BE206] -> 0
F207: R | G207: O | H207: V | I207: H | J207: R | K207: O | L207: V | M207: H | N207: R | O207: O | P207: V | Q207: H | R207: R | S207: O | T207: V | U207: H | V207: R | W207: O | X207: V | Y207: H | Z207: R | AA207: O | AB207: V | AC207: H | AD207: R | AE207: O | AF207: V | AG207: H | AR207: VACATION RATE
E208: ROW # | AH208: of:=IF([.AH206]>0;CONCATENATE(TEXT([.CC206];"####.##");"-Expense");"") -> .-Expense
AH209: VACATION | AK209: HOLIDAY | AM209: EXPENSES
E210: of:=[.E202]+1 -> 26 | AH210: of:=IF([.BK206]>0; IF([.AR208]>0;[.BM206]; "ENTER RATE >");0) -> 0 | AK210: of:=IF([.BO206]>0; IF([.AR211]>0;[.BQ206]; "ENTER RATE >");0) -> 0 | AR210: HOLIDAY RATE
E212: VOL | F212: of:=['Work Log'.E242] -> 0 | J212: of:=['Work Log'.I242] -> 0 | N212: of:=['Work Log'.M242] -> 0 | R212: of:=['Work Log'.Q242] -> 0 | V212: of:=['Work Log'.U242] -> 0 | Z212: of:=['Work Log'.Y242] -> 0 | AD212: of:=['Work Log'.AC242] -> 0 | AH212: of:=[.BY206] -> 0 | AK212: of:=CONCATENATE("REG = ";[.BA206]) -> REG = 0 | AL212: of:=CONCATENATE("OT = "; [.BG206]) -> OT = 0 | AM212: Prod % = | AN212: of:=[.AM206]/[.AH212] -> 
E213: D/L | F213: of:=IF([.F212];[.F212]*0.3;"") ->  | J213: of:=IF([.J212];[.J212]*0.3;"") ->  | N213: of:=IF([.N212];[.N212]*0.3;"") ->  | R213: of:=IF([.R212];[.R212]*0.3;"") ->  | V213: of:=IF([.V212];[.V212]*0.3;"") ->  | Z213: of:=IF([.Z212];[.Z212]*0.3;"") ->  | AD213: of:=IF([.AD212];[.AD212]*0.3;"") ->  | AH213: of:=SUM([.F213:.AD213]) -> 0 | AK213: of:=CONCATENATE("VAC = ";[.BK206]) -> VAC = 0 | AL213: of:=CONCATENATE("HOL = "; [.BO206]) -> HOL = 0
E214: HRS : | AH214: of:=IF([.BC214]>0; [.BC214];"") ->  | AK214: of:=[.BI214] -> 0 | AM214: of:=[.BS214] -> 0 | AW214: of:=[.E218] -> 27 | AY214: of:=[.B214] -> 0 | BA214: of:=[.$F214]+[.$J214]+[.$N214]+[.$R214]+[.$V214]+[.$Z214]+[.$AD214] -> 0 | BC214: of:=IF([.$BG214]=0;[.$CA214]; IF([.$BG214]>0; [.$CA214]/([.$BA214]+([.$BG214]*1.5)))*[.$BA214])-[.$BE214] -> 0 | BE214: of:=[.BU214] -> 0 | BG214: of:=[.$G214]+[.$K214]+[.$O214]+[.$S214]+[.$W214]+[.$AA214]+[.$AE214] -> 0 | BI214: of:=IF([.$BA214]>0;[.$BG214]*[.$CA214]/([.$BA214]+([.$BG214]*1.5))*1.5;0) -> 0 | BK214: of:=[.$H214]+[.$L214]+[.$P214]+[.$T214]+[.$X214]+[.$AB214]+[.$AF214] -> 0 | BM214: of:=[.$BK214]*([.$AR216]/8) -> 0 | BO214: of:=[.$I214]+[.$M214]+[.$Q214]+[.$U214]+[.$Y214]+[.$AC214]+[.$AG214] -> 0 | BQ214: of:=[.$BO214]*([.$AR219]/8) -> 0 | BS214: of:=[.$BC214]+[.$BI214]+[.$BM214]+[.$BQ214]+[.$BE214] -> 0 | BU214: of:=[.$AM218] -> 0 | BW214: of:=IF([.$BU214] <= [.$CA214]* 0.25; [.$BU214]; [.$CA214]* 0.25) -> 0 | BY214: of:=SUM([.$F220:.$AD220]) -> 0 | CA214: of:=SUM([.$F221:.$AD221]) -> 0 | CC214: of:=[.BC214]+[.BE214] -> 0
F215: R | G215: O | H215: V | I215: H | J215: R | K215: O | L215: V | M215: H | N215: R | O215: O | P215: V | Q215: H | R215: R | S215: O | T215: V | U215: H | V215: R | W215: O | X215: V | Y215: H | Z215: R | AA215: O | AB215: V | AC215: H | AD215: R | AE215: O | AF215: V | AG215: H | AR215: VACATION RATE
E216: ROW # | AH216: of:=IF([.AH214]>0;CONCATENATE(TEXT([.CC214];"####.##");"-Expense");"") -> .-Expense
AH217: VACATION | AK217: HOLIDAY | AM217: EXPENSES
E218: of:=[.E210]+1 -> 27 | AH218: of:=IF([.BK214]>0; IF([.AR216]>0;[.BM214]; "ENTER RATE >");0) -> 0 | AK218: of:=IF([.BO214]>0; IF([.AR219]>0;[.BQ214]; "ENTER RATE >");0) -> 0 | AR218: HOLIDAY RATE
E220: VOL | F220: of:=['Work Log'.E251] -> 0 | J220: of:=['Work Log'.I251] -> 0 | N220: of:=['Work Log'.M251] -> 0 | R220: of:=['Work Log'.Q251] -> 0 | V220: of:=['Work Log'.U251] -> 0 | Z220: of:=['Work Log'.Y251] -> 0 | AD220: of:=['Work Log'.AC251] -> 0 | AH220: of:=[.BY214] -> 0 | AK220: of:=CONCATENATE("REG = ";[.BA214]) -> REG = 0 | AL220: of:=CONCATENATE("OT = "; [.BG214]) -> OT = 0 | AM220: Prod % = | AN220: of:=[.AM214]/[.AH220] -> 
E221: D/L | F221: of:=IF([.F220];[.F220]*0.3;"") ->  | J221: of:=IF([.J220];[.J220]*0.3;"") ->  | N221: of:=IF([.N220];[.N220]*0.3;"") ->  | R221: of:=IF([.R220];[.R220]*0.3;"") ->  | V221: of:=IF([.V220];[.V220]*0.3;"") ->  | Z221: of:=IF([.Z220];[.Z220]*0.3;"") ->  | AD221: of:=IF([.AD220];[.AD220]*0.3;"") ->  | AH221: of:=SUM([.F221:.AD221]) -> 0 | AK221: of:=CONCATENATE("VAC = ";[.BK214]) -> VAC = 0 | AL221: of:=CONCATENATE("HOL = "; [.BO214]) -> HOL = 0
E222: HRS : | AH222: of:=IF([.BC222]>0; [.BC222];"") ->  | AK222: of:=[.BI222] -> 0 | AM222: of:=[.BS222] -> 0 | AW222: of:=[.E226] -> 28 | AY222: of:=[.B222] -> 0 | BA222: of:=[.$F222]+[.$J222]+[.$N222]+[.$R222]+[.$V222]+[.$Z222]+[.$AD222] -> 0 | BC222: of:=IF([.$BG222]=0;[.$CA222]; IF([.$BG222]>0; [.$CA222]/([.$BA222]+([.$BG222]*1.5)))*[.$BA222])-[.$BE222] -> 0 | BE222: of:=[.BU222] -> 0 | BG222: of:=[.$G222]+[.$K222]+[.$O222]+[.$S222]+[.$W222]+[.$AA222]+[.$AE222] -> 0 | BI222: of:=IF([.$BA222]>0;[.$BG222]*[.$CA222]/([.$BA222]+([.$BG222]*1.5))*1.5;0) -> 0 | BK222: of:=[.$H222]+[.$L222]+[.$P222]+[.$T222]+[.$X222]+[.$AB222]+[.$AF222] -> 0 | BM222: of:=[.$BK222]*([.$AR224]/8) -> 0 | BO222: of:=[.$I222]+[.$M222]+[.$Q222]+[.$U222]+[.$Y222]+[.$AC222]+[.$AG222] -> 0 | BQ222: of:=[.$BO222]*([.$AR227]/8) -> 0 | BS222: of:=[.$BC222]+[.$BI222]+[.$BM222]+[.$BQ222]+[.$BE222] -> 0 | BU222: of:=[.$AM226] -> 0 | BW222: of:=IF([.$BU222] <= [.$CA222]* 0.25; [.$BU222]; [.$CA222]* 0.25) -> 0 | BY222: of:=SUM([.$F228:.$AD228]) -> 0 | CA222: of:=SUM([.$F229:.$AD229]) -> 0 | CC222: of:=[.BC222]+[.BE222] -> 0
F223: R | G223: O | H223: V | I223: H | J223: R | K223: O | L223: V | M223: H | N223: R | O223: O | P223: V | Q223: H | R223: R | S223: O | T223: V | U223: H | V223: R | W223: O | X223: V | Y223: H | Z223: R | AA223: O | AB223: V | AC223: H | AD223: R | AE223: O | AF223: V | AG223: H | AR223: VACATION RATE
E224: ROW # | AH224: of:=IF([.AH222]>0;CONCATENATE(TEXT([.CC222];"####.##");"-Expense");"") -> .-Expense
AH225: VACATION | AK225: HOLIDAY | AM225: EXPENSES
E226: of:=[.E218]+1 -> 28 | AH226: of:=IF([.BK222]>0; IF([.AR224]>0;[.BM222]; "ENTER RATE >");0) -> 0 | AK226: of:=IF([.BO222]>0; IF([.AR227]>0;[.BQ222]; "ENTER RATE >");0) -> 0 | AR226: HOLIDAY RATE
E228: VOL | F228: of:=['Work Log'.E260] -> 0 | J228: of:=['Work Log'.I260] -> 0 | N228: of:=['Work Log'.M260] -> 0 | R228: of:=['Work Log'.Q260] -> 0 | V228: of:=['Work Log'.U260] -> 0 | Z228: of:=['Work Log'.Y260] -> 0 | AD228: of:=['Work Log'.AC260] -> 0 | AH228: of:=[.BY222] -> 0 | AK228: of:=CONCATENATE("REG = ";[.BA222]) -> REG = 0 | AL228: of:=CONCATENATE("OT = "; [.BG222]) -> OT = 0 | AM228: Prod % = | AN228: of:=[.AM222]/[.AH228] -> 
E229: D/L | F229: of:=IF([.F228];[.F228]*0.3;"") ->  | J229: of:=IF([.J228];[.J228]*0.3;"") ->  | N229: of:=IF([.N228];[.N228]*0.3;"") ->  | R229: of:=IF([.R228];[.R228]*0.3;"") ->  | V229: of:=IF([.V228];[.V228]*0.3;"") ->  | Z229: of:=IF([.Z228];[.Z228]*0.3;"") ->  | AD229: of:=IF([.AD228];[.AD228]*0.3;"") ->  | AH229: of:=SUM([.F229:.AD229]) -> 0 | AK229: of:=CONCATENATE("VAC = ";[.BK222]) -> VAC = 0 | AL229: of:=CONCATENATE("HOL = "; [.BO222]) -> HOL = 0
E230: HRS : | AH230: of:=IF([.BC230]>0; [.BC230];"") ->  | AK230: of:=[.BI230] -> 0 | AM230: of:=[.BS230] -> 0 | AW230: of:=[.E234] -> 29 | AY230: of:=[.B230] -> 0 | BA230: of:=[.$F230]+[.$J230]+[.$N230]+[.$R230]+[.$V230]+[.$Z230]+[.$AD230] -> 0 | BC230: of:=IF([.$BG230]=0;[.$CA230]; IF([.$BG230]>0; [.$CA230]/([.$BA230]+([.$BG230]*1.5)))*[.$BA230])-[.$BE230] -> 0 | BE230: of:=[.BU230] -> 0 | BG230: of:=[.$G230]+[.$K230]+[.$O230]+[.$S230]+[.$W230]+[.$AA230]+[.$AE230] -> 0 | BI230: of:=IF([.$BA230]>0;[.$BG230]*[.$CA230]/([.$BA230]+([.$BG230]*1.5))*1.5;0) -> 0 | BK230: of:=[.$H230]+[.$L230]+[.$P230]+[.$T230]+[.$X230]+[.$AB230]+[.$AF230] -> 0 | BM230: of:=[.$BK230]*([.$AR232]/8) -> 0 | BO230: of:=[.$I230]+[.$M230]+[.$Q230]+[.$U230]+[.$Y230]+[.$AC230]+[.$AG230] -> 0 | BQ230: of:=[.$BO230]*([.$AR235]/8) -> 0 | BS230: of:=[.$BC230]+[.$BI230]+[.$BM230]+[.$BQ230]+[.$BE230] -> 0 | BU230: of:=[.$AM234] -> 0 | BW230: of:=IF([.$BU230] <= [.$CA230]* 0.25; [.$BU230]; [.$CA230]* 0.25) -> 0 | BY230: of:=SUM([.$F236:.$AD236]) -> 0 | CA230: of:=SUM([.$F237:.$AD237]) -> 0 | CC230: of:=[.BC230]+[.BE230] -> 0
F231: R | G231: O | H231: V | I231: H | J231: R | K231: O | L231: V | M231: H | N231: R | O231: O | P231: V | Q231: H | R231: R | S231: O | T231: V | U231: H | V231: R | W231: O | X231: V | Y231: H | Z231: R | AA231: O | AB231: V | AC231: H | AD231: R | AE231: O | AF231: V | AG231: H | AR231: VACATION RATE
E232: ROW # | AH232: of:=IF([.AH230]>0;CONCATENATE(TEXT([.CC230];"####.##");"-Expense");"") -> .-Expense
AH233: VACATION | AK233: HOLIDAY | AM233: EXPENSES
E234: of:=[.E226]+1 -> 29 | AH234: of:=IF([.BK230]>0; IF([.AR232]>0;[.BM230]; "ENTER RATE >");0) -> 0 | AK234: of:=IF([.BO230]>0; IF([.AR235]>0;[.BQ230]; "ENTER RATE >");0) -> 0 | AR234: HOLIDAY RATE
E236: VOL | F236: of:=['Work Log'.E270] -> 0 | J236: of:=['Work Log'.I270] -> 0 | N236: of:=['Work Log'.M270] -> 0 | R236: of:=['Work Log'.Q270] -> 0 | V236: of:=['Work Log'.U270] -> 0 | Z236: of:=['Work Log'.Y270] -> 0 | AD236: of:=['Work Log'.AC270] -> 0 | AH236: of:=[.BY230] -> 0 | AK236: of:=CONCATENATE("REG = ";[.BA230]) -> REG = 0 | AL236: of:=CONCATENATE("OT = "; [.BG230]) -> OT = 0 | AM236: Prod % = | AN236: of:=[.AM230]/[.AH236] -> 
E237: D/L | F237: of:=IF([.F236];[.F236]*0.3;"") ->  | J237: of:=IF([.J236];[.J236]*0.3;"") ->  | N237: of:=IF([.N236];[.N236]*0.3;"") ->  | R237: of:=IF([.R236];[.R236]*0.3;"") ->  | V237: of:=IF([.V236];[.V236]*0.3;"") ->  | Z237: of:=IF([.Z236];[.Z236]*0.3;"") ->  | AD237: of:=IF([.AD236];[.AD236]*0.3;"") ->  | AH237: of:=SUM([.F237:.AD237]) -> 0 | AK237: of:=CONCATENATE("VAC = ";[.BK230]) -> VAC = 0 | AL237: of:=CONCATENATE("HOL = "; [.BO230]) -> HOL = 0
E238: HRS : | AH238: of:=IF([.BC238]>0; [.BC238];"") ->  | AK238: of:=[.BI238] -> 0 | AM238: of:=[.BS238] -> 0 | AW238: of:=[.E242] -> 30 | AY238: of:=[.B238] -> 0 | BA238: of:=[.$F238]+[.$J238]+[.$N238]+[.$R238]+[.$V238]+[.$Z238]+[.$AD238] -> 0 | BC238: of:=IF([.$BG238]=0;[.$CA238]; IF([.$BG238]>0; [.$CA238]/([.$BA238]+([.$BG238]*1.5)))*[.$BA238])-[.$BE238] -> 0 | BE238: of:=[.BU238] -> 0 | BG238: of:=[.$G238]+[.$K238]+[.$O238]+[.$S238]+[.$W238]+[.$AA238]+[.$AE238] -> 0 | BI238: of:=IF([.$BA238]>0;[.$BG238]*[.$CA238]/([.$BA238]+([.$BG238]*1.5))*1.5;0) -> 0 | BK238: of:=[.$H238]+[.$L238]+[.$P238]+[.$T238]+[.$X238]+[.$AB238]+[.$AF238] -> 0 | BM238: of:=[.$BK238]*([.$AR240]/8) -> 0 | BO238: of:=[.$I238]+[.$M238]+[.$Q238]+[.$U238]+[.$Y238]+[.$AC238]+[.$AG238] -> 0 | BQ238: of:=[.$BO238]*([.$AR243]/8) -> 0 | BS238: of:=[.$BC238]+[.$BI238]+[.$BM238]+[.$BQ238]+[.$BE238] -> 0 | BU238: of:=[.$AM242] -> 0 | BW238: of:=IF([.$BU238] <= [.$CA238]* 0.25; [.$BU238]; [.$CA238]* 0.25) -> 0 | BY238: of:=SUM([.$F244:.$AD244]) -> 0 | CA238: of:=SUM([.$F245:.$AD245]) -> 0 | CC238: of:=[.BC238]+[.BE238] -> 0
F239: R | G239: O | H239: V | I239: H | J239: R | K239: O | L239: V | M239: H | N239: R | O239: O | P239: V | Q239: H | R239: R | S239: O | T239: V | U239: H | V239: R | W239: O | X239: V | Y239: H | Z239: R | AA239: O | AB239: V | AC239: H | AD239: R | AE239: O | AF239: V | AG239: H | AR239: VACATION RATE
E240: ROW # | AH240: of:=IF([.AH238]>0;CONCATENATE(TEXT([.CC238];"####.##");"-Expense");"") -> .-Expense
AH241: VACATION | AK241: HOLIDAY | AM241: EXPENSES
E242: of:=[.E234]+1 -> 30 | AH242: of:=IF([.BK238]>0; IF([.AR240]>0;[.BM238]; "ENTER RATE >");0) -> 0 | AK242: of:=IF([.BO238]>0; IF([.AR243]>0;[.BQ238]; "ENTER RATE >");0) -> 0 | AR242: HOLIDAY RATE
E244: VOL | F244: of:=['Work Log'.E279] -> 0 | J244: of:=['Work Log'.I279] -> 0 | N244: of:=['Work Log'.M279] -> 0 | R244: of:=['Work Log'.Q279] -> 0 | V244: of:=['Work Log'.U279] -> 0 | Z244: of:=['Work Log'.Y279] -> 0 | AD244: of:=['Work Log'.AC279] -> 0 | AH244: of:=[.BY238] -> 0 | AK244: of:=CONCATENATE("REG = ";[.BA238]) -> REG = 0 | AL244: of:=CONCATENATE("OT = "; [.BG238]) -> OT = 0 | AM244: Prod % = | AN244: of:=[.AM238]/[.AH244] -> 
E245: D/L | F245: of:=IF([.F244];[.F244]*0.3;"") ->  | J245: of:=IF([.J244];[.J244]*0.3;"") ->  | N245: of:=IF([.N244];[.N244]*0.3;"") ->  | R245: of:=IF([.R244];[.R244]*0.3;"") ->  | V245: of:=IF([.V244];[.V244]*0.3;"") ->  | Z245: of:=IF([.Z244];[.Z244]*0.3;"") ->  | AD245: of:=IF([.AD244];[.AD244]*0.3;"") ->  | AH245: of:=SUM([.F245:.AD245]) -> 0 | AK245: of:=CONCATENATE("VAC = ";[.BK238]) -> VAC = 0 | AL245: of:=CONCATENATE("HOL = "; [.BO238]) -> HOL = 0
E246: HRS : | AH246: of:=IF([.BC246]>0; [.BC246];"") ->  | AK246: of:=[.BI246] -> 0 | AM246: of:=[.BS246] -> 0 | AW246: of:=[.E250] -> 31 | AY246: of:=[.B246] -> 0 | BA246: of:=[.$F246]+[.$J246]+[.$N246]+[.$R246]+[.$V246]+[.$Z246]+[.$AD246] -> 0 | BC246: of:=IF([.$BG246]=0;[.$CA246]; IF([.$BG246]>0; [.$CA246]/([.$BA246]+([.$BG246]*1.5)))*[.$BA246])-[.$BE246] -> 0 | BE246: of:=[.BU246] -> 0 | BG246: of:=[.$G246]+[.$K246]+[.$O246]+[.$S246]+[.$W246]+[.$AA246]+[.$AE246] -> 0 | BI246: of:=IF([.$BA246]>0;[.$BG246]*[.$CA246]/([.$BA246]+([.$BG246]*1.5))*1.5;0) -> 0 | BK246: of:=[.$H246]+[.$L246]+[.$P246]+[.$T246]+[.$X246]+[.$AB246]+[.$AF246] -> 0 | BM246: of:=[.$BK246]*([.$AR248]/8) -> 0 | BO246: of:=[.$I246]+[.$M246]+[.$Q246]+[.$U246]+[.$Y246]+[.$AC246]+[.$AG246] -> 0 | BQ246: of:=[.$BO246]*([.$AR251]/8) -> 0 | BS246: of:=[.$BC246]+[.$BI246]+[.$BM246]+[.$BQ246]+[.$BE246] -> 0 | BU246: of:=[.$AM250] -> 0 | BW246: of:=IF([.$BU246] <= [.$CA246]* 0.25; [.$BU246]; [.$CA246]* 0.25) -> 0 | BY246: of:=SUM([.$F252:.$AD252]) -> 0 | CA246: of:=SUM([.$F253:.$AD253]) -> 0 | CC246: of:=[.BC246]+[.BE246] -> 0
F247: R | G247: O | H247: V | I247: H | J247: R | K247: O | L247: V | M247: H | N247: R | O247: O | P247: V | Q247: H | R247: R | S247: O | T247: V | U247: H | V247: R | W247: O | X247: V | Y247: H | Z247: R | AA247: O | AB247: V | AC247: H | AD247: R | AE247: O | AF247: V | AG247: H | AR247: VACATION RATE
E248: ROW # | AH248: of:=IF([.AH246]>0;CONCATENATE(TEXT([.CC246];"####.##");"-Expense");"") -> .-Expense
AH249: VACATION | AK249: HOLIDAY | AM249: EXPENSES
E250: of:=[.E242]+1 -> 31 | AH250: of:=IF([.BK246]>0; IF([.AR248]>0;[.BM246]; "ENTER RATE >");0) -> 0 | AK250: of:=IF([.BO246]>0; IF([.AR251]>0;[.BQ246]; "ENTER RATE >");0) -> 0 | AR250: HOLIDAY RATE
E252: VOL | F252: of:=['Work Log'.E288] -> 0 | J252: of:=['Work Log'.I288] -> 0 | N252: of:=['Work Log'.M288] -> 0 | R252: of:=['Work Log'.Q288] -> 0 | V252: of:=['Work Log'.U288] -> 0 | Z252: of:=['Work Log'.Y288] -> 0 | AD252: of:=['Work Log'.AC288] -> 0 | AH252: of:=[.BY246] -> 0 | AK252: of:=CONCATENATE("REG = ";[.BA246]) -> REG = 0 | AL252: of:=CONCATENATE("OT = "; [.BG246]) -> OT = 0 | AM252: Prod % = | AN252: of:=[.AM246]/[.AH252] -> 
E253: D/L | F253: of:=IF([.F252];[.F252]*0.3;"") ->  | J253: of:=IF([.J252];[.J252]*0.3;"") ->  | N253: of:=IF([.N252];[.N252]*0.3;"") ->  | R253: of:=IF([.R252];[.R252]*0.3;"") ->  | V253: of:=IF([.V252];[.V252]*0.3;"") ->  | Z253: of:=IF([.Z252];[.Z252]*0.3;"") ->  | AD253: of:=IF([.AD252];[.AD252]*0.3;"") ->  | AH253: of:=SUM([.F253:.AD253]) -> 0 | AK253: of:=CONCATENATE("VAC = ";[.BK246]) -> VAC = 0 | AL253: of:=CONCATENATE("HOL = "; [.BO246]) -> HOL = 0
E254: HRS : | AH254: of:=IF([.BC254]>0; [.BC254];"") ->  | AK254: of:=[.BI254] -> 0 | AM254: of:=[.BS254] -> 0 | AW254: of:=[.E258] -> 32 | AY254: of:=[.B254] -> 0 | BA254: of:=[.$F254]+[.$J254]+[.$N254]+[.$R254]+[.$V254]+[.$Z254]+[.$AD254] -> 0 | BC254: of:=IF([.$BG254]=0;[.$CA254]; IF([.$BG254]>0; [.$CA254]/([.$BA254]+([.$BG254]*1.5)))*[.$BA254])-[.$BE254] -> 0 | BE254: of:=[.BU254] -> 0 | BG254: of:=[.$G254]+[.$K254]+[.$O254]+[.$S254]+[.$W254]+[.$AA254]+[.$AE254] -> 0 | BI254: of:=IF([.$BA254]>0;[.$BG254]*[.$CA254]/([.$BA254]+([.$BG254]*1.5))*1.5;0) -> 0 | BK254: of:=[.$H254]+[.$L254]+[.$P254]+[.$T254]+[.$X254]+[.$AB254]+[.$AF254] -> 0 | BM254: of:=[.$BK254]*([.$AR256]/8) -> 0 | BO254: of:=[.$I254]+[.$M254]+[.$Q254]+[.$U254]+[.$Y254]+[.$AC254]+[.$AG254] -> 0 | BQ254: of:=[.$BO254]*([.$AR259]/8) -> 0 | BS254: of:=[.$BC254]+[.$BI254]+[.$BM254]+[.$BQ254]+[.$BE254] -> 0 | BU254: of:=[.$AM258] -> 0 | BW254: of:=IF([.$BU254] <= [.$CA254]* 0.25; [.$BU254]; [.$CA254]* 0.25) -> 0 | BY254: of:=SUM([.$F260:.$AD260]) -> 0 | CA254: of:=SUM([.$F261:.$AD261]) -> 0 | CC254: of:=[.BC254]+[.BE254] -> 0
F255: R | G255: O | H255: V | I255: H | J255: R | K255: O | L255: V | M255: H | N255: R | O255: O | P255: V | Q255: H | R255: R | S255: O | T255: V | U255: H | V255: R | W255: O | X255: V | Y255: H | Z255: R | AA255: O | AB255: V | AC255: H | AD255: R | AE255: O | AF255: V | AG255: H | AR255: VACATION RATE
E256: ROW # | AH256: of:=IF([.AH254]>0;CONCATENATE(TEXT([.CC254];"####.##");"-Expense");"") -> .-Expense
AH257: VACATION | AK257: HOLIDAY | AM257: EXPENSES
E258: of:=[.E250]+1 -> 32 | AH258: of:=IF([.BK254]>0; IF([.AR256]>0;[.BM254]; "ENTER RATE >");0) -> 0 | AK258: of:=IF([.BO254]>0; IF([.AR259]>0;[.BQ254]; "ENTER RATE >");0) -> 0 | AR258: HOLIDAY RATE
E260: VOL | F260: of:=['Work Log'.E297] -> 0 | J260: of:=['Work Log'.I297] -> 0 | N260: of:=['Work Log'.M297] -> 0 | R260: of:=['Work Log'.Q297] -> 0 | V260: of:=['Work Log'.U297] -> 0 | Z260: of:=['Work Log'.Y297] -> 0 | AD260: of:=['Work Log'.AC297] -> 0 | AH260: of:=[.BY254] -> 0 | AK260: of:=CONCATENATE("REG = ";[.BA254]) -> REG = 0 | AL260: of:=CONCATENATE("OT = "; [.BG254]) -> OT = 0 | AM260: Prod % = | AN260: of:=[.AM254]/[.AH260] -> 
E261: D/L | F261: of:=IF([.F260];[.F260]*0.3;"") ->  | J261: of:=IF([.J260];[.J260]*0.3;"") ->  | N261: of:=IF([.N260];[.N260]*0.3;"") ->  | R261: of:=IF([.R260];[.R260]*0.3;"") ->  | V261: of:=IF([.V260];[.V260]*0.3;"") ->  | Z261: of:=IF([.Z260];[.Z260]*0.3;"") ->  | AD261: of:=IF([.AD260];[.AD260]*0.3;"") ->  | AH261: of:=SUM([.F261:.AD261]) -> 0 | AK261: of:=CONCATENATE("VAC = ";[.BK254]) -> VAC = 0 | AL261: of:=CONCATENATE("HOL = "; [.BO254]) -> HOL = 0

Sheet: Work Log
B1: Work Log | H1: DIV : | I1: of:=[$'Weekly Payroll Report'.$I$3] -> 19 | L1: O.M.: | N1: of:=[$'Weekly Payroll Report'.$V$3] -> Rhett Winford | R1: WEEK ENDING : | U1: of:=['Weekly Payroll Report'.AM3] -> 2021-09-24 | AF1: American National Skyline, Inc.
B3: EMP | E3: of:=[.I3]-1 -> 2021-09-18 | I3: of:=[.M3]-1 -> 2021-09-19 | M3: of:=[.Q3]-1 -> 2021-09-20 | Q3: of:=[.U3]-1 -> 2021-09-21 | U3: of:=[.Y3]-1 -> 2021-09-22 | Y3: of:=[.AC3]-1 -> 2021-09-23 | AC3: of:=['Weekly Payroll Report'.AM3] -> 2021-09-24
E4: JOB | H4: VOL | I4: JOB | L4: VOL | M4: JOB | P4: VOL | Q4: JOB | T4: VOL | U4: JOB | X4: VOL | Y4: JOB | AB4: VOL | AC4: JOB | AF4: VOL
B5: of:=['Weekly Payroll Report'.B6] -> Baxter, Brian | AH5: Note : The work log sheet is optional. You may use it if you wish to track all of the volume done each day for each employee. If, in your division, a window cleaner generally only visits a site or two per day, you can just note that in the center section for each day on the 'Weekly Payroll Report' tab.
B13: Total : | E13: of:=SUM([.H5:.H12]) -> 0 | I13: of:=SUM([.L5:.L12]) -> 0 | L13: of:=SUM([.L5:.L12]) -> 0 | M13: of:=SUM([.P5:.P12]) -> 0 | P13: of:=SUM([.P5:.P12]) -> 0 | Q13: of:=SUM([.T5:.T12]) -> 0 | T13: of:=SUM([.T5:.T12]) -> 0 | U13: of:=SUM([.X5:.X12]) -> 0 | X13: of:=SUM([.X5:.X12]) -> 0 | Y13: of:=SUM([.AB5:.AB12]) -> 0 | AB13: of:=SUM([.AB5:.AB12]) -> 0 | AC13: of:=SUM([.AF5:.AF12]) -> 0 | AF13: of:=SUM([.AF5:.AF12]) -> 0
B14: of:=IF(['Weekly Payroll Report'.B14]="";"";['Weekly Payroll Report'.B14]) -> Fonseca, Jonathan Colon
B22: Total : | E22: of:=SUM([.H14:.H21]) -> 0 | I22: of:=SUM([.L14:.L21]) -> 0 | L22: of:=SUM([.L14:.L21]) -> 0 | M22: of:=SUM([.P14:.P21]) -> 0 | P22: of:=SUM([.P14:.P21]) -> 0 | Q22: of:=SUM([.T14:.T21]) -> 0 | T22: of:=SUM([.T14:.T21]) -> 0 | U22: of:=SUM([.X14:.X21]) -> 0 | X22: of:=SUM([.X14:.X21]) -> 0 | Y22: of:=SUM([.AB14:.AB21]) -> 0 | AB22: of:=SUM([.AB14:.AB21]) -> 0 | AC22: of:=SUM([.AF14:.AF21]) -> 0 | AF22: of:=SUM([.AF14:.AF21]) -> 0
B23: of:=IF(['Weekly Payroll Report'.B22]="";"";['Weekly Payroll Report'.B22]) -> Rigdon, Chad
B31: Total : | E31: of:=SUM([.H23:.H30]) -> 0 | I31: of:=SUM([.L23:.L30]) -> 0 | L31: of:=SUM([.L23:.L30]) -> 0 | M31: of:=SUM([.P23:.P30]) -> 0 | P31: of:=SUM([.P23:.P30]) -> 0 | Q31: of:=SUM([.T23:.T30]) -> 0 | T31: of:=SUM([.T23:.T30]) -> 0 | U31: of:=SUM([.X23:.X30]) -> 0 | X31: of:=SUM([.X23:.X30]) -> 0 | Y31: of:=SUM([.AB23:.AB30]) -> 0 | AB31: of:=SUM([.AB23:.AB30]) -> 0 | AC31: of:=SUM([.AF23:.AF30]) -> 0 | AF31: of:=SUM([.AF23:.AF30]) -> 0
B32: of:=['Weekly Payroll Report'.B30] -> Selleck, Dustin
B40: Total : | E40: of:=SUM([.H32:.H39]) -> 0 | I40: of:=SUM([.L32:.L39]) -> 0 | L40: of:=SUM([.L32:.L39]) -> 0 | M40: of:=SUM([.P32:.P39]) -> 0 | P40: of:=SUM([.P32:.P39]) -> 0 | Q40: of:=SUM([.T32:.T39]) -> 0 | T40: of:=SUM([.T32:.T39]) -> 0 | U40: of:=SUM([.X32:.X39]) -> 0 | X40: of:=SUM([.X32:.X39]) -> 0 | Y40: of:=SUM([.AB32:.AB39]) -> 0 | AB40: of:=SUM([.AB32:.AB39]) -> 0 | AC40: of:=SUM([.AF32:.AF39]) -> 0 | AF40: of:=SUM([.AF32:.AF39]) -> 0
B41: of:=['Weekly Payroll Report'.B38] -> Snyder, Blake
B49: Total : | E49: of:=SUM([.H41:.H48]) -> 0 | I49: of:=SUM([.L41:.L48]) -> 0 | L49: of:=SUM([.L41:.L48]) -> 0 | M49: of:=SUM([.P41:.P48]) -> 0 | P49: of:=SUM([.P41:.P48]) -> 0 | Q49: of:=SUM([.T41:.T48]) -> 0 | T49: of:=SUM([.T41:.T48]) -> 0 | U49: of:=SUM([.X41:.X48]) -> 0 | X49: of:=SUM([.X41:.X48]) -> 0 | Y49: of:=SUM([.AB41:.AB48]) -> 0 | AB49: of:=SUM([.AB41:.AB48]) -> 0 | AC49: of:=SUM([.AF41:.AF48]) -> 0 | AF49: of:=SUM([.AF41:.AF48]) -> 0
B50: of:=['Weekly Payroll Report'.B46] -> Stonestreet, Jessi
B58: Total : | E58: of:=SUM([.H50:.H57]) -> 0 | I58: of:=SUM([.L50:.L57]) -> 0 | L58: of:=SUM([.L50:.L57]) -> 0 | M58: of:=SUM([.P50:.P57]) -> 0 | P58: of:=SUM([.P50:.P57]) -> 0 | Q58: of:=SUM([.T50:.T57]) -> 0 | T58: of:=SUM([.T50:.T57]) -> 0 | U58: of:=SUM([.X50:.X57]) -> 0 | X58: of:=SUM([.X50:.X57]) -> 0 | Y58: of:=SUM([.AB50:.AB57]) -> 0 | AB58: of:=SUM([.AB50:.AB57]) -> 0 | AC58: of:=SUM([.AF50:.AF57]) -> 0 | AF58: of:=SUM([.AF50:.AF57]) -> 0
B59: of:=['Weekly Payroll Report'.B54] -> Vaughn, Kyle
B67: Total : | E67: of:=SUM([.H59:.H66]) -> 0 | I67: of:=SUM([.L59:.L66]) -> 0 | L67: of:=SUM([.L59:.L66]) -> 0 | M67: of:=SUM([.P59:.P66]) -> 0 | P67: of:=SUM([.P59:.P66]) -> 0 | Q67: of:=SUM([.T59:.T66]) -> 0 | T67: of:=SUM([.T59:.T66]) -> 0 | U67: of:=SUM([.X59:.X66]) -> 0 | X67: of:=SUM([.X59:.X66]) -> 0 | Y67: of:=SUM([.AB59:.AB66]) -> 0 | AB67: of:=SUM([.AB59:.AB66]) -> 0 | AC67: of:=SUM([.AF59:.AF66]) -> 0 | AF67: of:=SUM([.AF59:.AF66]) -> 0
B68: of:=['Weekly Payroll Report'.B62] -> Winford, Rhett
B76: Total : | E76: of:=SUM([.H68:.H75]) -> 0 | I76: of:=SUM([.L68:.L75]) -> 0 | L76: of:=SUM([.L68:.L75]) -> 0 | M76: of:=SUM([.P68:.P75]) -> 0 | P76: of:=SUM([.P68:.P75]) -> 0 | Q76: of:=SUM([.T68:.T75]) -> 0 | T76: of:=SUM([.T68:.T75]) -> 0 | U76: of:=SUM([.X68:.X75]) -> 0 | X76: of:=SUM([.X68:.X75]) -> 0 | Y76: of:=SUM([.AB68:.AB75]) -> 0 | AB76: of:=SUM([.AB68:.AB75]) -> 0 | AC76: of:=SUM([.AF68:.AF75]) -> 0 | AF76: of:=SUM([.AF68:.AF75]) -> 0
B77: of:=['Weekly Payroll Report'.B70] -> 0
B85: Total : | E85: of:=SUM([.H77:.H84]) -> 0 | I85: of:=SUM([.L77:.L84]) -> 0 | L85: of:=SUM([.L77:.L84]) -> 0 | M85: of:=SUM([.P77:.P84]) -> 0 | P85: of:=SUM([.P77:.P84]) -> 0 | Q85: of:=SUM([.T77:.T84]) -> 0 | T85: of:=SUM([.T77:.T84]) -> 0 | U85: of:=SUM([.X77:.X84]) -> 0 | X85: of:=SUM([.X77:.X84]) -> 0 | Y85: of:=SUM([.AB77:.AB84]) -> 0 | AB85: of:=SUM([.AB77:.AB84]) -> 0 | AC85: of:=SUM([.AF77:.AF84]) -> 0 | AF85: of:=SUM([.AF77:.AF84]) -> 0
B86: of:=['Weekly Payroll Report'.B78] -> 0
B94: Total : | E94: of:=SUM([.H86:.H93]) -> 0 | I94: of:=SUM([.L86:.L93]) -> 0 | L94: of:=SUM([.L86:.L93]) -> 0 | M94: of:=SUM([.P86:.P93]) -> 0 | P94: of:=SUM([.P86:.P93]) -> 0 | Q94: of:=SUM([.T86:.T93]) -> 0 | T94: of:=SUM([.T86:.T93]) -> 0 | U94: of:=SUM([.X86:.X93]) -> 0 | X94: of:=SUM([.X86:.X93]) -> 0 | Y94: of:=SUM([.AB86:.AB93]) -> 0 | AB94: of:=SUM([.AB86:.AB93]) -> 0 | AC94: of:=SUM([.AF86:.AF93]) -> 0 | AF94: of:=SUM([.AF86:.AF93]) -> 0
B95: of:=['Weekly Payroll Report'.B86] -> 0
B103: Total : | E103: of:=SUM([.H95:.H102]) -> 0 | I103: of:=SUM([.L95:.L102]) -> 0 | L103: of:=SUM([.L95:.L102]) -> 0 | M103: of:=SUM([.P95:.P102]) -> 0 | P103: of:=SUM([.P95:.P102]) -> 0 | Q103: of:=SUM([.T95:.T102]) -> 0 | T103: of:=SUM([.T95:.T102]) -> 0 | U103: of:=SUM([.X95:.X102]) -> 0 | X103: of:=SUM([.X95:.X102]) -> 0 | Y103: of:=SUM([.AB95:.AB102]) -> 0 | AB103: of:=SUM([.AB95:.AB102]) -> 0 | AC103: of:=SUM([.AF95:.AF102]) -> 0 | AF103: of:=SUM([.AF95:.AF102]) -> 0
B104: of:=['Weekly Payroll Report'.B94] -> 0
B112: Total : | E112: of:=SUM([.H104:.H111]) -> 0 | I112: of:=SUM([.L104:.L111]) -> 0 | L112: of:=SUM([.L104:.L111]) -> 0 | M112: of:=SUM([.P104:.P111]) -> 0 | P112: of:=SUM([.P104:.P111]) -> 0 | Q112: of:=SUM([.T104:.T111]) -> 0 | T112: of:=SUM([.T104:.T111]) -> 0 | U112: of:=SUM([.X104:.X111]) -> 0 | X112: of:=SUM([.X104:.X111]) -> 0 | Y112: of:=SUM([.AB104:.AB111]) -> 0 | AB112: of:=SUM([.AB104:.AB111]) -> 0 | AC112: of:=SUM([.AF104:.AF111]) -> 0 | AF112: of:=SUM([.AF104:.AF111]) -> 0
B114: of:=['Weekly Payroll Report'.B102] -> 0
B122: Total : | E122: of:=SUM([.H114:.H121]) -> 0 | I122: of:=SUM([.L114:.L121]) -> 0 | L122: of:=SUM([.L114:.L121]) -> 0 | M122: of:=SUM([.P114:.P121]) -> 0 | P122: of:=SUM([.P114:.P121]) -> 0 | Q122: of:=SUM([.T114:.T121]) -> 0 | T122: of:=SUM([.T114:.T121]) -> 0 | U122: of:=SUM([.X114:.X121]) -> 0 | X122: of:=SUM([.X114:.X121]) -> 0 | Y122: of:=SUM([.AB114:.AB121]) -> 0 | AB122: of:=SUM([.AB114:.AB121]) -> 0 | AC122: of:=SUM([.AF114:.AF121]) -> 0 | AF122: of:=SUM([.AF114:.AF121]) -> 0
B123: of:=['Weekly Payroll Report'.B110] -> 0
B131: Total : | E131: of:=SUM([.H123:.H130]) -> 0 | I131: of:=SUM([.L123:.L130]) -> 0 | L131: of:=SUM([.L123:.L130]) -> 0 | M131: of:=SUM([.P123:.P130]) -> 0 | P131: of:=SUM([.P123:.P130]) -> 0 | Q131: of:=SUM([.T123:.T130]) -> 0 | T131: of:=SUM([.T123:.T130]) -> 0 | U131: of:=SUM([.X123:.X130]) -> 0 | X131: of:=SUM([.X123:.X130]) -> 0 | Y131: of:=SUM([.AB123:.AB130]) -> 0 | AB131: of:=SUM([.AB123:.AB130]) -> 0 | AC131: of:=SUM([.AF123:.AF130]) -> 0 | AF131: of:=SUM([.AF123:.AF130]) -> 0
B132: of:=['Weekly Payroll Report'.B118] -> 0
B140: Total : | E140: of:=SUM([.H132:.H139]) -> 0 | I140: of:=SUM([.L132:.L139]) -> 0 | L140: of:=SUM([.L132:.L139]) -> 0 | M140: of:=SUM([.P132:.P139]) -> 0 | P140: of:=SUM([.P132:.P139]) -> 0 | Q140: of:=SUM([.T132:.T139]) -> 0 | T140: of:=SUM([.T132:.T139]) -> 0 | U140: of:=SUM([.X132:.X139]) -> 0 | X140: of:=SUM([.X132:.X139]) -> 0 | Y140: of:=SUM([.AB132:.AB139]) -> 0 | AB140: of:=SUM([.AB132:.AB139]) -> 0 | AC140: of:=SUM([.AF132:.AF139]) -> 0 | AF140: of:=SUM([.AF132:.AF139]) -> 0
B141: of:=['Weekly Payroll Report'.B126] -> 0
B149: Total : | E149: of:=SUM([.H141:.H148]) -> 0 | I149: of:=SUM([.L141:.L148]) -> 0 | L149: of:=SUM([.L141:.L148]) -> 0 | M149: of:=SUM([.P141:.P148]) -> 0 | P149: of:=SUM([.P141:.P148]) -> 0 | Q149: of:=SUM([.T141:.T148]) -> 0 | T149: of:=SUM([.T141:.T148]) -> 0 | U149: of:=SUM([.X141:.X148]) -> 0 | X149: of:=SUM([.X141:.X148]) -> 0 | Y149: of:=SUM([.AB141:.AB148]) -> 0 | AB149: of:=SUM([.AB141:.AB148]) -> 0 | AC149: of:=SUM([.AF141:.AF148]) -> 0 | AF149: of:=SUM([.AF141:.AF148]) -> 0
B151: of:=['Weekly Payroll Report'.B134] -> 0
B159: Total : | E159: of:=SUM([.H151:.H158]) -> 0 | I159: of:=SUM([.L151:.L158]) -> 0 | L159: of:=SUM([.L151:.L158]) -> 0 | M159: of:=SUM([.P151:.P158]) -> 0 | P159: of:=SUM([.P151:.P158]) -> 0 | Q159: of:=SUM([.T151:.T158]) -> 0 | T159: of:=SUM([.T151:.T158]) -> 0 | U159: of:=SUM([.X151:.X158]) -> 0 | X159: of:=SUM([.X151:.X158]) -> 0 | Y159: of:=SUM([.AB151:.AB158]) -> 0 | AB159: of:=SUM([.AB151:.AB158]) -> 0 | AC159: of:=SUM([.AF151:.AF158]) -> 0 | AF159: of:=SUM([.AF151:.AF158]) -> 0
B160: of:=['Weekly Payroll Report'.B142] -> 0
B168: Total : | E168: of:=SUM([.H160:.H167]) -> 0 | I168: of:=SUM([.L160:.L167]) -> 0 | L168: of:=SUM([.L160:.L167]) -> 0 | M168: of:=SUM([.P160:.P167]) -> 0 | P168: of:=SUM([.P160:.P167]) -> 0 | Q168: of:=SUM([.T160:.T167]) -> 0 | T168: of:=SUM([.T160:.T167]) -> 0 | U168: of:=SUM([.X160:.X167]) -> 0 | X168: of:=SUM([.X160:.X167]) -> 0 | Y168: of:=SUM([.AB160:.AB167]) -> 0 | AB168: of:=SUM([.AB160:.AB167]) -> 0 | AC168: of:=SUM([.AF160:.AF167]) -> 0 | AF168: of:=SUM([.AF160:.AF167]) -> 0
B169: of:=['Weekly Payroll Report'.B150] -> 0
B177: Total : | E177: of:=SUM([.H169:.H176]) -> 0 | I177: of:=SUM([.L169:.L176]) -> 0 | L177: of:=SUM([.L169:.L176]) -> 0 | M177: of:=SUM([.P169:.P176]) -> 0 | P177: of:=SUM([.P169:.P176]) -> 0 | Q177: of:=SUM([.T169:.T176]) -> 0 | T177: of:=SUM([.T169:.T176]) -> 0 | U177: of:=SUM([.X169:.X176]) -> 0 | X177: of:=SUM([.X169:.X176]) -> 0 | Y177: of:=SUM([.AB169:.AB176]) -> 0 | AB177: of:=SUM([.AB169:.AB176]) -> 0 | AC177: of:=SUM([.AF169:.AF176]) -> 0 | AF177: of:=SUM([.AF169:.AF176]) -> 0
B178: of:=['Weekly Payroll Report'.B158] -> 0
B186: Total : | E186: of:=SUM([.H178:.H185]) -> 0 | I186: of:=SUM([.L178:.L185]) -> 0 | L186: of:=SUM([.L178:.L185]) -> 0 | M186: of:=SUM([.P178:.P185]) -> 0 | P186: of:=SUM([.P178:.P185]) -> 0 | Q186: of:=SUM([.T178:.T185]) -> 0 | T186: of:=SUM([.T178:.T185]) -> 0 | U186: of:=SUM([.X178:.X185]) -> 0 | X186: of:=SUM([.X178:.X185]) -> 0 | Y186: of:=SUM([.AB178:.AB185]) -> 0 | AB186: of:=SUM([.AB178:.AB185]) -> 0 | AC186: of:=SUM([.AF178:.AF185]) -> 0 | AF186: of:=SUM([.AF178:.AF185]) -> 0
B188: of:=['Weekly Payroll Report'.B166] -> 0
B196: Total : | E196: of:=SUM([.H188:.H195]) -> 0 | I196: of:=SUM([.L188:.L195]) -> 0 | L196: of:=SUM([.L188:.L195]) -> 0 | M196: of:=SUM([.P188:.P195]) -> 0 | P196: of:=SUM([.P188:.P195]) -> 0 | Q196: of:=SUM([.T188:.T195]) -> 0 | T196: of:=SUM([.T188:.T195]) -> 0 | U196: of:=SUM([.X188:.X195]) -> 0 | X196: of:=SUM([.X188:.X195]) -> 0 | Y196: of:=SUM([.AB188:.AB195]) -> 0 | AB196: of:=SUM([.AB188:.AB195]) -> 0 | AC196: of:=SUM([.AF188:.AF195]) -> 0 | AF196: of:=SUM([.AF188:.AF195]) -> 0
B197: of:=['Weekly Payroll Report'.B174] -> 0
B205: Total : | E205: of:=SUM([.H197:.H204]) -> 0 | I205: of:=SUM([.L197:.L204]) -> 0 | L205: of:=SUM([.L197:.L204]) -> 0 | M205: of:=SUM([.P197:.P204]) -> 0 | P205: of:=SUM([.P197:.P204]) -> 0 | Q205: of:=SUM([.T197:.T204]) -> 0 | T205: of:=SUM([.T197:.T204]) -> 0 | U205: of:=SUM([.X197:.X204]) -> 0 | X205: of:=SUM([.X197:.X204]) -> 0 | Y205: of:=SUM([.AB197:.AB204]) -> 0 | AB205: of:=SUM([.AB197:.AB204]) -> 0 | AC205: of:=SUM([.AF197:.AF204]) -> 0 | AF205: of:=SUM([.AF197:.AF204]) -> 0
B206: of:=['Weekly Payroll Report'.B182] -> 0
B214: Total : | E214: of:=SUM([.H206:.H213]) -> 0 | I214: of:=SUM([.L206:.L213]) -> 0 | L214: of:=SUM([.L206:.L213]) -> 0 | M214: of:=SUM([.P206:.P213]) -> 0 | P214: of:=SUM([.P206:.P213]) -> 0 | Q214: of:=SUM([.T206:.T213]) -> 0 | T214: of:=SUM([.T206:.T213]) -> 0 | U214: of:=SUM([.X206:.X213]) -> 0 | X214: of:=SUM([.X206:.X213]) -> 0 | Y214: of:=SUM([.AB206:.AB213]) -> 0 | AB214: of:=SUM([.AB206:.AB213]) -> 0 | AC214: of:=SUM([.AF206:.AF213]) -> 0 | AF214: of:=SUM([.AF206:.AF213]) -> 0
B215: of:=['Weekly Payroll Report'.B190] -> 0
B223: Total : | E223: of:=SUM([.H215:.H222]) -> 0 | I223: of:=SUM([.L215:.L222]) -> 0 | L223: of:=SUM([.L215:.L222]) -> 0 | M223: of:=SUM([.P215:.P222]) -> 0 | P223: of:=SUM([.P215:.P222]) -> 0 | Q223: of:=SUM([.T215:.T222]) -> 0 | T223: of:=SUM([.T215:.T222]) -> 0 | U223: of:=SUM([.X215:.X222]) -> 0 | X223: of:=SUM([.X215:.X222]) -> 0 | Y223: of:=SUM([.AB215:.AB222]) -> 0 | AB223: of:=SUM([.AB215:.AB222]) -> 0 | AC223: of:=SUM([.AF215:.AF222]) -> 0 | AF223: of:=SUM([.AF215:.AF222]) -> 0
B225: of:=['Weekly Payroll Report'.B198] -> 0
B233: Total : | E233: of:=SUM([.H225:.H232]) -> 0 | I233: of:=SUM([.L225:.L232]) -> 0 | L233: of:=SUM([.L225:.L232]) -> 0 | M233: of:=SUM([.P225:.P232]) -> 0 | P233: of:=SUM([.P225:.P232]) -> 0 | Q233: of:=SUM([.T225:.T232]) -> 0 | T233: of:=SUM([.T225:.T232]) -> 0 | U233: of:=SUM([.X225:.X232]) -> 0 | X233: of:=SUM([.X225:.X232]) -> 0 | Y233: of:=SUM([.AB225:.AB232]) -> 0 | AB233: of:=SUM([.AB225:.AB232]) -> 0 | AC233: of:=SUM([.AF225:.AF232]) -> 0 | AF233: of:=SUM([.AF225:.AF232]) -> 0
B234: of:=['Weekly Payroll Report'.B206] -> 0
B242: Total : | E242: of:=SUM([.H234:.H241]) -> 0 | I242: of:=SUM([.L234:.L241]) -> 0 | L242: of:=SUM([.L234:.L241]) -> 0 | M242: of:=SUM([.P234:.P241]) -> 0 | P242: of:=SUM([.P234:.P241]) -> 0 | Q242: of:=SUM([.T234:.T241]) -> 0 | T242: of:=SUM([.T234:.T241]) -> 0 | U242: of:=SUM([.X234:.X241]) -> 0 | X242: of:=SUM([.X234:.X241]) -> 0 | Y242: of:=SUM([.AB234:.AB241]) -> 0 | AB242: of:=SUM([.AB234:.AB241]) -> 0 | AC242: of:=SUM([.AF234:.AF241]) -> 0 | AF242: of:=SUM([.AF234:.AF241]) -> 0
B243: of:=['Weekly Payroll Report'.B214] -> 0
B251: Total : | E251: of:=SUM([.H243:.H250]) -> 0 | I251: of:=SUM([.L243:.L250]) -> 0 | L251: of:=SUM([.L243:.L250]) -> 0 | M251: of:=SUM([.P243:.P250]) -> 0 | P251: of:=SUM([.P243:.P250]) -> 0 | Q251: of:=SUM([.T243:.T250]) -> 0 | T251: of:=SUM([.T243:.T250]) -> 0 | U251: of:=SUM([.X243:.X250]) -> 0 | X251: of:=SUM([.X243:.X250]) -> 0 | Y251: of:=SUM([.AB243:.AB250]) -> 0 | AB251: of:=SUM([.AB243:.AB250]) -> 0 | AC251: of:=SUM([.AF243:.AF250]) -> 0 | AF251: of:=SUM([.AF243:.AF250]) -> 0
B252: of:=['Weekly Payroll Report'.B222] -> 0
B260: Total : | E260: of:=SUM([.H252:.H259]) -> 0 | I260: of:=SUM([.L252:.L259]) -> 0 | L260: of:=SUM([.L252:.L259]) -> 0 | M260: of:=SUM([.P252:.P259]) -> 0 | P260: of:=SUM([.P252:.P259]) -> 0 | Q260: of:=SUM([.T252:.T259]) -> 0 | T260: of:=SUM([.T252:.T259]) -> 0 | U260: of:=SUM([.X252:.X259]) -> 0 | X260: of:=SUM([.X252:.X259]) -> 0 | Y260: of:=SUM([.AB252:.AB259]) -> 0 | AB260: of:=SUM([.AB252:.AB259]) -> 0 | AC260: of:=SUM([.AF252:.AF259]) -> 0 | AF260: of:=SUM([.AF252:.AF259]) -> 0
B262: of:=['Weekly Payroll Report'.B230] -> 0
B270: Total : | E270: of:=SUM([.H262:.H269]) -> 0 | I270: of:=SUM([.L262:.L269]) -> 0 | L270: of:=SUM([.L262:.L269]) -> 0 | M270: of:=SUM([.P262:.P269]) -> 0 | P270: of:=SUM([.P262:.P269]) -> 0 | Q270: of:=SUM([.T262:.T269]) -> 0 | T270: of:=SUM([.T262:.T269]) -> 0 | U270: of:=SUM([.X262:.X269]) -> 0 | X270: of:=SUM([.X262:.X269]) -> 0 | Y270: of:=SUM([.AB262:.AB269]) -> 0 | AB270: of:=SUM([.AB262:.AB269]) -> 0 | AC270: of:=SUM([.AF262:.AF269]) -> 0 | AF270: of:=SUM([.AF262:.AF269]) -> 0
B271: of:=['Weekly Payroll Report'.B238] -> 0
B279: Total : | E279: of:=SUM([.H271:.H278]) -> 0 | I279: of:=SUM([.L271:.L278]) -> 0 | L279: of:=SUM([.L271:.L278]) -> 0 | M279: of:=SUM([.P271:.P278]) -> 0 | P279: of:=SUM([.P271:.P278]) -> 0 | Q279: of:=SUM([.T271:.T278]) -> 0 | T279: of:=SUM([.T271:.T278]) -> 0 | U279: of:=SUM([.X271:.X278]) -> 0 | X279: of:=SUM([.X271:.X278]) -> 0 | Y279: of:=SUM([.AB271:.AB278]) -> 0 | AB279: of:=SUM([.AB271:.AB278]) -> 0 | AC279: of:=SUM([.AF271:.AF278]) -> 0 | AF279: of:=SUM([.AF271:.AF278]) -> 0
B280: of:=['Weekly Payroll Report'.B246] -> 0
B288: Total : | E288: of:=SUM([.H280:.H287]) -> 0 | I288: of:=SUM([.L280:.L287]) -> 0 | L288: of:=SUM([.L280:.L287]) -> 0 | M288: of:=SUM([.P280:.P287]) -> 0 | P288: of:=SUM([.P280:.P287]) -> 0 | Q288: of:=SUM([.T280:.T287]) -> 0 | T288: of:=SUM([.T280:.T287]) -> 0 | U288: of:=SUM([.X280:.X287]) -> 0 | X288: of:=SUM([.X280:.X287]) -> 0 | Y288: of:=SUM([.AB280:.AB287]) -> 0 | AB288: of:=SUM([.AB280:.AB287]) -> 0 | AC288: of:=SUM([.AF280:.AF287]) -> 0 | AF288: of:=SUM([.AF280:.AF287]) -> 0
B289: of:=['Weekly Payroll Report'.B254] -> 0
B297: Total : | E297: of:=SUM([.H289:.H296]) -> 0 | I297: of:=SUM([.L289:.L296]) -> 0 | L297: of:=SUM([.L289:.L296]) -> 0 | M297: of:=SUM([.P289:.P296]) -> 0 | P297: of:=SUM([.P289:.P296]) -> 0 | Q297: of:=SUM([.T289:.T296]) -> 0 | T297: of:=SUM([.T289:.T296]) -> 0 | U297: of:=SUM([.X289:.X296]) -> 0 | X297: of:=SUM([.X289:.X296]) -> 0 | Y297: of:=SUM([.AB289:.AB296]) -> 0 | AB297: of:=SUM([.AB289:.AB296]) -> 0 | AC297: of:=SUM([.AF289:.AF296]) -> 0 | AF297: of:=SUM([.AF289:.AF296]) -> 0

Sheet: Summary
B1: SUMMARY OF WEEKLY PAYROLL | X1: American National Skyline, Inc.
B2: Note : This sheet is automatically generated. Please do not modify it.
J3: Division : | L3: of:=[$'Weekly Payroll Report'.$I$3] -> 19 | N3: O.M.: | O3: of:=[$'Weekly Payroll Report'.$V$3] -> Rhett Winford | T3: Week Ending : | X3: of:=['Weekly Payroll Report'.AM3] -> 2021-09-24
B5: Row | D5: Employee Name | F5: Regular Hours | H5: Regular Pay | J5: Expenses | L5: O.T. Hours | N5: O.T. Pay | P5: Vac Hours | R5: Vac Pay | T5: Hol Hours | V5: Hol Pay | X5: Gross Pay | Z5: Exp Smt'd | AB5: Exp Allw'd | AD5: VOL | AF5: D/L | AH5: Prod
B6: of:=[$'Weekly Payroll Report'.$AW$6] -> 1 | D6: of:=[$'Weekly Payroll Report'.$AY$6] -> Baxter, Brian | F6: of:=[$'Weekly Payroll Report'.$BA$6] -> 40 | H6: of:=[$'Weekly Payroll Report'.$BC$6] -> 889.009900990099 | J6: of:=[$'Weekly Payroll Report'.$BE$6] -> 10 | L6: of:=[$'Weekly Payroll Report'.$BG$6] -> 7 | N6: of:=[$'Weekly Payroll Report'.$BI$6] -> 235.990099009901 | P6: of:=[$'Weekly Payroll Report'.$BK$6] -> 0 | R6: of:=[$'Weekly Payroll Report'.$BM$6] -> 0 | T6: of:=[$'Weekly Payroll Report'.$BO$6] -> 0 | V6: of:=[$'Weekly Payroll Report'.$BQ$6] -> 0 | X6: of:=[$'Weekly Payroll Report'.$BS$6] -> 1135 | Z6: of:=[$'Weekly Payroll Report'.$BU$6] -> 10 | AB6: of:=[$'Weekly Payroll Report'.$BW$6] -> 10 | AD6: of:=[$'Weekly Payroll Report'.$BY$6] -> 4214.5 | AF6: of:=[$'Weekly Payroll Report'.$CA$6] -> 1135 | AH6: of:=IF([.AD6]>0;IF([.X6]>0; [.X6]/[.AD6];1);IF([.X6]>0;1;0)) -> 0.269308340253885
B7: of:=[$'Weekly Payroll Report'.$AW$14] -> 2 | D7: of:=[$'Weekly Payroll Report'.$AY$14] -> Fonseca, Jonathan Colon | F7: of:=[$'Weekly Payroll Report'.$BA$14] -> 40 | H7: of:=[$'Weekly Payroll Report'.$BC$14] -> 828.190954773869 | J7: of:=[$'Weekly Payroll Report'.$BE$14] -> 10 | L7: of:=[$'Weekly Payroll Report'.$BG$14] -> 6.5 | N7: of:=[$'Weekly Payroll Report'.$BI$14] -> 204.309045226131 | P7: of:=[$'Weekly Payroll Report'.$BK$14] -> 0 | R7: of:=[$'Weekly Payroll Report'.$BM$14] -> 0 | T7: of:=[$'Weekly Payroll Report'.$BO$14] -> 0 | V7: of:=[$'Weekly Payroll Report'.$BQ$14] -> 0 | X7: of:=[$'Weekly Payroll Report'.$BS$14] -> 1042.5 | Z7: of:=[$'Weekly Payroll Report'.$BU$14] -> 10 | AB7: of:=[$'Weekly Payroll Report'.$BW$14] -> 10 | AD7: of:=[$'Weekly Payroll Report'.$BY$14] -> 3957.5 | AF7: of:=[$'Weekly Payroll Report'.$CA$14] -> 1042.5 | AH7: of:=IF([.AD7]>0;IF([.X7]>0; [.X7]/[.AD7];1);IF([.X7]>0;1;0)) -> 0.263423878711308
B8: of:=[$'Weekly Payroll Report'.$AW$22] -> 3 | D8: of:=[$'Weekly Payroll Report'.$AY$22] -> Rigdon, Chad | F8: of:=[$'Weekly Payroll Report'.$BA$22] -> 39 | H8: of:=[$'Weekly Payroll Report'.$BC$22] -> 1090 | J8: of:=[$'Weekly Payroll Report'.$BE$22] -> 10 | L8: of:=[$'Weekly Payroll Report'.$BG$22] -> 0 | N8: of:=[$'Weekly Payroll Report'.$BI$22] -> 0 | P8: of:=[$'Weekly Payroll Report'.$BK$22] -> 0 | R8: of:=[$'Weekly Payroll Report'.$BM$22] -> 0 | T8: of:=[$'Weekly Payroll Report'.$BO$22] -> 0 | V8: of:=[$'Weekly Payroll Report'.$BQ$22] -> 0 | X8: of:=[$'Weekly Payroll Report'.$BS$22] -> 1100 | Z8: of:=[$'Weekly Payroll Report'.$BU$22] -> 10 | AB8: of:=[$'Weekly Payroll Report'.$BW$22] -> 10 | AD8: of:=[$'Weekly Payroll Report'.$BY$22] -> 3750 | AF8: of:=[$'Weekly Payroll Report'.$CA$22] -> 1100 | AH8: of:=IF([.AD8]>0;IF([.X8]>0; [.X8]/[.AD8];1);IF([.X8]>0;1;0)) -> 0.293333333333333
B9: of:=[$'Weekly Payroll Report'.$AW$30] -> 4 | D9: of:=[$'Weekly Payroll Report'.$AY$30] -> Selleck, Dustin | F9: of:=[$'Weekly Payroll Report'.$BA$30] -> 40 | H9: of:=[$'Weekly Payroll Report'.$BC$30] -> 574.232365145228 | J9: of:=[$'Weekly Payroll Report'.$BE$30] -> 10 | L9: of:=[$'Weekly Payroll Report'.$BG$30] -> 13.5 | N9: of:=[$'Weekly Payroll Report'.$BI$30] -> 295.767634854772 | P9: of:=[$'Weekly Payroll Report'.$BK$30] -> 0 | R9: of:=[$'Weekly Payroll Report'.$BM$30] -> 0 | T9: of:=[$'Weekly Payroll Report'.$BO$30] -> 0 | V9: of:=[$'Weekly Payroll Report'.$BQ$30] -> 0 | X9: of:=[$'Weekly Payroll Report'.$BS$30] -> 880 | Z9: of:=[$'Weekly Payroll Report'.$BU$30] -> 10 | AB9: of:=[$'Weekly Payroll Report'.$BW$30] -> 10 | AD9: of:=[$'Weekly Payroll Report'.$BY$30] -> 2940.5 | AF9: of:=[$'Weekly Payroll Report'.$CA$30] -> 880 | AH9: of:=IF([.AD9]>0;IF([.X9]>0; [.X9]/[.AD9];1);IF([.X9]>0;1;0)) -> 0.299268831831321
B10: of:=[$'Weekly Payroll Report'.$AW$38] -> 5 | D10: of:=[$'Weekly Payroll Report'.$AY$38] -> Snyder, Blake | F10: of:=[$'Weekly Payroll Report'.$BA$38] -> 40 | H10: of:=[$'Weekly Payroll Report'.$BC$38] -> 826.571428571429 | J10: of:=[$'Weekly Payroll Report'.$BE$38] -> 10 | L10: of:=[$'Weekly Payroll Report'.$BG$38] -> 2.5 | N10: of:=[$'Weekly Payroll Report'.$BI$38] -> 78.4285714285714 | P10: of:=[$'Weekly Payroll Report'.$BK$38] -> 0 | R10: of:=[$'Weekly Payroll Report'.$BM$38] -> 0 | T10: of:=[$'Weekly Payroll Report'.$BO$38] -> 0 | V10: of:=[$'Weekly Payroll Report'.$BQ$38] -> 0 | X10: of:=[$'Weekly Payroll Report'.$BS$38] -> 915 | Z10: of:=[$'Weekly Payroll Report'.$BU$38] -> 10 | AB10: of:=[$'Weekly Payroll Report'.$BW$38] -> 10 | AD10: of:=[$'Weekly Payroll Report'.$BY$38] -> 3028.6 | AF10: of:=[$'Weekly Payroll Report'.$CA$38] -> 915 | AH10: of:=IF([.AD10]>0;IF([.X10]>0; [.X10]/[.AD10];1);IF([.X10]>0;1;0)) -> 0.302119791322723
B11: of:=[$'Weekly Payroll Report'.$AW$46] -> 6 | D11: of:=[$'Weekly Payroll Report'.$AY$46] -> Stonestreet, Jessi | F11: of:=[$'Weekly Payroll Report'.$BA$46] -> 31.5 | H11: of:=[$'Weekly Payroll Report'.$BC$46] -> 790 | J11: of:=[$'Weekly Payroll Report'.$BE$46] -> 10 | L11: of:=[$'Weekly Payroll Report'.$BG$46] -> 0 | N11: of:=[$'Weekly Payroll Report'.$BI$46] -> 0 | P11: of:=[$'Weekly Payroll Report'.$BK$46] -> 0 | R11: of:=[$'Weekly Payroll Report'.$BM$46] -> 0 | T11: of:=[$'Weekly Payroll Report'.$BO$46] -> 0 | V11: of:=[$'Weekly Payroll Report'.$BQ$46] -> 0 | X11: of:=[$'Weekly Payroll Report'.$BS$46] -> 800 | Z11: of:=[$'Weekly Payroll Report'.$BU$46] -> 10 | AB11: of:=[$'Weekly Payroll Report'.$BW$46] -> 10 | AD11: of:=[$'Weekly Payroll Report'.$BY$46] -> 2992.75 | AF11: of:=[$'Weekly Payroll Report'.$CA$46] -> 800 | AH11: of:=IF([.AD11]>0;IF([.X11]>0; [.X11]/[.AD11];1);IF([.X11]>0;1;0)) -> 0.267312672291371
B12: of:=[$'Weekly Payroll Report'.$AW$54] -> 7 | D12: of:=[$'Weekly Payroll Report'.$AY$54] -> Vaughn, Kyle | F12: of:=[$'Weekly Payroll Report'.$BA$54] -> 40 | H12: of:=[$'Weekly Payroll Report'.$BC$54] -> 856.331658291457 | J12: of:=[$'Weekly Payroll Report'.$BE$54] -> 10 | L12: of:=[$'Weekly Payroll Report'.$BG$54] -> 6.5 | N12: of:=[$'Weekly Payroll Report'.$BI$54] -> 211.168341708543 | P12: of:=[$'Weekly Payroll Report'.$BK$54] -> 0 | R12: of:=[$'Weekly Payroll Report'.$BM$54] -> 0 | T12: of:=[$'Weekly Payroll Report'.$BO$54] -> 0 | V12: of:=[$'Weekly Payroll Report'.$BQ$54] -> 0 | X12: of:=[$'Weekly Payroll Report'.$BS$54] -> 1077.5 | Z12: of:=[$'Weekly Payroll Report'.$BU$54] -> 10 | AB12: of:=[$'Weekly Payroll Report'.$BW$54] -> 10 | AD12: of:=[$'Weekly Payroll Report'.$BY$54] -> 3873.75 | AF12: of:=[$'Weekly Payroll Report'.$CA$54] -> 1077.5 | AH12: of:=IF([.AD12]>0;IF([.X12]>0; [.X12]/[.AD12];1);IF([.X12]>0;1;0)) -> 0.278154243304292
B13: of:=[$'Weekly Payroll Report'.$AW$62] -> 8 | D13: of:=[$'Weekly Payroll Report'.$AY$62] -> Winford, Rhett | F13: of:=[$'Weekly Payroll Report'.$BA$62] -> 0 | H13: of:=[$'Weekly Payroll Report'.$BC$62] -> 915 | J13: of:=[$'Weekly Payroll Report'.$BE$62] -> 0 | L13: of:=[$'Weekly Payroll Report'.$BG$62] -> 0 | N13: of:=[$'Weekly Payroll Report'.$BI$62] -> 0 | P13: of:=[$'Weekly Payroll Report'.$BK$62] -> 0 | R13: of:=[$'Weekly Payroll Report'.$BM$62] -> 0 | T13: of:=[$'Weekly Payroll Report'.$BO$62] -> 0 | V13: of:=[$'Weekly Payroll Report'.$BQ$62] -> 0 | X13: of:=[$'Weekly Payroll Report'.$BS$62] -> 915 | Z13: of:=[$'Weekly Payroll Report'.$BU$62] -> 0 | AB13: of:=[$'Weekly Payroll Report'.$BW$62] -> 0 | AD13: of:=[$'Weekly Payroll Report'.$BY$62] -> 2050 | AF13: of:=[$'Weekly Payroll Report'.$CA$62] -> 915 | AH13: of:=IF([.AD13]>0;IF([.X13]>0; [.X13]/[.AD13];1);IF([.X13]>0;1;0)) -> 0.446341463414634
B14: of:=[$'Weekly Payroll Report'.$AW$70] -> 9 | D14: of:=[$'Weekly Payroll Report'.$AY$70] -> 0 | F14: of:=[$'Weekly Payroll Report'.$BA$70] -> 0 | H14: of:=[$'Weekly Payroll Report'.$BC$70] -> 0 | J14: of:=[$'Weekly Payroll Report'.$BE$70] -> 0 | L14: of:=[$'Weekly Payroll Report'.$BG$70] -> 0 | N14: of:=[$'Weekly Payroll Report'.$BI$70] -> 0 | P14: of:=[$'Weekly Payroll Report'.$BK$70] -> 0 | R14: of:=[$'Weekly Payroll Report'.$BM$70] -> 0 | T14: of:=[$'Weekly Payroll Report'.$BO$70] -> 0 | V14: of:=[$'Weekly Payroll Report'.$BQ$70] -> 0 | X14: of:=[$'Weekly Payroll Report'.$BS$70] -> 0 | Z14: of:=[$'Weekly Payroll Report'.$BU$70] -> 0 | AB14: of:=[$'Weekly Payroll Report'.$BW$70] -> 0 | AD14: of:=[$'Weekly Payroll Report'.$BY$70] -> 0 | AF14: of:=[$'Weekly Payroll Report'.$CA$70] -> 0 | AH14: of:=IF([.AD14]>0;IF([.X14]>0; [.X14]/[.AD14];1);IF([.X14]>0;1;0)) -> 0
B15: of:=[$'Weekly Payroll Report'.$AW$78] -> 10 | D15: of:=[$'Weekly Payroll Report'.$AY$78] -> 0 | F15: of:=[$'Weekly Payroll Report'.$BA$78] -> 0 | H15: of:=[$'Weekly Payroll Report'.$BC$78] -> 0 | J15: of:=[$'Weekly Payroll Report'.$BE$78] -> 0 | L15: of:=[$'Weekly Payroll Report'.$BG$78] -> 0 | N15: of:=[$'Weekly Payroll Report'.$BI$78] -> 0 | P15: of:=[$'Weekly Payroll Report'.$BK$78] -> 0 | R15: of:=[$'Weekly Payroll Report'.$BM$78] -> 0 | T15: of:=[$'Weekly Payroll Report'.$BO$78] -> 0 | V15: of:=[$'Weekly Payroll Report'.$BQ$78] -> 0 | X15: of:=[$'Weekly Payroll Report'.$BS$78] -> 0 | Z15: of:=[$'Weekly Payroll Report'.$BU$78] -> 0 | AB15: of:=[$'Weekly Payroll Report'.$BW$78] -> 0 | AD15: of:=[$'Weekly Payroll Report'.$BY$78] -> 0 | AF15: of:=[$'Weekly Payroll Report'.$CA$78] -> 0 | AH15: of:=IF([.AD15]>0;IF([.X15]>0; [.X15]/[.AD15];1);IF([.X15]>0;1;0)) -> 0
B16: of:=[$'Weekly Payroll Report'.$AW$86] -> 11 | D16: of:=[$'Weekly Payroll Report'.$AY$86] -> 0 | F16: of:=[$'Weekly Payroll Report'.$BA$86] -> 0 | H16: of:=[$'Weekly Payroll Report'.$BC$86] -> 0 | J16: of:=[$'Weekly Payroll Report'.$BE$86] -> 0 | L16: of:=[$'Weekly Payroll Report'.$BG$86] -> 0 | N16: of:=[$'Weekly Payroll Report'.$BI$86] -> 0 | P16: of:=[$'Weekly Payroll Report'.$BK$86] -> 0 | R16: of:=[$'Weekly Payroll Report'.$BM$86] -> 0 | T16: of:=[$'Weekly Payroll Report'.$BO$86] -> 0 | V16: of:=[$'Weekly Payroll Report'.$BQ$86] -> 0 | X16: of:=[$'Weekly Payroll Report'.$BS$86] -> 0 | Z16: of:=[$'Weekly Payroll Report'.$BU$86] -> 0 | AB16: of:=[$'Weekly Payroll Report'.$BW$86] -> 0 | AD16: of:=[$'Weekly Payroll Report'.$BY$86] -> 0 | AF16: of:=[$'Weekly Payroll Report'.$CA$86] -> 0 | AH16: of:=IF([.AD16]>0;IF([.X16]>0; [.X16]/[.AD16];1);IF([.X16]>0;1;0)) -> 0
B17: of:=[$'Weekly Payroll Report'.$AW$94] -> 12 | D17: of:=[$'Weekly Payroll Report'.$AY$94] -> 0 | F17: of:=[$'Weekly Payroll Report'.$BA$94] -> 0 | H17: of:=[$'Weekly Payroll Report'.$BC$94] -> 0 | J17: of:=[$'Weekly Payroll Report'.$BE$94] -> 0 | L17: of:=[$'Weekly Payroll Report'.$BG$94] -> 0 | N17: of:=[$'Weekly Payroll Report'.$BI$94] -> 0 | P17: of:=[$'Weekly Payroll Report'.$BK$94] -> 0 | R17: of:=[$'Weekly Payroll Report'.$BM$94] -> 0 | T17: of:=[$'Weekly Payroll Report'.$BO$94] -> 0 | V17: of:=[$'Weekly Payroll Report'.$BQ$94] -> 0 | X17: of:=[$'Weekly Payroll Report'.$BS$94] -> 0 | Z17: of:=[$'Weekly Payroll Report'.$BU$94] -> 0 | AB17: of:=[$'Weekly Payroll Report'.$BW$94] -> 0 | AD17: of:=[$'Weekly Payroll Report'.$BY$94] -> 0 | AF17: of:=[$'Weekly Payroll Report'.$CA$94] -> 0 | AH17: of:=IF([.AD17]>0;IF([.X17]>0; [.X17]/[.AD17];1);IF([.X17]>0;1;0)) -> 0
B18: of:=[$'Weekly Payroll Report'.$AW$102] -> 13 | D18: of:=[$'Weekly Payroll Report'.$AY$102] -> 0 | F18: of:=[$'Weekly Payroll Report'.$BA$102] -> 0 | H18: of:=[$'Weekly Payroll Report'.$BC$102] -> 0 | J18: of:=[$'Weekly Payroll Report'.$BE$102] -> 0 | L18: of:=[$'Weekly Payroll Report'.$BG$102] -> 0 | N18: of:=[$'Weekly Payroll Report'.$BI$102] -> 0 | P18: of:=[$'Weekly Payroll Report'.$BK$102] -> 0 | R18: of:=[$'Weekly Payroll Report'.$BM$102] -> 0 | T18: of:=[$'Weekly Payroll Report'.$BO$102] -> 0 | V18: of:=[$'Weekly Payroll Report'.$BQ$102] -> 0 | X18: of:=[$'Weekly Payroll Report'.$BS$102] -> 0 | Z18: of:=[$'Weekly Payroll Report'.$BU$102] -> 0 | AB18: of:=[$'Weekly Payroll Report'.$BW$102] -> 0 | AD18: of:=[$'Weekly Payroll Report'.$BY$102] -> 0 | AF18: of:=[$'Weekly Payroll Report'.$CA$102] -> 0 | AH18: of:=IF([.AD18]>0;IF([.X18]>0; [.X18]/[.AD18];1);IF([.X18]>0;1;0)) -> 0
B19: of:=[$'Weekly Payroll Report'.$AW$110] -> 14 | D19: of:=[$'Weekly Payroll Report'.$AY$110] -> 0 | F19: of:=[$'Weekly Payroll Report'.$BA$110] -> 0 | H19: of:=[$'Weekly Payroll Report'.$BC$110] -> 0 | J19: of:=[$'Weekly Payroll Report'.$BE$110] -> 0 | L19: of:=[$'Weekly Payroll Report'.$BG$110] -> 0 | N19: of:=[$'Weekly Payroll Report'.$BI$110] -> 0 | P19: of:=[$'Weekly Payroll Report'.$BK$110] -> 0 | R19: of:=[$'Weekly Payroll Report'.$BM$110] -> 0 | T19: of:=[$'Weekly Payroll Report'.$BO$110] -> 0 | V19: of:=[$'Weekly Payroll Report'.$BQ$110] -> 0 | X19: of:=[$'Weekly Payroll Report'.$BS$110] -> 0 | Z19: of:=[$'Weekly Payroll Report'.$BU$110] -> 0 | AB19: of:=[$'Weekly Payroll Report'.$BW$110] -> 0 | AD19: of:=[$'Weekly Payroll Report'.$BY$110] -> 0 | AF19: of:=[$'Weekly Payroll Report'.$CA$110] -> 0 | AH19: of:=IF([.AD19]>0;IF([.X19]>0; [.X19]/[.AD19];1);IF([.X19]>0;1;0)) -> 0
B20: of:=[$'Weekly Payroll Report'.$AW$118] -> 15 | D20: of:=[$'Weekly Payroll Report'.$AY$118] -> 0 | F20: of:=[$'Weekly Payroll Report'.$BA$118] -> 0 | H20: of:=[$'Weekly Payroll Report'.$BC$118] -> 0 | J20: of:=[$'Weekly Payroll Report'.$BE$118] -> 0 | L20: of:=[$'Weekly Payroll Report'.$BG$118] -> 0 | N20: of:=[$'Weekly Payroll Report'.$BI$118] -> 0 | P20: of:=[$'Weekly Payroll Report'.$BK$118] -> 0 | R20: of:=[$'Weekly Payroll Report'.$BM$118] -> 0 | T20: of:=[$'Weekly Payroll Report'.$BO$118] -> 0 | V20: of:=[$'Weekly Payroll Report'.$BQ$118] -> 0 | X20: of:=[$'Weekly Payroll Report'.$BS$118] -> 0 | Z20: of:=[$'Weekly Payroll Report'.$BU$118] -> 0 | AB20: of:=[$'Weekly Payroll Report'.$BW$118] -> 0 | AD20: of:=[$'Weekly Payroll Report'.$BY$118] -> 0 | AF20: of:=[$'Weekly Payroll Report'.$CA$118] -> 0 | AH20: of:=IF([.AD20]>0;IF([.X20]>0; [.X20]/[.AD20];1);IF([.X20]>0;1;0)) -> 0
B21: of:=[$'Weekly Payroll Report'.$AW$126] -> 16 | D21: of:=[$'Weekly Payroll Report'.$AY$126] -> 0 | F21: of:=[$'Weekly Payroll Report'.$BA$126] -> 0 | H21: of:=[$'Weekly Payroll Report'.$BC$126] -> 0 | J21: of:=[$'Weekly Payroll Report'.$BE$126] -> 0 | L21: of:=[$'Weekly Payroll Report'.$BG$126] -> 0 | N21: of:=[$'Weekly Payroll Report'.$BI$126] -> 0 | P21: of:=[$'Weekly Payroll Report'.$BK$126] -> 0 | R21: of:=[$'Weekly Payroll Report'.$BM$126] -> 0 | T21: of:=[$'Weekly Payroll Report'.$BO$126] -> 0 | V21: of:=[$'Weekly Payroll Report'.$BQ$126] -> 0 | X21: of:=[$'Weekly Payroll Report'.$BS$126] -> 0 | Z21: of:=[$'Weekly Payroll Report'.$BU$126] -> 0 | AB21: of:=[$'Weekly Payroll Report'.$BW$126] -> 0 | AD21: of:=[$'Weekly Payroll Report'.$BY$126] -> 0 | AF21: of:=[$'Weekly Payroll Report'.$CA$126] -> 0 | AH21: of:=IF([.AD21]>0;IF([.X21]>0; [.X21]/[.AD21];1);IF([.X21]>0;1;0)) -> 0
B22: of:=[$'Weekly Payroll Report'.$AW$134] -> 17 | D22: of:=[$'Weekly Payroll Report'.$AY$134] -> 0 | F22: of:=[$'Weekly Payroll Report'.$BA$134] -> 0 | H22: of:=[$'Weekly Payroll Report'.$BC$134] -> 0 | J22: of:=[$'Weekly Payroll Report'.$BE$134] -> 0 | L22: of:=[$'Weekly Payroll Report'.$BG$134] -> 0 | N22: of:=[$'Weekly Payroll Report'.$BI$134] -> 0 | P22: of:=[$'Weekly Payroll Report'.$BK$134] -> 0 | R22: of:=[$'Weekly Payroll Report'.$BM$134] -> 0 | T22: of:=[$'Weekly Payroll Report'.$BO$134] -> 0 | V22: of:=[$'Weekly Payroll Report'.$BQ$134] -> 0 | X22: of:=[$'Weekly Payroll Report'.$BS$134] -> 0 | Z22: of:=[$'Weekly Payroll Report'.$BU$134] -> 0 | AB22: of:=[$'Weekly Payroll Report'.$BW$134] -> 0 | AD22: of:=[$'Weekly Payroll Report'.$BY$134] -> 0 | AF22: of:=[$'Weekly Payroll Report'.$CA$134] -> 0 | AH22: of:=IF([.AD22]>0;IF([.X22]>0; [.X22]/[.AD22];1);IF([.X22]>0;1;0)) -> 0
B23: of:=[$'Weekly Payroll Report'.$AW$142] -> 18 | D23: of:=[$'Weekly Payroll Report'.$AY$142] -> 0 | F23: of:=[$'Weekly Payroll Report'.$BA$142] -> 0 | H23: of:=[$'Weekly Payroll Report'.$BC$142] -> 0 | J23: of:=[$'Weekly Payroll Report'.$BE$142] -> 0 | L23: of:=[$'Weekly Payroll Report'.$BG$142] -> 0 | N23: of:=[$'Weekly Payroll Report'.$BI$142] -> 0 | P23: of:=[$'Weekly Payroll Report'.$BK$142] -> 0 | R23: of:=[$'Weekly Payroll Report'.$BM$142] -> 0 | T23: of:=[$'Weekly Payroll Report'.$BO$142] -> 0 | V23: of:=[$'Weekly Payroll Report'.$BQ$142] -> 0 | X23: of:=[$'Weekly Payroll Report'.$BS$142] -> 0 | Z23: of:=[$'Weekly Payroll Report'.$BU$142] -> 0 | AB23: of:=[$'Weekly Payroll Report'.$BW$142] -> 0 | AD23: of:=[$'Weekly Payroll Report'.$BY$142] -> 0 | AF23: of:=[$'Weekly Payroll Report'.$CA$142] -> 0 | AH23: of:=IF([.AD23]>0;IF([.X23]>0; [.X23]/[.AD23];1);IF([.X23]>0;1;0)) -> 0
B24: of:=[$'Weekly Payroll Report'.$AW$150] -> 19 | D24: of:=[$'Weekly Payroll Report'.$AY$150] -> 0 | F24: of:=[$'Weekly Payroll Report'.$BA$150] -> 0 | H24: of:=[$'Weekly Payroll Report'.$BC$150] -> 0 | J24: of:=[$'Weekly Payroll Report'.$BE$150] -> 0 | L24: of:=[$'Weekly Payroll Report'.$BG$150] -> 0 | N24: of:=[$'Weekly Payroll Report'.$BI$150] -> 0 | P24: of:=[$'Weekly Payroll Report'.$BK$150] -> 0 | R24: of:=[$'Weekly Payroll Report'.$BM$150] -> 0 | T24: of:=[$'Weekly Payroll Report'.$BO$150] -> 0 | V24: of:=[$'Weekly Payroll Report'.$BQ$150] -> 0 | X24: of:=[$'Weekly Payroll Report'.$BS$150] -> 0 | Z24: of:=[$'Weekly Payroll Report'.$BU$150] -> 0 | AB24: of:=[$'Weekly Payroll Report'.$BW$150] -> 0 | AD24: of:=[$'Weekly Payroll Report'.$BY$150] -> 0 | AF24: of:=[$'Weekly Payroll Report'.$CA$150] -> 0 | AH24: of:=IF([.AD24]>0;IF([.X24]>0; [.X24]/[.AD24];1);IF([.X24]>0;1;0)) -> 0
B25: of:=[$'Weekly Payroll Report'.$AW$158] -> 20 | D25: of:=[$'Weekly Payroll Report'.$AY$158] -> 0 | F25: of:=[$'Weekly Payroll Report'.$BA$158] -> 0 | H25: of:=[$'Weekly Payroll Report'.$BC$158] -> 0 | J25: of:=[$'Weekly Payroll Report'.$BE$158] -> 0 | L25: of:=[$'Weekly Payroll Report'.$BG$158] -> 0 | N25: of:=[$'Weekly Payroll Report'.$BI$158] -> 0 | P25: of:=[$'Weekly Payroll Report'.$BK$158] -> 0 | R25: of:=[$'Weekly Payroll Report'.$BM$158] -> 0 | T25: of:=[$'Weekly Payroll Report'.$BO$158] -> 0 | V25: of:=[$'Weekly Payroll Report'.$BQ$158] -> 0 | X25: of:=[$'Weekly Payroll Report'.$BS$158] -> 0 | Z25: of:=[$'Weekly Payroll Report'.$BU$158] -> 0 | AB25: of:=[$'Weekly Payroll Report'.$BW$158] -> 0 | AD25: of:=[$'Weekly Payroll Report'.$BY$158] -> 0 | AF25: of:=[$'Weekly Payroll Report'.$CA$158] -> 0 | AH25: of:=IF([.AD25]>0;IF([.X25]>0; [.X25]/[.AD25];1);IF([.X25]>0;1;0)) -> 0
B26: of:=[$'Weekly Payroll Report'.$AW$166] -> 21 | D26: of:=[$'Weekly Payroll Report'.$AY$166] -> 0 | F26: of:=[$'Weekly Payroll Report'.$BA$166] -> 0 | H26: of:=[$'Weekly Payroll Report'.$BC$166] -> 0 | J26: of:=[$'Weekly Payroll Report'.$BE$166] -> 0 | L26: of:=[$'Weekly Payroll Report'.$BG$166] -> 0 | N26: of:=[$'Weekly Payroll Report'.$BI$166] -> 0 | P26: of:=[$'Weekly Payroll Report'.$BK$166] -> 0 | R26: of:=[$'Weekly Payroll Report'.$BM$166] -> 0 | T26: of:=[$'Weekly Payroll Report'.$BO$166] -> 0 | V26: of:=[$'Weekly Payroll Report'.$BQ$166] -> 0 | X26: of:=[$'Weekly Payroll Report'.$BS$166] -> 0 | Z26: of:=[$'Weekly Payroll Report'.$BU$166] -> 0 | AB26: of:=[$'Weekly Payroll Report'.$BW$166] -> 0 | AD26: of:=[$'Weekly Payroll Report'.$BY$166] -> 0 | AF26: of:=[$'Weekly Payroll Report'.$CA$166] -> 0 | AH26: of:=IF([.AD26]>0;IF([.X26]>0; [.X26]/[.AD26];1);IF([.X26]>0;1;0)) -> 0
B27: of:=[$'Weekly Payroll Report'.$AW$174] -> 22 | D27: of:=[$'Weekly Payroll Report'.$AY$174] -> 0 | F27: of:=[$'Weekly Payroll Report'.$BA$174] -> 0 | H27: of:=[$'Weekly Payroll Report'.$BC$174] -> 0 | J27: of:=[$'Weekly Payroll Report'.$BE$174] -> 0 | L27: of:=[$'Weekly Payroll Report'.$BG$174] -> 0 | N27: of:=[$'Weekly Payroll Report'.$BI$174] -> 0 | P27: of:=[$'Weekly Payroll Report'.$BK$174] -> 0 | R27: of:=[$'Weekly Payroll Report'.$BM$174] -> 0 | T27: of:=[$'Weekly Payroll Report'.$BO$174] -> 0 | V27: of:=[$'Weekly Payroll Report'.$BQ$174] -> 0 | X27: of:=[$'Weekly Payroll Report'.$BS$174] -> 0 | Z27: of:=[$'Weekly Payroll Report'.$BU$174] -> 0 | AB27: of:=[$'Weekly Payroll Report'.$BW$174] -> 0 | AD27: of:=[$'Weekly Payroll Report'.$BY$174] -> 0 | AF27: of:=[$'Weekly Payroll Report'.$CA$174] -> 0 | AH27: of:=IF([.AD27]>0;IF([.X27]>0; [.X27]/[.AD27];1);IF([.X27]>0;1;0)) -> 0
B28: of:=[$'Weekly Payroll Report'.$AW$182] -> 23 | D28: of:=[$'Weekly Payroll Report'.$AY$182] -> 0 | F28: of:=[$'Weekly Payroll Report'.$BA$182] -> 0 | H28: of:=[$'Weekly Payroll Report'.$BC$182] -> 0 | J28: of:=[$'Weekly Payroll Report'.$BE$182] -> 0 | L28: of:=[$'Weekly Payroll Report'.$BG$182] -> 0 | N28: of:=[$'Weekly Payroll Report'.$BI$182] -> 0 | P28: of:=[$'Weekly Payroll Report'.$BK$182] -> 0 | R28: of:=[$'Weekly Payroll Report'.$BM$182] -> 0 | T28: of:=[$'Weekly Payroll Report'.$BO$182] -> 0 | V28: of:=[$'Weekly Payroll Report'.$BQ$182] -> 0 | X28: of:=[$'Weekly Payroll Report'.$BS$182] -> 0 | Z28: of:=[$'Weekly Payroll Report'.$BU$182] -> 0 | AB28: of:=[$'Weekly Payroll Report'.$BW$182] -> 0 | AD28: of:=[$'Weekly Payroll Report'.$BY$182] -> 0 | AF28: of:=[$'Weekly Payroll Report'.$CA$182] -> 0 | AH28: of:=IF([.AD28]>0;IF([.X28]>0; [.X28]/[.AD28];1);IF([.X28]>0;1;0)) -> 0
B29: of:=[$'Weekly Payroll Report'.$AW$190] -> 24 | D29: of:=[$'Weekly Payroll Report'.$AY$190] -> 0 | F29: of:=[$'Weekly Payroll Report'.$BA$190] -> 0 | H29: of:=[$'Weekly Payroll Report'.$BC$190] -> 0 | J29: of:=[$'Weekly Payroll Report'.$BE$190] -> 0 | L29: of:=[$'Weekly Payroll Report'.$BG$190] -> 0 | N29: of:=[$'Weekly Payroll Report'.$BI$190] -> 0 | P29: of:=[$'Weekly Payroll Report'.$BK$190] -> 0 | R29: of:=[$'Weekly Payroll Report'.$BM$190] -> 0 | T29: of:=[$'Weekly Payroll Report'.$BO$190] -> 0 | V29: of:=[$'Weekly Payroll Report'.$BQ$190] -> 0 | X29: of:=[$'Weekly Payroll Report'.$BS$190] -> 0 | Z29: of:=[$'Weekly Payroll Report'.$BU$190] -> 0 | AB29: of:=[$'Weekly Payroll Report'.$BW$190] -> 0 | AD29: of:=[$'Weekly Payroll Report'.$BY$190] -> 0 | AF29: of:=[$'Weekly Payroll Report'.$CA$190] -> 0 | AH29: of:=IF([.AD29]>0;IF([.X29]>0; [.X29]/[.AD29];1);IF([.X29]>0;1;0)) -> 0
B30: of:=[$'Weekly Payroll Report'.$AW$198] -> 25 | D30: of:=[$'Weekly Payroll Report'.$AY$198] -> 0 | F30: of:=[$'Weekly Payroll Report'.$BA$198] -> 0 | H30: of:=[$'Weekly Payroll Report'.$BC$198] -> 0 | J30: of:=[$'Weekly Payroll Report'.$BE$198] -> 0 | L30: of:=[$'Weekly Payroll Report'.$BG$198] -> 0 | N30: of:=[$'Weekly Payroll Report'.$BI$198] -> 0 | P30: of:=[$'Weekly Payroll Report'.$BK$198] -> 0 | R30: of:=[$'Weekly Payroll Report'.$BM$198] -> 0 | T30: of:=[$'Weekly Payroll Report'.$BO$198] -> 0 | V30: of:=[$'Weekly Payroll Report'.$BQ$198] -> 0 | X30: of:=[$'Weekly Payroll Report'.$BS$198] -> 0 | Z30: of:=[$'Weekly Payroll Report'.$BU$198] -> 0 | AB30: of:=[$'Weekly Payroll Report'.$BW$198] -> 0 | AD30: of:=[$'Weekly Payroll Report'.$BY$198] -> 0 | AF30: of:=[$'Weekly Payroll Report'.$CA$198] -> 0 | AH30: of:=IF([.AD30]>0;IF([.X30]>0; [.X30]/[.AD30];1);IF([.X30]>0;1;0)) -> 0
B31: of:=[$'Weekly Payroll Report'.$AW$206] -> 26 | D31: of:=[$'Weekly Payroll Report'.$AY$206] -> 0 | F31: of:=[$'Weekly Payroll Report'.$BA$206] -> 0 | H31: of:=[$'Weekly Payroll Report'.$BC$206] -> 0 | J31: of:=[$'Weekly Payroll Report'.$BE$206] -> 0 | L31: of:=[$'Weekly Payroll Report'.$BG$206] -> 0 | N31: of:=[$'Weekly Payroll Report'.$BI$206] -> 0 | P31: of:=[$'Weekly Payroll Report'.$BK$206] -> 0 | R31: of:=[$'Weekly Payroll Report'.$BM$206] -> 0 | T31: of:=[$'Weekly Payroll Report'.$BO$206] -> 0 | V31: of:=[$'Weekly Payroll Report'.$BQ$206] -> 0 | X31: of:=[$'Weekly Payroll Report'.$BS$206] -> 0 | Z31: of:=[$'Weekly Payroll Report'.$BU$206] -> 0 | AB31: of:=[$'Weekly Payroll Report'.$BW$206] -> 0 | AD31: of:=[$'Weekly Payroll Report'.$BY$206] -> 0 | AF31: of:=[$'Weekly Payroll Report'.$CA$206] -> 0 | AH31: of:=IF([.AD31]>0;IF([.X31]>0; [.X31]/[.AD31];1);IF([.X31]>0;1;0)) -> 0
B32: of:=[$'Weekly Payroll Report'.$AW$214] -> 27 | D32: of:=[$'Weekly Payroll Report'.$AY$214] -> 0 | F32: of:=[$'Weekly Payroll Report'.$BA$214] -> 0 | H32: of:=[$'Weekly Payroll Report'.$BC$214] -> 0 | J32: of:=[$'Weekly Payroll Report'.$BE$214] -> 0 | L32: of:=[$'Weekly Payroll Report'.$BG$214] -> 0 | N32: of:=[$'Weekly Payroll Report'.$BI$214] -> 0 | P32: of:=[$'Weekly Payroll Report'.$BK$214] -> 0 | R32: of:=[$'Weekly Payroll Report'.$BM$214] -> 0 | T32: of:=[$'Weekly Payroll Report'.$BO$214] -> 0 | V32: of:=[$'Weekly Payroll Report'.$BQ$214] -> 0 | X32: of:=[$'Weekly Payroll Report'.$BS$214] -> 0 | Z32: of:=[$'Weekly Payroll Report'.$BU$214] -> 0 | AB32: of:=[$'Weekly Payroll Report'.$BW$214] -> 0 | AD32: of:=[$'Weekly Payroll Report'.$BY$214] -> 0 | AF32: of:=[$'Weekly Payroll Report'.$CA$214] -> 0 | AH32: of:=IF([.AD32]>0;IF([.X32]>0; [.X32]/[.AD32];1);IF([.X32]>0;1;0)) -> 0
B33: of:=[$'Weekly Payroll Report'.$AW$222] -> 28 | D33: of:=[$'Weekly Payroll Report'.$AY$222] -> 0 | F33: of:=[$'Weekly Payroll Report'.$BA$222] -> 0 | H33: of:=[$'Weekly Payroll Report'.$BC$222] -> 0 | J33: of:=[$'Weekly Payroll Report'.$BE$222] -> 0 | L33: of:=[$'Weekly Payroll Report'.$BG$222] -> 0 | N33: of:=[$'Weekly Payroll Report'.$BI$222] -> 0 | P33: of:=[$'Weekly Payroll Report'.$BK$222] -> 0 | R33: of:=[$'Weekly Payroll Report'.$BM$222] -> 0 | T33: of:=[$'Weekly Payroll Report'.$BO$222] -> 0 | V33: of:=[$'Weekly Payroll Report'.$BQ$222] -> 0 | X33: of:=[$'Weekly Payroll Report'.$BS$222] -> 0 | Z33: of:=[$'Weekly Payroll Report'.$BU$222] -> 0 | AB33: of:=[$'Weekly Payroll Report'.$BW$222] -> 0 | AD33: of:=[$'Weekly Payroll Report'.$BY$222] -> 0 | AF33: of:=[$'Weekly Payroll Report'.$CA$222] -> 0 | AH33: of:=IF([.AD33]>0;IF([.X33]>0; [.X33]/[.AD33];1);IF([.X33]>0;1;0)) -> 0
B34: of:=[$'Weekly Payroll Report'.$AW$230] -> 29 | D34: of:=[$'Weekly Payroll Report'.$AY$230] -> 0 | F34: of:=[$'Weekly Payroll Report'.$BA$230] -> 0 | H34: of:=[$'Weekly Payroll Report'.$BC$230] -> 0 | J34: of:=[$'Weekly Payroll Report'.$BE$230] -> 0 | L34: of:=[$'Weekly Payroll Report'.$BG$230] -> 0 | N34: of:=[$'Weekly Payroll Report'.$BI$230] -> 0 | P34: of:=[$'Weekly Payroll Report'.$BK$230] -> 0 | R34: of:=[$'Weekly Payroll Report'.$BM$230] -> 0 | T34: of:=[$'Weekly Payroll Report'.$BO$230] -> 0 | V34: of:=[$'Weekly Payroll Report'.$BQ$230] -> 0 | X34: of:=[$'Weekly Payroll Report'.$BS$230] -> 0 | Z34: of:=[$'Weekly Payroll Report'.$BU$230] -> 0 | AB34: of:=[$'Weekly Payroll Report'.$BW$230] -> 0 | AD34: of:=[$'Weekly Payroll Report'.$BY$230] -> 0 | AF34: of:=[$'Weekly Payroll Report'.$CA$230] -> 0 | AH34: of:=IF([.AD34]>0;IF([.X34]>0; [.X34]/[.AD34];1);IF([.X34]>0;1;0)) -> 0
B35: of:=[$'Weekly Payroll Report'.$AW$238] -> 30 | D35: of:=[$'Weekly Payroll Report'.$AY$238] -> 0 | F35: of:=[$'Weekly Payroll Report'.$BA$238] -> 0 | H35: of:=[$'Weekly Payroll Report'.$BC$238] -> 0 | J35: of:=[$'Weekly Payroll Report'.$BE$238] -> 0 | L35: of:=[$'Weekly Payroll Report'.$BG$238] -> 0 | N35: of:=[$'Weekly Payroll Report'.$BI$238] -> 0 | P35: of:=[$'Weekly Payroll Report'.$BK$238] -> 0 | R35: of:=[$'Weekly Payroll Report'.$BM$238] -> 0 | T35: of:=[$'Weekly Payroll Report'.$BO$238] -> 0 | V35: of:=[$'Weekly Payroll Report'.$BQ$238] -> 0 | X35: of:=[$'Weekly Payroll Report'.$BS$238] -> 0 | Z35: of:=[$'Weekly Payroll Report'.$BU$238] -> 0 | AB35: of:=[$'Weekly Payroll Report'.$BW$238] -> 0 | AD35: of:=[$'Weekly Payroll Report'.$BY$238] -> 0 | AF35: of:=[$'Weekly Payroll Report'.$CA$238] -> 0 | AH35: of:=IF([.AD35]>0;IF([.X35]>0; [.X35]/[.AD35];1);IF([.X35]>0;1;0)) -> 0
B36: of:=[$'Weekly Payroll Report'.$AW$246] -> 31 | D36: of:=[$'Weekly Payroll Report'.$AY$246] -> 0 | F36: of:=[$'Weekly Payroll Report'.$BA$246] -> 0 | H36: of:=[$'Weekly Payroll Report'.$BC$246] -> 0 | J36: of:=[$'Weekly Payroll Report'.$BE$246] -> 0 | L36: of:=[$'Weekly Payroll Report'.$BG$246] -> 0 | N36: of:=[$'Weekly Payroll Report'.$BI$246] -> 0 | P36: of:=[$'Weekly Payroll Report'.$BK$246] -> 0 | R36: of:=[$'Weekly Payroll Report'.$BM$246] -> 0 | T36: of:=[$'Weekly Payroll Report'.$BO$246] -> 0 | V36: of:=[$'Weekly Payroll Report'.$BQ$246] -> 0 | X36: of:=[$'Weekly Payroll Report'.$BS$246] -> 0 | Z36: of:=[$'Weekly Payroll Report'.$BU$246] -> 0 | AB36: of:=[$'Weekly Payroll Report'.$BW$246] -> 0 | AD36: of:=[$'Weekly Payroll Report'.$BY$246] -> 0 | AF36: of:=[$'Weekly Payroll Report'.$CA$246] -> 0 | AH36: of:=IF([.AD36]>0;IF([.X36]>0; [.X36]/[.AD36];1);IF([.X36]>0;1;0)) -> 0
B37: of:=[$'Weekly Payroll Report'.$AW$254] -> 32 | D37: of:=[$'Weekly Payroll Report'.$AY$254] -> 0 | F37: of:=[$'Weekly Payroll Report'.$BA$254] -> 0 | H37: of:=[$'Weekly Payroll Report'.$BC$254] -> 0 | J37: of:=[$'Weekly Payroll Report'.$BE$254] -> 0 | L37: of:=[$'Weekly Payroll Report'.$BG$254] -> 0 | N37: of:=[$'Weekly Payroll Report'.$BI$254] -> 0 | P37: of:=[$'Weekly Payroll Report'.$BK$254] -> 0 | R37: of:=[$'Weekly Payroll Report'.$BM$254] -> 0 | T37: of:=[$'Weekly Payroll Report'.$BO$254] -> 0 | V37: of:=[$'Weekly Payroll Report'.$BQ$254] -> 0 | X37: of:=[$'Weekly Payroll Report'.$BS$254] -> 0 | Z37: of:=[$'Weekly Payroll Report'.$BU$254] -> 0 | AB37: of:=[$'Weekly Payroll Report'.$BW$254] -> 0 | AD37: of:=[$'Weekly Payroll Report'.$BY$254] -> 0 | AF37: of:=[$'Weekly Payroll Report'.$CA$254] -> 0 | AH37: of:=IF([.AD37]>0;IF([.X37]>0; [.X37]/[.AD37];1);IF([.X37]>0;1;0)) -> 0
F38: of:=SUM([.F6:.F37]) -> 270.5 | H38: of:=SUM([.H6:.H37]) -> 6769.33630777208 | J38: of:=SUM([.J6:.J37]) -> 70 | L38: of:=SUM([.L6:.L37]) -> 36 | N38: of:=SUM([.N6:.N37]) -> 1025.66369222792 | P38: of:=SUM([.P6:.P37]) -> 0 | R38: of:=SUM([.R6:.R37]) -> 0 | T38: of:=SUM([.T6:.T37]) -> 0 | V38: of:=SUM([.V6:.V37]) -> 0 | X38: of:=SUM([.X6:.X37]) -> 7865 | Z38: of:=SUM([.Z6:.Z37]) -> 70 | AB38: of:=SUM([.AB6:.AB37]) -> 70 | AD38: of:=SUM([.AD6:.AD37]) -> 26807.6 | AF38: of:=SUM([.AF6:.AF37]) -> 7865 | AH38: of:=IF([.AD38]>0;IF([.X38]>0; [.X38]/[.AD38];1);IF([.X38]>0;1;0)) -> 0.293386949969412